"user_id","status_id","created_at","screen_name","text","source","display_text_width","reply_to_status_id","reply_to_user_id","reply_to_screen_name","is_quote","is_retweet","favorite_count","retweet_count","quote_count","reply_count","hashtags","symbols","urls_url","urls_t.co","urls_expanded_url","media_url","media_t.co","media_expanded_url","media_type","ext_media_url","ext_media_t.co","ext_media_expanded_url","ext_media_type","mentions_user_id","mentions_screen_name","lang","quoted_status_id","quoted_text","quoted_created_at","quoted_source","quoted_favorite_count","quoted_retweet_count","quoted_user_id","quoted_screen_name","quoted_name","quoted_followers_count","quoted_friends_count","quoted_statuses_count","quoted_location","quoted_description","quoted_verified","retweet_status_id","retweet_text","retweet_created_at","retweet_source","retweet_favorite_count","retweet_retweet_count","retweet_user_id","retweet_screen_name","retweet_name","retweet_followers_count","retweet_friends_count","retweet_statuses_count","retweet_location","retweet_description","retweet_verified","place_url","place_name","place_full_name","place_type","country","country_code","geo_coords","coords_coords","bbox_coords","status_url","name","location","description","url","protected","followers_count","friends_count","listed_count","statuses_count","favourites_count","account_created_at","verified","profile_url","profile_expanded_url","account_lang","profile_banner_url","profile_background_url","profile_image_url"
"757659945487728640","1490825546682421249","2022-02-07 23:11:23","32BeatWriters","Saints have informed their defensive coordinator Dennis Allen that they are hiring him as their next head coach, sources tell ESPN.

Once again Allen replaces Sean Payton, minus the interim title.","Twitter for iPhone",139,,,,false,true,0,2727,,,"","","","","","","","","","","","",,"","","en",,,,,,,,,,,,,,,,"1490825417569148933","Saints have informed their defensive coordinator Dennis Allen that they are hiring him as their next head coach, sources tell ESPN.

Once again Allen replaces Sean Payton, minus the interim title.","2022-02-07 23:10:52","Twitter for iPhone",17747,2727,"51263592","AdamSchefter","Adam Schefter",9108978,3519,58887,"New York","ESPN Senior NFL Insider. 
Interview & Podcast Requests: ESPNPR@espn.com
Host of the Adam Schefter Podcast
https://t.co/oz43ix5jZU",true,,,,,,,"","","","https://twitter.com/32BeatWriters/status/1490825546682421249","NFL Beat Writers","Training camp","We follow all 32 NFL teams' beat writers so you don't have to. Follow us to help win your fantasy football league. https://t.co/KK0FOK2MQ1","https://t.co/IJHGG4qFGm",false,44239,782,1340,24006,1569,"2016-07-25 19:33:02",false,"https://t.co/IJHGG4qFGm","https://www.patreon.com/32beatwriters",,"https://pbs.twimg.com/profile_banners/757659945487728640/1597874950",,"http://pbs.twimg.com/profile_images/1484327856905674762/a3aIBH4E_normal.jpg"
