"user_id","status_id","created_at","screen_name","text","source","display_text_width","reply_to_status_id","reply_to_user_id","reply_to_screen_name","is_quote","is_retweet","favorite_count","retweet_count","quote_count","reply_count","hashtags","symbols","urls_url","urls_t.co","urls_expanded_url","media_url","media_t.co","media_expanded_url","media_type","ext_media_url","ext_media_t.co","ext_media_expanded_url","ext_media_type","mentions_user_id","mentions_screen_name","lang","quoted_status_id","quoted_text","quoted_created_at","quoted_source","quoted_favorite_count","quoted_retweet_count","quoted_user_id","quoted_screen_name","quoted_name","quoted_followers_count","quoted_friends_count","quoted_statuses_count","quoted_location","quoted_description","quoted_verified","retweet_status_id","retweet_text","retweet_created_at","retweet_source","retweet_favorite_count","retweet_retweet_count","retweet_user_id","retweet_screen_name","retweet_name","retweet_followers_count","retweet_friends_count","retweet_statuses_count","retweet_location","retweet_description","retweet_verified","place_url","place_name","place_full_name","place_type","country","country_code","geo_coords","coords_coords","bbox_coords","status_url","name","location","description","url","protected","followers_count","friends_count","listed_count","statuses_count","favourites_count","account_created_at","verified","profile_url","profile_expanded_url","account_lang","profile_banner_url","profile_background_url","profile_image_url"
"757659945487728640","1456585563969134594","2021-11-05 11:33:55","32BeatWriters","Today is Odell Beckham Jr.’s 29th birthday.","Twitter for iPhone",61,,,,false,true,0,606,,,"","","","","","","","","","","","",,"","","en",,,,,,,,,,,,,,,,"1456581064923697152","Today is Odell Beckham Jr.’s 29th birthday.","2021-11-05 11:16:02","Twitter for iPhone",6657,606,"51263592","AdamSchefter","Adam Schefter",8694812,3463,56884,"New York","ESPN Senior NFL Insider. 
Interview & Podcast Requests: ESPNPR@espn.com
Host of the Adam Schefter Podcast
https://t.co/oz43ix5jZU",true,,,,,,,"","","","https://twitter.com/32BeatWriters/status/1456585563969134594","NFL Beat Writers","Training camp","We follow all 32 NFL teams' beat writers so you don't have to. Follow us to help win your fantasy football league. https://t.co/KK0FOK2MQ1","https://t.co/IJHGG4qFGm",false,44256,762,1319,22934,1433,"2016-07-25 19:33:02",false,"https://t.co/IJHGG4qFGm","https://www.patreon.com/32beatwriters",,"https://pbs.twimg.com/profile_banners/757659945487728640/1597874950",,"http://pbs.twimg.com/profile_images/1438327029976424451/eBZhywAU_normal.jpg"
"757659945487728640","1456466770835955714","2021-11-05 03:41:52","32BeatWriters","Here's 90 seconds of Adrian Peterson at #Titans practice today. https://t.co/itQ4fQjTPa","Twitter for iPhone",107,,,,false,true,0,46,,,"","","","","","","","","","","","",,"","","en",,,,,,,,,,,,,,,,"1456335181577703433","Here's 90 seconds of Adrian Peterson at #Titans practice today. https://t.co/itQ4fQjTPa","2021-11-04 18:58:59","Twitter for Android",459,46,"41814795","TDavenport_NFL","TURRON DAVENPORT",34730,1823,147264,"Philly 🛫 Nashville","💻ESPN NFL Nation reporter covering the Tennessee Titans |  🗣️🎙️Talking w/TD | 🏈Member Pro Football Writers Association | 🙏🏾Heb 11:1 Believe it!",true,,,,,,,"","","","https://twitter.com/32BeatWriters/status/1456466770835955714","NFL Beat Writers","Training camp","We follow all 32 NFL teams' beat writers so you don't have to. Follow us to help win your fantasy football league. https://t.co/KK0FOK2MQ1","https://t.co/IJHGG4qFGm",false,44256,762,1319,22934,1433,"2016-07-25 19:33:02",false,"https://t.co/IJHGG4qFGm","https://www.patreon.com/32beatwriters",,"https://pbs.twimg.com/profile_banners/757659945487728640/1597874950",,"http://pbs.twimg.com/profile_images/1438327029976424451/eBZhywAU_normal.jpg"
"757659945487728640","1456465596711849984","2021-11-05 03:37:12","32BeatWriters","With the obvious caveat that plans can change, the Browns currently plan to release Odell Beckham Jr. on Friday. The move hinges on an agreement to reduce the money the Browns would owe him if he's not claimed on waivers. https://t.co/1qrFkRvPrl","Twitter for iPhone",140,,,,false,true,0,541,,,"","","","","","","","","","","","",,"","","en",,,,,,,,,,,,,,,,"1456464862046007308","With the obvious caveat that plans can change, the Browns currently plan to release Odell Beckham Jr. on Friday. The move hinges on an agreement to reduce the money the Browns would owe him if he's not claimed on waivers. https://t.co/1qrFkRvPrl","2021-11-05 03:34:17","Twitter Web App",1652,541,"16672159","ProFootballTalk","ProFootballTalk",1685357,295,258892,"","© 2021 https://t.co/otR2g1vnYL & Football Talk, LLC. All Rights Reserved.",true,,,,,,,"","","","https://twitter.com/32BeatWriters/status/1456465596711849984","NFL Beat Writers","Training camp","We follow all 32 NFL teams' beat writers so you don't have to. Follow us to help win your fantasy football league. https://t.co/KK0FOK2MQ1","https://t.co/IJHGG4qFGm",false,44256,762,1319,22934,1433,"2016-07-25 19:33:02",false,"https://t.co/IJHGG4qFGm","https://www.patreon.com/32beatwriters",,"https://pbs.twimg.com/profile_banners/757659945487728640/1597874950",,"http://pbs.twimg.com/profile_images/1438327029976424451/eBZhywAU_normal.jpg"
"757659945487728640","1456465048742866949","2021-11-05 03:35:02","32BeatWriters","Love Johnson’s competitiveness after he threw that interception.","Twitter for iPhone",64,,,,false,false,27,1,,,"","","","","","","","","","","","",,"","","en",,,,,,,,,,,,,,,,,,,,,,,,,,,,,,,,,,,,,"","","","https://twitter.com/32BeatWriters/status/1456465048742866949","NFL Beat Writers","Training camp","We follow all 32 NFL teams' beat writers so you don't have to. Follow us to help win your fantasy football league. https://t.co/KK0FOK2MQ1","https://t.co/IJHGG4qFGm",false,44256,762,1319,22934,1433,"2016-07-25 19:33:02",false,"https://t.co/IJHGG4qFGm","https://www.patreon.com/32beatwriters",,"https://pbs.twimg.com/profile_banners/757659945487728640/1597874950",,"http://pbs.twimg.com/profile_images/1438327029976424451/eBZhywAU_normal.jpg"
"757659945487728640","1456395863631310855","2021-11-04 23:00:07","32BeatWriters","No Corey Davis for the #Jets. No WR RB Marlon Mack or WR T.Y. Hilton for the #Colts https://t.co/KLvNYdNanc","Twitter for iPhone",97,,,,false,true,0,77,,,"","","","","","","","","","","","",,"","","en",,,,,,,,,,,,,,,,"1456395805078790149","No Corey Davis for the #Jets. No WR RB Marlon Mack or WR T.Y. Hilton for the #Colts https://t.co/KLvNYdNanc","2021-11-04 22:59:53","Twitter for iPhone",612,77,"16403943","RapSheet","Ian Rapoport",2930075,721,150206,"New York","National Insider for NFL Network and https://t.co/NIVZ6FP1b6. Husband of @thebanktress.",true,,,,,,,"","","","https://twitter.com/32BeatWriters/status/1456395863631310855","NFL Beat Writers","Training camp","We follow all 32 NFL teams' beat writers so you don't have to. Follow us to help win your fantasy football league. https://t.co/KK0FOK2MQ1","https://t.co/IJHGG4qFGm",false,44256,762,1319,22934,1433,"2016-07-25 19:33:02",false,"https://t.co/IJHGG4qFGm","https://www.patreon.com/32beatwriters",,"https://pbs.twimg.com/profile_banners/757659945487728640/1597874950",,"http://pbs.twimg.com/profile_images/1438327029976424451/eBZhywAU_normal.jpg"
"757659945487728640","1456357751966347267","2021-11-04 20:28:40","32BeatWriters","#Cowboys QB Dak Prescott was officially a full participant in practice today and remains on track to start Sunday vs. the #Broncos.

Meanwhile, WR CeeDee Lamb -- who sprained an ankle Wednesday -- did not participate. One to monitor.","Twitter for iPhone",140,,,,false,true,0,64,,,"","","","","","","","","","","","",,"","","en",,,,,,,,,,,,,,,,"1456357606944038922","#Cowboys QB Dak Prescott was officially a full participant in practice today and remains on track to start Sunday vs. the #Broncos.

Meanwhile, WR CeeDee Lamb -- who sprained an ankle Wednesday -- did not participate. One to monitor.","2021-11-04 20:28:05","TweetDeck",359,64,"36089053","TomPelissero","Tom Pelissero",343133,1273,75782,"","Reporter, @NFLNetwork. Host, @SiriusXMNFL. Husband, @SaraPelissero. Dad, the best girls ever.",true,,,,,,,"","","","https://twitter.com/32BeatWriters/status/1456357751966347267","NFL Beat Writers","Training camp","We follow all 32 NFL teams' beat writers so you don't have to. Follow us to help win your fantasy football league. https://t.co/KK0FOK2MQ1","https://t.co/IJHGG4qFGm",false,44256,762,1319,22934,1433,"2016-07-25 19:33:02",false,"https://t.co/IJHGG4qFGm","https://www.patreon.com/32beatwriters",,"https://pbs.twimg.com/profile_banners/757659945487728640/1597874950",,"http://pbs.twimg.com/profile_images/1438327029976424451/eBZhywAU_normal.jpg"
"757659945487728640","1456320224672862216","2021-11-04 17:59:33","32BeatWriters","Cowboys WR Michael Gallup (calf) is practicing for second week on IR. Mike McCarthy: ""Just want to see him get through a full week and then evaluate it. I thought he had a really good week last week, so we'll just see how it goes. We're kind of up in the air on where he is.""","Twitter for iPhone",140,,,,false,true,0,33,,,"","","","","","","","","","","","",,"","","en",,,,,,,,,,,,,,,,"1456283837361754115","Cowboys WR Michael Gallup (calf) is practicing for second week on IR. Mike McCarthy: ""Just want to see him get through a full week and then evaluate it. I thought he had a really good week last week, so we'll just see how it goes. We're kind of up in the air on where he is.""","2021-11-04 15:34:57","Twitter Web App",324,33,"120019718","GehlkenNFL","Michael Gehlken",51200,330,30248,"","Cowboys reporter for the Dallas Morning News. Formerly covered NFL teams in San Diego and Oakland.",true,,,,,,,"","","","https://twitter.com/32BeatWriters/status/1456320224672862216","NFL Beat Writers","Training camp","We follow all 32 NFL teams' beat writers so you don't have to. Follow us to help win your fantasy football league. https://t.co/KK0FOK2MQ1","https://t.co/IJHGG4qFGm",false,44256,762,1319,22934,1433,"2016-07-25 19:33:02",false,"https://t.co/IJHGG4qFGm","https://www.patreon.com/32beatwriters",,"https://pbs.twimg.com/profile_banners/757659945487728640/1597874950",,"http://pbs.twimg.com/profile_images/1438327029976424451/eBZhywAU_normal.jpg"
"757659945487728640","1456253241977679872","2021-11-04 13:33:23","32BeatWriters","#Browns WR Odell Beckham will be excused from practice again today, source says. We'll see where this goes but talks continue.","Twitter for iPhone",140,,,,false,true,0,413,,,"","","","","","","","","","","","",,"","","en",,,,,,,,,,,,,,,,"1456247893527076865","#Browns WR Odell Beckham will be excused from practice again today, source says. We'll see where this goes but talks continue.","2021-11-04 13:12:08","TweetDeck",3334,413,"12513132","MikeGarafolo","Mike Garafolo",361824,987,84721,"NY/NJ","Reporter, NFL Network. Co-host @GMFB Weekend. Distant cousin of @JimmyG_10. No relation to Pep Guardiola. IG: mike_garafolo",true,,,,,,,"","","","https://twitter.com/32BeatWriters/status/1456253241977679872","NFL Beat Writers","Training camp","We follow all 32 NFL teams' beat writers so you don't have to. Follow us to help win your fantasy football league. https://t.co/KK0FOK2MQ1","https://t.co/IJHGG4qFGm",false,44256,762,1319,22934,1433,"2016-07-25 19:33:02",false,"https://t.co/IJHGG4qFGm","https://www.patreon.com/32beatwriters",,"https://pbs.twimg.com/profile_banners/757659945487728640/1597874950",,"http://pbs.twimg.com/profile_images/1438327029976424451/eBZhywAU_normal.jpg"
"757659945487728640","1456020437062889478","2021-11-03 22:08:18","32BeatWriters",".@AlbertBreer on @BullandFox: ""Having talked to some people who were in the room for Kevin (Stefanski) and what he said to the team, the sentiment that I got was 'be prepared for Odell not to be part of the team the rest of the year'.""  #Browns","Twitter for iPhone",140,,,,false,true,0,39,,,"","","","","","","","","","","","",,"","","en",,,,,,,,,,,,,,,,"1456017181255376899",".@AlbertBreer on @BullandFox: ""Having talked to some people who were in the room for Kevin (Stefanski) and what he said to the team, the sentiment that I got was 'be prepared for Odell not to be part of the team the rest of the year'.""  #Browns","2021-11-03 21:55:22","TweetDeck",179,39,"363633553","KeithBritton86","Keith Britton",16907,839,32169,"Cleveland","Assistant Brand Manager @923TheFan. @HeismanTrophy Voter.",true,,,,,,,"","","","https://twitter.com/32BeatWriters/status/1456020437062889478","NFL Beat Writers","Training camp","We follow all 32 NFL teams' beat writers so you don't have to. Follow us to help win your fantasy football league. https://t.co/KK0FOK2MQ1","https://t.co/IJHGG4qFGm",false,44256,762,1319,22934,1433,"2016-07-25 19:33:02",false,"https://t.co/IJHGG4qFGm","https://www.patreon.com/32beatwriters",,"https://pbs.twimg.com/profile_banners/757659945487728640/1597874950",,"http://pbs.twimg.com/profile_images/1438327029976424451/eBZhywAU_normal.jpg"
"757659945487728640","1456000116716933120","2021-11-03 20:47:33","32BeatWriters","Injury updates from Sean McVay (1/2): 

Robert Woods (foot) and Matthew Stafford (back) won't practice today, but doesn't expect to affect their game statuses. 

Andrew Whitworth (knee) will rest today, Sebastian Joseph-Day (pec) will be limited; both expected to return.","Twitter for iPhone",140,,,,false,true,0,8,,,"","","","","","","","","","","","",,"","","en",,,,,,,,,,,,,,,,"1455996843184168960","Injury updates from Sean McVay (1/2): 

Robert Woods (foot) and Matthew Stafford (back) won't practice today, but doesn't expect to affect their game statuses. 

Andrew Whitworth (knee) will rest today, Sebastian Joseph-Day (pec) will be limited; both expected to return.","2021-11-03 20:34:33","TweetDeck",31,8,"25681875","StuJRams","Stu Jackson",6095,1018,37272,"Los Angeles","Staff writer @RamsNFL. Views are my own and do not represent the team’s.",true,,,,,,,"","","","https://twitter.com/32BeatWriters/status/1456000116716933120","NFL Beat Writers","Training camp","We follow all 32 NFL teams' beat writers so you don't have to. Follow us to help win your fantasy football league. https://t.co/KK0FOK2MQ1","https://t.co/IJHGG4qFGm",false,44256,762,1319,22934,1433,"2016-07-25 19:33:02",false,"https://t.co/IJHGG4qFGm","https://www.patreon.com/32beatwriters",,"https://pbs.twimg.com/profile_banners/757659945487728640/1597874950",,"http://pbs.twimg.com/profile_images/1438327029976424451/eBZhywAU_normal.jpg"
"757659945487728640","1455994261544046600","2021-11-03 20:24:17","32BeatWriters","With the departure of DeSean Jackson and Tutu Atwell being placed on injured reserve, Sean McVay says they will find depth with rookie Jacob Harris, who should be listed as a WR not TE, rookie Ben Skowronek and JJ Koski, who was signed today from the practice squad.","Twitter for iPhone",140,,,,false,true,0,22,,,"","","","","","","","","","","","",,"","","en",,,,,,,,,,,,,,,,"1455994155981697026","With the departure of DeSean Jackson and Tutu Atwell being placed on injured reserve, Sean McVay says they will find depth with rookie Jacob Harris, who should be listed as a WR not TE, rookie Ben Skowronek and JJ Koski, who was signed today from the practice squad.","2021-11-03 20:23:52","Twitter Web App",182,22,"30142826","LindseyThiry","Lindsey Thiry",46276,1141,41801,"Los Angeles","ESPN. NFL. LA. IG: LindseyThiry",true,,,,,,,"","","","https://twitter.com/32BeatWriters/status/1455994261544046600","NFL Beat Writers","Training camp","We follow all 32 NFL teams' beat writers so you don't have to. Follow us to help win your fantasy football league. https://t.co/KK0FOK2MQ1","https://t.co/IJHGG4qFGm",false,44256,762,1319,22934,1433,"2016-07-25 19:33:02",false,"https://t.co/IJHGG4qFGm","https://www.patreon.com/32beatwriters",,"https://pbs.twimg.com/profile_banners/757659945487728640/1597874950",,"http://pbs.twimg.com/profile_images/1438327029976424451/eBZhywAU_normal.jpg"
"757659945487728640","1455993494024110090","2021-11-03 20:21:14","32BeatWriters","Tua Tagovailoa (ribs/left finger) was limited in Miami Dolphins practice today","Twitter for iPhone",92,,,,false,true,0,12,,,"","","","","","","","","","","","",,"","","en",,,,,,,,,,,,,,,,"1455991083897442305","Tua Tagovailoa (ribs/left finger) was limited in Miami Dolphins practice today","2021-11-03 20:11:40","Twitter for iPhone",77,12,"19785801","schadjoe","Joe Schad",230576,23771,39444,"Parkland, FL","Miami Dolphins journalist for Palm Beach Post. Previously ESPN, Orlando Sentinel, Newsday. Tips/Ideas: jschad@pbpost.com https://t.co/20zHJcYV1e",true,,,,,,,"","","","https://twitter.com/32BeatWriters/status/1455993494024110090","NFL Beat Writers","Training camp","We follow all 32 NFL teams' beat writers so you don't have to. Follow us to help win your fantasy football league. https://t.co/KK0FOK2MQ1","https://t.co/IJHGG4qFGm",false,44256,762,1319,22934,1433,"2016-07-25 19:33:02",false,"https://t.co/IJHGG4qFGm","https://www.patreon.com/32beatwriters",,"https://pbs.twimg.com/profile_banners/757659945487728640/1597874950",,"http://pbs.twimg.com/profile_images/1438327029976424451/eBZhywAU_normal.jpg"
"757659945487728640","1455993322015690761","2021-11-03 20:20:33","32BeatWriters","https://t.co/fCKyHw3QWA https://t.co/oBpa1QwLJe","Twitter for iPhone",23,,,,true,false,71,6,,,"","","","","","","","","","","","",,"","","und","1455981935487078403","Aaron Jones on the Chiefs: ""They have a great defense.""","2021-11-03 19:35:18","TweetDeck",1097,48,"1087647560","mattschneidman","Matt Schneidman",44456,682,31425,"Green Bay","Green Bay Packers beat writer for The Athletic • Podcast: Head of the Pack • @dailyorange alum • mschneidman@theathletic.com",true,,,,,,,,,,,,,,,,,,,,,,"","","","https://twitter.com/32BeatWriters/status/1455993322015690761","NFL Beat Writers","Training camp","We follow all 32 NFL teams' beat writers so you don't have to. Follow us to help win your fantasy football league. https://t.co/KK0FOK2MQ1","https://t.co/IJHGG4qFGm",false,44256,762,1319,22934,1433,"2016-07-25 19:33:02",false,"https://t.co/IJHGG4qFGm","https://www.patreon.com/32beatwriters",,"https://pbs.twimg.com/profile_banners/757659945487728640/1597874950",,"http://pbs.twimg.com/profile_images/1438327029976424451/eBZhywAU_normal.jpg"
"757659945487728640","1455967797561995268","2021-11-03 18:39:08","32BeatWriters","Terrace Marshall was a full participant in practice today. 

Sam Darnold was limited with a concussion.","Twitter for iPhone",122,,,,false,true,0,7,,,"","","","","","","","","","","","",,"","","en",,,,,,,,,,,,,,,,"1455966555863408653","Terrace Marshall was a full participant in practice today. 

Sam Darnold was limited with a concussion.","2021-11-03 18:34:12","Twitter Web App",36,7,"114886151","jonmalexander","Jonathan M Alexander",7751,1502,46178,"Charlotte, NC","Carolina Panthers beat writer for @theobserver | Raised in the QC 👑| @NABJsports | @NCCU 🦅 alumnus | previous stop: @newsobserver",true,,,,,,,"","","","https://twitter.com/32BeatWriters/status/1455967797561995268","NFL Beat Writers","Training camp","We follow all 32 NFL teams' beat writers so you don't have to. Follow us to help win your fantasy football league. https://t.co/KK0FOK2MQ1","https://t.co/IJHGG4qFGm",false,44256,762,1319,22934,1433,"2016-07-25 19:33:02",false,"https://t.co/IJHGG4qFGm","https://www.patreon.com/32beatwriters",,"https://pbs.twimg.com/profile_banners/757659945487728640/1597874950",,"http://pbs.twimg.com/profile_images/1438327029976424451/eBZhywAU_normal.jpg"
"757659945487728640","1455967766754770944","2021-11-03 18:39:00","32BeatWriters","Christian McCaffrey was ""pretty limited"" today in practice and Sam Darnold was ""extremely limited,"" per Panthers HC Matt Rhule.

Darnold is still completing concussion protocol.","Twitter for iPhone",140,,,,false,true,0,8,,,"","","","","","","","","","","","",,"","","en",,,,,,,,,,,,,,,,"1455967034039324682","Christian McCaffrey was ""pretty limited"" today in practice and Sam Darnold was ""extremely limited,"" per Panthers HC Matt Rhule.

Darnold is still completing concussion protocol.","2021-11-03 18:36:06","TweetDeck",19,8,"2868106332","_AndrewCallahan","Andrew Callahan",8896,965,39980,"Boston, MA","Patriots beat writer @BostonHerald. Rule No. 76: No excuses, play like a champion.",false,,,,,,,"","","","https://twitter.com/32BeatWriters/status/1455967766754770944","NFL Beat Writers","Training camp","We follow all 32 NFL teams' beat writers so you don't have to. Follow us to help win your fantasy football league. https://t.co/KK0FOK2MQ1","https://t.co/IJHGG4qFGm",false,44256,762,1319,22934,1433,"2016-07-25 19:33:02",false,"https://t.co/IJHGG4qFGm","https://www.patreon.com/32beatwriters",,"https://pbs.twimg.com/profile_banners/757659945487728640/1597874950",,"http://pbs.twimg.com/profile_images/1438327029976424451/eBZhywAU_normal.jpg"
"757659945487728640","1455967756013096960","2021-11-03 18:38:58","32BeatWriters","I asked Kliff Kingsbury if he's thought about sitting down with Kyler Murray and telling him to sit this week out to further rest the sprained ankle.

""Do you wanna have that conversation with him?,"" Kingsbury asked. ""Me neither.”","Twitter for iPhone",140,,,,false,true,0,6,,,"","","","","","","","","","","","",,"","","en",,,,,,,,,,,,,,,,"1455966554059771904","I asked Kliff Kingsbury if he's thought about sitting down with Kyler Murray and telling him to sit this week out to further rest the sprained ankle.

""Do you wanna have that conversation with him?,"" Kingsbury asked. ""Me neither.”","2021-11-03 18:34:11","Twitter Web App",52,6,"349749823","azbobbymac","Bob McManaman",9379,1403,18721,"Phoenix, Arizona","Senior Sportswriter for The Arizona Republic. I cover the Arizona Cardinals and the NFL.",true,,,,,,,"","","","https://twitter.com/32BeatWriters/status/1455967756013096960","NFL Beat Writers","Training camp","We follow all 32 NFL teams' beat writers so you don't have to. Follow us to help win your fantasy football league. https://t.co/KK0FOK2MQ1","https://t.co/IJHGG4qFGm",false,44256,762,1319,22934,1433,"2016-07-25 19:33:02",false,"https://t.co/IJHGG4qFGm","https://www.patreon.com/32beatwriters",,"https://pbs.twimg.com/profile_banners/757659945487728640/1597874950",,"http://pbs.twimg.com/profile_images/1438327029976424451/eBZhywAU_normal.jpg"
"757659945487728640","1455967627306749956","2021-11-03 18:38:27","32BeatWriters","Javonte Williams leads all running backs with at least 50 attempts in missed tackles forced per attempt (36%).

He ranks 10th in explosive-run rate (10 yards or more) at 14% and 7th in yards after contact per attempt (3.4).

 Second-worst in stuff rate (0 yards or less) at 13%.","Twitter for iPhone",140,,,,false,true,0,64,,,"","","","","","","","","","","","",,"","","en",,,,,,,,,,,,,,,,"1455967384787902467","Javonte Williams leads all running backs with at least 50 attempts in missed tackles forced per attempt (36%).

He ranks 10th in explosive-run rate (10 yards or more) at 14% and 7th in yards after contact per attempt (3.4).

 Second-worst in stuff rate (0 yards or less) at 13%.","2021-11-03 18:37:29","Twitter Web App",482,64,"61520728","dwainmcfarland","Context Matters",25554,834,15935,"Texas","You're a daisy if you do.

@PFF, #UtilizationReport, @FFHustle, 3X @FFPC Top-5 Finisher, FFOC Top-8 Finisher, #SFB11

Tweets are my own",false,,,,,,,"","","","https://twitter.com/32BeatWriters/status/1455967627306749956","NFL Beat Writers","Training camp","We follow all 32 NFL teams' beat writers so you don't have to. Follow us to help win your fantasy football league. https://t.co/KK0FOK2MQ1","https://t.co/IJHGG4qFGm",false,44256,762,1319,22934,1433,"2016-07-25 19:33:02",false,"https://t.co/IJHGG4qFGm","https://www.patreon.com/32beatwriters",,"https://pbs.twimg.com/profile_banners/757659945487728640/1597874950",,"http://pbs.twimg.com/profile_images/1438327029976424451/eBZhywAU_normal.jpg"
"757659945487728640","1455967586026414084","2021-11-03 18:38:17","32BeatWriters","TE Darren Waller who missed the game against the Eagles is also back at practice with the #Raiders https://t.co/U0S82ilZzW","Twitter for iPhone",140,,,,false,true,0,32,,,"","","","","","","","","","","","",,"","","en",,,,,,,,,,,,,,,,"1455967227866320898","TE Darren Waller who missed the game against the Eagles is also back at practice with the #Raiders https://t.co/U0S82ilZzW","2021-11-03 18:36:52","Twitter for iPhone",434,32,"340686858","JesseNews3LV","Jesse Merrick",2995,3149,30200,"Las Vegas, NV","Sports interpreter @News3LV | @apufootball WR 08-12 | I wear makeup & talk about kids that can run faster than me | RT ain’t an endorsement | IG: jessemerrick_",true,,,,,,,"","","","https://twitter.com/32BeatWriters/status/1455967586026414084","NFL Beat Writers","Training camp","We follow all 32 NFL teams' beat writers so you don't have to. Follow us to help win your fantasy football league. https://t.co/KK0FOK2MQ1","https://t.co/IJHGG4qFGm",false,44256,762,1319,22934,1433,"2016-07-25 19:33:02",false,"https://t.co/IJHGG4qFGm","https://www.patreon.com/32beatwriters",,"https://pbs.twimg.com/profile_banners/757659945487728640/1597874950",,"http://pbs.twimg.com/profile_images/1438327029976424451/eBZhywAU_normal.jpg"
