"757659945487728640","1455966366658408457","2021-11-03 18:33:27","32BeatWriters","Cardinals QB Kyler Murray said having 4-5 days off following Thursday night's game definitely helped his sprained left ankle. Said he's taking it day to day but sure sounds like he expects to play vs. 49ers on Sunday.","Twitter for iPhone",140,,,,false,true,0,21,,,"","","","","","","","","","","","",,"","","en",,,,,,,,,,,,,,,,"1455965986247491585","Cardinals QB Kyler Murray said having 4-5 days off following Thursday night's game definitely helped his sprained left ankle. Said he's taking it day to day but sure sounds like he expects to play vs. 49ers on Sunday.","2021-11-03 18:31:56","Twitter Web App",252,21,"349749823","azbobbymac","Bob McManaman",9379,1403,18721,"Phoenix, Arizona","Senior Sportswriter for The Arizona Republic. I cover the Arizona Cardinals and the NFL.",true,,,,,,,"","","","https://twitter.com/32BeatWriters/status/1455966366658408457","NFL Beat Writers","Training camp","We follow all 32 NFL teams' beat writers so you don't have to. Follow us to help win your fantasy football league. https://t.co/KK0FOK2MQ1","https://t.co/IJHGG4qFGm",false,44256,762,1319,22934,1433,"2016-07-25 19:33:02",false,"https://t.co/IJHGG4qFGm","https://www.patreon.com/32beatwriters",,"https://pbs.twimg.com/profile_banners/757659945487728640/1597874950",,"http://pbs.twimg.com/profile_images/1438327029976424451/eBZhywAU_normal.jpg"
"757659945487728640","1455943582410493957","2021-11-03 17:02:54","32BeatWriters","Earlier today, Browns coach Kevin Stefanski told his players that Odell Beckham Jr. is essentially not on the team right now and that the WR has been told to stay at home.","Twitter for iPhone",140,,,,false,true,0,1278,,,"","","","","","","","","","","","",,"","","en",,,,,,,,,,,,,,,,"1455943081388175366","Earlier today, Browns coach Kevin Stefanski told his players that Odell Beckham Jr. is essentially not on the team right now and that the WR has been told to stay at home.","2021-11-03 17:00:55","Twitter for iPhone",6400,1278,"49883265","MikeSilver","Michael Silver",193510,998,161960,"California Republic","13-plus years at Sports Illustrated. Six as a DotCom Don. Now loudly dispensing real talk on a television near you. Unfollow me. https://t.co/eerZ10pZdX",true,,,,,,,"","","","https://twitter.com/32BeatWriters/status/1455943582410493957","NFL Beat Writers","Training camp","We follow all 32 NFL teams' beat writers so you don't have to. Follow us to help win your fantasy football league. https://t.co/KK0FOK2MQ1","https://t.co/IJHGG4qFGm",false,44256,762,1319,22934,1433,"2016-07-25 19:33:02",false,"https://t.co/IJHGG4qFGm","https://www.patreon.com/32beatwriters",,"https://pbs.twimg.com/profile_banners/757659945487728640/1597874950",,"http://pbs.twimg.com/profile_images/1438327029976424451/eBZhywAU_normal.jpg"
"757659945487728640","1455931877555048452","2021-11-03 16:16:24","32BeatWriters","Former Raiders WR Henry Ruggs is accused of driving 156 mph before the crash. 

He was at 127mph when airbags deployed. His blood alcohol level was .161. This is more than twice the legal limit...

A loaded gun was also found in the car... https://t.co/bMna7qLbpb","Twitter for iPhone",140,,,,false,true,0,125,,,"","","","","","","","","","","","",,"","","en",,,,,,,,,,,,,,,,"1455931770445123589","Former Raiders WR Henry Ruggs is accused of driving 156 mph before the crash. 

He was at 127mph when airbags deployed. His blood alcohol level was .161. This is more than twice the legal limit...

A loaded gun was also found in the car... https://t.co/bMna7qLbpb","2021-11-03 16:15:58","Twitter Web App",471,125,"1154347952","MitchellRenz365","Raiders Report Mitchell Renz",21598,762,25346,"DM INSTAGRAM: @MitchellRenz365","NFL Daily & Raiders Report Host @ChatSports | #RaiderNation Subscribe to the #1 Las Vegas Raiders show on YouTube (94.1K Subs) for Daily videos. Link Below 👇🏻",false,,,,,,,"","","","https://twitter.com/32BeatWriters/status/1455931877555048452","NFL Beat Writers","Training camp","We follow all 32 NFL teams' beat writers so you don't have to. Follow us to help win your fantasy football league. https://t.co/KK0FOK2MQ1","https://t.co/IJHGG4qFGm",false,44256,762,1319,22934,1433,"2016-07-25 19:33:02",false,"https://t.co/IJHGG4qFGm","https://www.patreon.com/32beatwriters",,"https://pbs.twimg.com/profile_banners/757659945487728640/1597874950",,"http://pbs.twimg.com/profile_images/1438327029976424451/eBZhywAU_normal.jpg"
"757659945487728640","1455930995648126977","2021-11-03 16:12:53","32BeatWriters","I'm told #Browns WR Odell Beckham Jr. has been told he's excused from practice today, per league source. Additionally, it is my understanding that OBJ was ready to attend practice per usual.","Twitter for iPhone",139,,,,false,true,0,1274,,,"","","","","","","","","","","","",,"","","en",,,,,,,,,,,,,,,,"1455922586085466112","I'm told #Browns WR Odell Beckham Jr. has been told he's excused from practice today, per league source. Additionally, it is my understanding that OBJ was ready to attend practice per usual.","2021-11-03 15:39:28","TweetDeck",6230,1274,"41369172","JosinaAnderson","IG: JosinaAnderson",201895,4407,51593,"In Journalistic Freedom","Emmy & NABJ Award Winner, @CBSSportsHQ, @Usatoday, Host of 'The Crew' & 'Undefined with Josina Anderson.' Alum ESPN, Showtime, FOX31. Concierge@TheCrewShow.com",true,,,,,,,"","","","https://twitter.com/32BeatWriters/status/1455930995648126977","NFL Beat Writers","Training camp","We follow all 32 NFL teams' beat writers so you don't have to. Follow us to help win your fantasy football league. https://t.co/KK0FOK2MQ1","https://t.co/IJHGG4qFGm",false,44256,762,1319,22934,1433,"2016-07-25 19:33:02",false,"https://t.co/IJHGG4qFGm","https://www.patreon.com/32beatwriters",,"https://pbs.twimg.com/profile_banners/757659945487728640/1597874950",,"http://pbs.twimg.com/profile_images/1438327029976424451/eBZhywAU_normal.jpg"
"757659945487728640","1455925250852544512","2021-11-03 15:50:04","32BeatWriters","Christian McCaffrey designated to return from IR
https://t.co/ynjA1mdkRc","Twitter for iPhone",86,,,,false,true,0,213,,,"","","","","","","","","","","","",,"","","en",,,,,,,,,,,,,,,,"1455922215199944708","Christian McCaffrey designated to return from IR
https://t.co/ynjA1mdkRc","2021-11-03 15:38:00","Twitter Web App",1314,213,"56443153","Panthers","Carolina Panthers",3014018,7449,87329,"Charlotte, NC","#KeepPounding",true,,,,,,,"","","","https://twitter.com/32BeatWriters/status/1455925250852544512","NFL Beat Writers","Training camp","We follow all 32 NFL teams' beat writers so you don't have to. Follow us to help win your fantasy football league. https://t.co/KK0FOK2MQ1","https://t.co/IJHGG4qFGm",false,44256,762,1319,22934,1433,"2016-07-25 19:33:02",false,"https://t.co/IJHGG4qFGm","https://www.patreon.com/32beatwriters",,"https://pbs.twimg.com/profile_banners/757659945487728640/1597874950",,"http://pbs.twimg.com/profile_images/1438327029976424451/eBZhywAU_normal.jpg"
"757659945487728640","1455924839672422400","2021-11-03 15:48:26","32BeatWriters","No Kyler Murray in the open part of #AZCardinals practice this morning. 

WR DeAndre Hopkins also absent. Did not see WR A.J. Green either, or RB Jonathan Ward.

C Rodney Hudson, DL Rashard Lawrence, LB Zaven Collins, OL Max Garcia all practicing. https://t.co/8ZBXSL7Dur","Twitter for iPhone",139,,,,false,true,0,40,,,"","","","","","","","","","","","",,"","","en",,,,,,,,,,,,,,,,"1455920870229086209","No Kyler Murray in the open part of #AZCardinals practice this morning. 

WR DeAndre Hopkins also absent. Did not see WR A.J. Green either, or RB Jonathan Ward.

C Rodney Hudson, DL Rashard Lawrence, LB Zaven Collins, OL Max Garcia all practicing. https://t.co/8ZBXSL7Dur","2021-11-03 15:32:39","Twitter for iPhone",280,40,"36550247","Cardschatter","Darren Urban",142886,496,74687,"Tempe, Az","Working my 22nd season covering the Arizona Cardinals. Opinions are my own, not the team's. Warning and a promise: Sarcasm can be found here. @Cronkite_ASU",true,,,,,,,"","","","https://twitter.com/32BeatWriters/status/1455924839672422400","NFL Beat Writers","Training camp","We follow all 32 NFL teams' beat writers so you don't have to. Follow us to help win your fantasy football league. https://t.co/KK0FOK2MQ1","https://t.co/IJHGG4qFGm",false,44256,762,1319,22934,1433,"2016-07-25 19:33:02",false,"https://t.co/IJHGG4qFGm","https://www.patreon.com/32beatwriters",,"https://pbs.twimg.com/profile_banners/757659945487728640/1597874950",,"http://pbs.twimg.com/profile_images/1438327029976424451/eBZhywAU_normal.jpg"
"757659945487728640","1455924788212473859","2021-11-03 15:48:13","32BeatWriters","Source close to #Browns Odell Beckham Jr. said the wideout will not practice today and that the decision was “team-related”. @JosinaAnderson reports Beckham Jr. was ready to practice and the team told him he was “excused” from attending. This appears to be a crossroads.","Twitter for iPhone",140,,,,false,true,0,273,,,"","","","","","","","","","","","",,"","","en",,,,,,,,,,,,,,,,"1455924113214693382","Source close to #Browns Odell Beckham Jr. said the wideout will not practice today and that the decision was “team-related”. @JosinaAnderson reports Beckham Jr. was ready to practice and the team told him he was “excused” from attending. This appears to be a crossroads.","2021-11-03 15:45:33","Twitter for iPhone",1055,273,"50863281","CharlesRobinson","Charles Robinson",117216,661,14350,"An NFL city near you","Senior NFL reporter for Yahoo. Always outnumbered. Email me at: WindyCityScribe@yahoo.com.",true,,,,,,,"","","","https://twitter.com/32BeatWriters/status/1455924788212473859","NFL Beat Writers","Training camp","We follow all 32 NFL teams' beat writers so you don't have to. Follow us to help win your fantasy football league. https://t.co/KK0FOK2MQ1","https://t.co/IJHGG4qFGm",false,44256,762,1319,22934,1433,"2016-07-25 19:33:02",false,"https://t.co/IJHGG4qFGm","https://www.patreon.com/32beatwriters",,"https://pbs.twimg.com/profile_banners/757659945487728640/1597874950",,"http://pbs.twimg.com/profile_images/1438327029976424451/eBZhywAU_normal.jpg"
"757659945487728640","1455920888902295553","2021-11-03 15:32:44","32BeatWriters","If #Packers Rodgers is indeed unvaccinated, he’s out for at least 10 days + has to show back-to-back negative tests 24 hours apart to return. He would definitely be out vs Chiefs, and potentially out vs Seahawks. 

Reminder: Kurt Benkert has also tested positive + is out for now","Twitter for iPhone",139,,,,false,true,0,7,,,"","","","","","","","","","","","",,"","","en",,,,,,,,,,,,,,,,"1455918136381874184","If #Packers Rodgers is indeed unvaccinated, he’s out for at least 10 days + has to show back-to-back negative tests 24 hours apart to return. He would definitely be out vs Chiefs, and potentially out vs Seahawks. 

Reminder: Kurt Benkert has also tested positive + is out for now","2021-11-03 15:21:48","Twitter for iPhone",42,7,"497478603","rachelhopmayer","Rachel Hopmayer",7493,1990,42279,"Green Bay, WI","Sports Reporter @NBC26, news/elex pinch hitter. Previously @nbcsports, @capitals, @AUeagles, etc. Proud product of the 508 🦞 she/her",true,,,,,,,"","","","https://twitter.com/32BeatWriters/status/1455920888902295553","NFL Beat Writers","Training camp","We follow all 32 NFL teams' beat writers so you don't have to. Follow us to help win your fantasy football league. https://t.co/KK0FOK2MQ1","https://t.co/IJHGG4qFGm",false,44256,762,1319,22934,1433,"2016-07-25 19:33:02",false,"https://t.co/IJHGG4qFGm","https://www.patreon.com/32beatwriters",,"https://pbs.twimg.com/profile_banners/757659945487728640/1597874950",,"http://pbs.twimg.com/profile_images/1438327029976424451/eBZhywAU_normal.jpg"
"757659945487728640","1455914642983768072","2021-11-03 15:07:55","32BeatWriters","I asked Aaron Rodgers on August 26 if he was vaccinated.

His answer: “Yeah, I’ve been immunized.” https://t.co/ZWj3JKsRm0","Twitter for iPhone",114,,,,false,true,0,218,,,"","","","","","","","","","","","",,"","","en",,,,,,,,,,,,,,,,"1455913961531060235","I asked Aaron Rodgers on August 26 if he was vaccinated.

His answer: “Yeah, I’ve been immunized.” https://t.co/ZWj3JKsRm0","2021-11-03 15:05:12","Twitter for iPhone",1192,218,"1686423121","ByRyanWood","Ryan Wood",46848,499,39334,"Green Bay, Wisc.","Packers beat writer, Green Bay Press-Gazette. “That Dude” for WSSP. Storyteller. Proud dad. From the cornfields of Indiana. Off he goes…",true,,,,,,,"","","","https://twitter.com/32BeatWriters/status/1455914642983768072","NFL Beat Writers","Training camp","We follow all 32 NFL teams' beat writers so you don't have to. Follow us to help win your fantasy football league. https://t.co/KK0FOK2MQ1","https://t.co/IJHGG4qFGm",false,44256,762,1319,22934,1433,"2016-07-25 19:33:02",false,"https://t.co/IJHGG4qFGm","https://www.patreon.com/32beatwriters",,"https://pbs.twimg.com/profile_banners/757659945487728640/1597874950",,"http://pbs.twimg.com/profile_images/1438327029976424451/eBZhywAU_normal.jpg"
"757659945487728640","1455910747838550029","2021-11-03 14:52:26","32BeatWriters","#Packers QB Jordan Love, who the team drafted in the first round, will start against the #Chiefs. Rodgers out with COVID.","Twitter for iPhone",135,,,,false,true,0,900,,,"","","","","","","","","","","","",,"","","en",,,,,,,,,,,,,,,,"1455910701101424648","#Packers QB Jordan Love, who the team drafted in the first round, will start against the #Chiefs. Rodgers out with COVID.","2021-11-03 14:52:15","TweetDeck",7915,900,"16403943","RapSheet","Ian Rapoport",2930075,721,150206,"New York","National Insider for NFL Network and https://t.co/NIVZ6FP1b6. Husband of @thebanktress.",true,,,,,,,"","","","https://twitter.com/32BeatWriters/status/1455910747838550029","NFL Beat Writers","Training camp","We follow all 32 NFL teams' beat writers so you don't have to. Follow us to help win your fantasy football league. https://t.co/KK0FOK2MQ1","https://t.co/IJHGG4qFGm",false,44256,762,1319,22934,1433,"2016-07-25 19:33:02",false,"https://t.co/IJHGG4qFGm","https://www.patreon.com/32beatwriters",,"https://pbs.twimg.com/profile_banners/757659945487728640/1597874950",,"http://pbs.twimg.com/profile_images/1438327029976424451/eBZhywAU_normal.jpg"
"757659945487728640","1455910738363551744","2021-11-03 14:52:24","32BeatWriters","Sources: #Packers QB Aaron Rodgers tested positive for COVID-19 and is out for Sunday’s game against the #Chiefs.","Twitter for iPhone",131,,,,false,true,0,2098,,,"","","","","","","","","","","","",,"","","en",,,,,,,,,,,,,,,,"1455910215191248899","Sources: #Packers QB Aaron Rodgers tested positive for COVID-19 and is out for Sunday’s game against the #Chiefs.","2021-11-03 14:50:19","TweetDeck",6969,2098,"36089053","TomPelissero","Tom Pelissero",343133,1273,75782,"","Reporter, @NFLNetwork. Host, @SiriusXMNFL. Husband, @SaraPelissero. Dad, the best girls ever.",true,,,,,,,"","","","https://twitter.com/32BeatWriters/status/1455910738363551744","NFL Beat Writers","Training camp","We follow all 32 NFL teams' beat writers so you don't have to. Follow us to help win your fantasy football league. https://t.co/KK0FOK2MQ1","https://t.co/IJHGG4qFGm",false,44256,762,1319,22934,1433,"2016-07-25 19:33:02",false,"https://t.co/IJHGG4qFGm","https://www.patreon.com/32beatwriters",,"https://pbs.twimg.com/profile_banners/757659945487728640/1597874950",,"http://pbs.twimg.com/profile_images/1438327029976424451/eBZhywAU_normal.jpg"
"757659945487728640","1455897064987049987","2021-11-03 13:58:04","32BeatWriters","And now, #Saints WR Michael Thomas makes the announcement. He’s out for the season. https://t.co/OlwTsYY4I3","Twitter for iPhone",97,,,,false,true,0,308,,,"","","","","","","","","","","","",,"","","en",,,,,,,,,,,,,,,,"1455895926174883840","And now, #Saints WR Michael Thomas makes the announcement. He’s out for the season. https://t.co/OlwTsYY4I3","2021-11-03 13:53:32","TweetDeck",1643,308,"16403943","RapSheet","Ian Rapoport",2930075,721,150206,"New York","National Insider for NFL Network and https://t.co/NIVZ6FP1b6. Husband of @thebanktress.",true,,,,,,,"","","","https://twitter.com/32BeatWriters/status/1455897064987049987","NFL Beat Writers","Training camp","We follow all 32 NFL teams' beat writers so you don't have to. Follow us to help win your fantasy football league. https://t.co/KK0FOK2MQ1","https://t.co/IJHGG4qFGm",false,44256,762,1319,22934,1433,"2016-07-25 19:33:02",false,"https://t.co/IJHGG4qFGm","https://www.patreon.com/32beatwriters",,"https://pbs.twimg.com/profile_banners/757659945487728640/1597874950",,"http://pbs.twimg.com/profile_images/1438327029976424451/eBZhywAU_normal.jpg"
"757659945487728640","1455880231378694154","2021-11-03 12:51:10","32BeatWriters","“You drafted a great team. It is not your fault.” https://t.co/AAOENEc0Qu","Twitter for iPhone",49,,,,false,false,1681,200,,,"","","","","","","","","","","","",,"","","en",,,,,,,,,,,,,,,,,,,,,,,,,,,,,,,,,,,,,"","","","https://twitter.com/32BeatWriters/status/1455880231378694154","NFL Beat Writers","Training camp","We follow all 32 NFL teams' beat writers so you don't have to. Follow us to help win your fantasy football league. https://t.co/KK0FOK2MQ1","https://t.co/IJHGG4qFGm",false,44256,762,1319,22934,1433,"2016-07-25 19:33:02",false,"https://t.co/IJHGG4qFGm","https://www.patreon.com/32beatwriters",,"https://pbs.twimg.com/profile_banners/757659945487728640/1597874950",,"http://pbs.twimg.com/profile_images/1438327029976424451/eBZhywAU_normal.jpg"
"757659945487728640","1455622973222760458","2021-11-02 19:48:55","32BeatWriters","Deebo Samuel has caught 15-of-18 targets with 15+ air yards. That is ridiculous. https://t.co/qcKVIQUDr4","Twitter for iPhone",121,,,,false,true,0,39,,,"","","","","","","","","","","","",,"","","en",,,,,,,,,,,,,,,,"1455622157963182083","Deebo Samuel has caught 15-of-18 targets with 15+ air yards. That is ridiculous. https://t.co/qcKVIQUDr4","2021-11-02 19:45:41","Twitter Web App",266,39,"838999572093399040","HaydenWinks","Hayden Winks",23707,1387,12716,"","Content and Marketing @UnderdogFantasy 🐶 | TUE, THU, & SUN ⬇️ | Charts on Underblog 📊",false,,,,,,,"","","","https://twitter.com/32BeatWriters/status/1455622973222760458","NFL Beat Writers","Training camp","We follow all 32 NFL teams' beat writers so you don't have to. Follow us to help win your fantasy football league. https://t.co/KK0FOK2MQ1","https://t.co/IJHGG4qFGm",false,44256,762,1319,22934,1433,"2016-07-25 19:33:02",false,"https://t.co/IJHGG4qFGm","https://www.patreon.com/32beatwriters",,"https://pbs.twimg.com/profile_banners/757659945487728640/1597874950",,"http://pbs.twimg.com/profile_images/1438327029976424451/eBZhywAU_normal.jpg"
