"user_id","status_id","created_at","screen_name","text","source","display_text_width","reply_to_status_id","reply_to_user_id","reply_to_screen_name","is_quote","is_retweet","favorite_count","retweet_count","quote_count","reply_count","hashtags","symbols","urls_url","urls_t.co","urls_expanded_url","media_url","media_t.co","media_expanded_url","media_type","ext_media_url","ext_media_t.co","ext_media_expanded_url","ext_media_type","mentions_user_id","mentions_screen_name","lang","quoted_status_id","quoted_text","quoted_created_at","quoted_source","quoted_favorite_count","quoted_retweet_count","quoted_user_id","quoted_screen_name","quoted_name","quoted_followers_count","quoted_friends_count","quoted_statuses_count","quoted_location","quoted_description","quoted_verified","retweet_status_id","retweet_text","retweet_created_at","retweet_source","retweet_favorite_count","retweet_retweet_count","retweet_user_id","retweet_screen_name","retweet_name","retweet_followers_count","retweet_friends_count","retweet_statuses_count","retweet_location","retweet_description","retweet_verified","place_url","place_name","place_full_name","place_type","country","country_code","geo_coords","coords_coords","bbox_coords","status_url","name","location","description","url","protected","followers_count","friends_count","listed_count","statuses_count","favourites_count","account_created_at","verified","profile_url","profile_expanded_url","account_lang","profile_banner_url","profile_background_url","profile_image_url"
"757659945487728640","1512211409735671809","2022-04-07 23:31:10","32BeatWriters","WR Brandin Cooks has agreed to a new two-year extension with the Texans, per source.","Twitter for iPhone",102,,,,false,true,0,995,,,"","","","","","","","","","","","",,"","","en",,,,,,,,,,,,,,,,"1512204069418450944","WR Brandin Cooks has agreed to a new two-year extension with the Texans, per source.","2022-04-07 23:02:00","Twitter for iPhone",11234,995,"51263592","AdamSchefter","Adam Schefter",9438915,3553,59784,"New York","ESPN Senior NFL Insider. 
Interview & Podcast Requests: ESPNPR@espn.com
Host of the Adam Schefter Podcast
https://t.co/oz43ix5jZU",true,,,,,,,"","","","https://twitter.com/32BeatWriters/status/1512211409735671809","NFL Beat Writers","Training camp","We follow all 32 NFL teams' beat writers so you don't have to, even though you should because they do great work. 
Creator of Little Football Guys - #LFG","https://t.co/EhQR4trGzl",false,44474,888,1364,24695,1666,"2016-07-25 19:33:02",false,"https://t.co/EhQR4trGzl","https://discord.gg/qqXkfc3GPs",,"https://pbs.twimg.com/profile_banners/757659945487728640/1645979972",,"http://pbs.twimg.com/profile_images/1484327856905674762/a3aIBH4E_normal.jpg"
"757659945487728640","1512125995083567116","2022-04-07 17:51:45","32BeatWriters","From NFL Now: #Cincinnati QB Desmond Ridder is with the #Steelers today on a visit, and he's got a busy few weeks ahead. https://t.co/dZ6OS2qlyY","Twitter for iPhone",140,,,,false,true,0,93,,,"","","","","","","","","","","","",,"","","en",,,,,,,,,,,,,,,,"1512125952754601990","From NFL Now: #Cincinnati QB Desmond Ridder is with the #Steelers today on a visit, and he's got a busy few weeks ahead. https://t.co/dZ6OS2qlyY","2022-04-07 17:51:35","Socialie.",732,93,"16403943","RapSheet","Ian Rapoport",3346432,738,153813,"New York","National Insider for NFL Network and https://t.co/NIVZ6FP1b6. Husband of @thebanktress. Made seven cameos in the movie, Draft Day.",true,,,,,,,"","","","https://twitter.com/32BeatWriters/status/1512125995083567116","NFL Beat Writers","Training camp","We follow all 32 NFL teams' beat writers so you don't have to, even though you should because they do great work. 
Creator of Little Football Guys - #LFG","https://t.co/EhQR4trGzl",false,44474,888,1364,24695,1666,"2016-07-25 19:33:02",false,"https://t.co/EhQR4trGzl","https://discord.gg/qqXkfc3GPs",,"https://pbs.twimg.com/profile_banners/757659945487728640/1645979972",,"http://pbs.twimg.com/profile_images/1484327856905674762/a3aIBH4E_normal.jpg"
"757659945487728640","1512046064618164235","2022-04-07 12:34:08","32BeatWriters","The 2022 NFL Draft Guide is now available.

#TheBeast 

https://t.co/ntAmew61AK","Twitter for iPhone",94,,,,false,true,0,488,,,"","","","","","","","","","","","",,"","","en",,,,,,,,,,,,,,,,"1512037785619861505","The 2022 NFL Draft Guide is now available.

#TheBeast 

https://t.co/ntAmew61AK","2022-04-07 12:01:15","Twitter Web App",2477,488,"115430404","dpbrugler","Dane Brugler",128374,810,86673,"Northeast Ohio","NFL Draft Analyst for @TheAthletic. Husband, father, amateur BBQ Pitmaster.",true,,,,,,,"","","","https://twitter.com/32BeatWriters/status/1512046064618164235","NFL Beat Writers","Training camp","We follow all 32 NFL teams' beat writers so you don't have to, even though you should because they do great work. 
Creator of Little Football Guys - #LFG","https://t.co/EhQR4trGzl",false,44474,888,1364,24695,1666,"2016-07-25 19:33:02",false,"https://t.co/EhQR4trGzl","https://discord.gg/qqXkfc3GPs",,"https://pbs.twimg.com/profile_banners/757659945487728640/1645979972",,"http://pbs.twimg.com/profile_images/1484327856905674762/a3aIBH4E_normal.jpg"
"757659945487728640","1512045417848094722","2022-04-07 12:31:34","32BeatWriters","In this, from @BradyHenderson: Seahawks want “something in the neighborhood of two firsts as the minimum” for DK Metcalf. https://t.co/AJXN4bRB7p","Twitter for iPhone",137,,,,false,true,0,21,,,"","","","","","","","","","","","",,"","","en",,,,,,,,,,,,,,,,"1512040148925657093","In this, from @BradyHenderson: Seahawks want “something in the neighborhood of two firsts as the minimum” for DK Metcalf. https://t.co/AJXN4bRB7p","2022-04-07 12:10:38","Twitter for iPhone",238,21,"196688108","zachkruse2","Zach Kruse",50082,1331,64555,"","Managing editor and writer for @ThePackersWire. Regional editor, NFL Wires. Contributor to Packers Plus.",true,,,,,,,"","","","https://twitter.com/32BeatWriters/status/1512045417848094722","NFL Beat Writers","Training camp","We follow all 32 NFL teams' beat writers so you don't have to, even though you should because they do great work. 
Creator of Little Football Guys - #LFG","https://t.co/EhQR4trGzl",false,44474,888,1364,24695,1666,"2016-07-25 19:33:02",false,"https://t.co/EhQR4trGzl","https://discord.gg/qqXkfc3GPs",,"https://pbs.twimg.com/profile_banners/757659945487728640/1645979972",,"http://pbs.twimg.com/profile_images/1484327856905674762/a3aIBH4E_normal.jpg"
"757659945487728640","1511876235726577667","2022-04-07 01:19:18","32BeatWriters","#SMU WR Danny Gray (@dgray_5), listed today on https://t.co/iLSuC0HswN as the 64th overall prospect (https://t.co/4JRY7yglUo), is finishing up a visit with the #Vikings after visiting the #Raiders on Monday and spending time with the #Cowboys over the weekend.","Twitter for iPhone",140,,,,false,true,0,94,,,"","","","","","","","","","","","",,"","","en",,,,,,,,,,,,,,,,"1511876190902042625","#SMU WR Danny Gray (@dgray_5), listed today on https://t.co/iLSuC0HswN as the 64th overall prospect (https://t.co/4JRY7yglUo), is finishing up a visit with the #Vikings after visiting the #Raiders on Monday and spending time with the #Cowboys over the weekend.","2022-04-07 01:19:07","Twitter for iPhone",604,94,"16403943","RapSheet","Ian Rapoport",3346432,738,153813,"New York","National Insider for NFL Network and https://t.co/NIVZ6FP1b6. Husband of @thebanktress. Made seven cameos in the movie, Draft Day.",true,,,,,,,"","","","https://twitter.com/32BeatWriters/status/1511876235726577667","NFL Beat Writers","Training camp","We follow all 32 NFL teams' beat writers so you don't have to, even though you should because they do great work. 
Creator of Little Football Guys - #LFG","https://t.co/EhQR4trGzl",false,44474,888,1364,24695,1666,"2016-07-25 19:33:02",false,"https://t.co/EhQR4trGzl","https://discord.gg/qqXkfc3GPs",,"https://pbs.twimg.com/profile_banners/757659945487728640/1645979972",,"http://pbs.twimg.com/profile_images/1484327856905674762/a3aIBH4E_normal.jpg"
"757659945487728640","1511671862992027653","2022-04-06 11:47:12","32BeatWriters","Stefon Diggs’ deal, which now locks him in for 6 seasons, puts him right in the mix of the highest paid WRs based on new money average. https://t.co/2jeWBiwfpB","Twitter for iPhone",140,,,,false,true,0,95,,,"","","","","","","","","","","","",,"","","en",,,,,,,,,,,,,,,,"1511668506282053635","Stefon Diggs’ deal, which now locks him in for 6 seasons, puts him right in the mix of the highest paid WRs based on new money average. https://t.co/2jeWBiwfpB","2022-04-06 11:33:51","Twitter for iPhone",1345,95,"16403943","RapSheet","Ian Rapoport",3346432,738,153813,"New York","National Insider for NFL Network and https://t.co/NIVZ6FP1b6. Husband of @thebanktress. Made seven cameos in the movie, Draft Day.",true,,,,,,,"","","","https://twitter.com/32BeatWriters/status/1511671862992027653","NFL Beat Writers","Training camp","We follow all 32 NFL teams' beat writers so you don't have to, even though you should because they do great work. 
Creator of Little Football Guys - #LFG","https://t.co/EhQR4trGzl",false,44474,888,1364,24695,1666,"2016-07-25 19:33:02",false,"https://t.co/EhQR4trGzl","https://discord.gg/qqXkfc3GPs",,"https://pbs.twimg.com/profile_banners/757659945487728640/1645979972",,"http://pbs.twimg.com/profile_images/1484327856905674762/a3aIBH4E_normal.jpg"
