"user_id","status_id","created_at","screen_name","text","source","display_text_width","reply_to_status_id","reply_to_user_id","reply_to_screen_name","is_quote","is_retweet","favorite_count","retweet_count","quote_count","reply_count","hashtags","symbols","urls_url","urls_t.co","urls_expanded_url","media_url","media_t.co","media_expanded_url","media_type","ext_media_url","ext_media_t.co","ext_media_expanded_url","ext_media_type","mentions_user_id","mentions_screen_name","lang","quoted_status_id","quoted_text","quoted_created_at","quoted_source","quoted_favorite_count","quoted_retweet_count","quoted_user_id","quoted_screen_name","quoted_name","quoted_followers_count","quoted_friends_count","quoted_statuses_count","quoted_location","quoted_description","quoted_verified","retweet_status_id","retweet_text","retweet_created_at","retweet_source","retweet_favorite_count","retweet_retweet_count","retweet_user_id","retweet_screen_name","retweet_name","retweet_followers_count","retweet_friends_count","retweet_statuses_count","retweet_location","retweet_description","retweet_verified","place_url","place_name","place_full_name","place_type","country","country_code","geo_coords","coords_coords","bbox_coords","status_url","name","location","description","url","protected","followers_count","friends_count","listed_count","statuses_count","favourites_count","account_created_at","verified","profile_url","profile_expanded_url","account_lang","profile_banner_url","profile_background_url","profile_image_url"
"757659945487728640","1513959679008952322","2022-04-12 19:18:10","32BeatWriters","Travis Etienne on missing all of last season with the injury  said  “Just seeing the results If there was any year to miss, I missed a great one.” https://t.co/JFLyasxGQD","Twitter Web App",140,,,,false,true,0,26,,,"","","","","","","","","","","","",,"","","en",,,,,,,,,,,,,,,,"1513957574072320003","Travis Etienne on missing all of last season with the injury  said  “Just seeing the results If there was any year to miss, I missed a great one.” https://t.co/JFLyasxGQD","2022-04-12 19:09:48","Twitter Web App",227,26,"3614851402","JStCyrTV","Jamal St. Cyr",4172,877,20716,"Downtown Jacksonville, FL","Sports Anchor for @WJXT4 • NFL Owner 🧀 • @CAU Alum 🐾 • @NABJ Member • @PFWAwriters member 🏈",true,,,,,,,"","","","https://twitter.com/32BeatWriters/status/1513959679008952322","NFL Beat Writers","Training camp","We follow all 32 NFL teams' beat writers so you don't have to, even though you should because they do great work. 
Creator of Little Football Guys - #LFG","https://t.co/EhQR4trGzl",false,44471,885,1362,24705,1666,"2016-07-25 19:33:02",false,"https://t.co/EhQR4trGzl","https://discord.gg/qqXkfc3GPs",,"https://pbs.twimg.com/profile_banners/757659945487728640/1645979972",,"http://pbs.twimg.com/profile_images/1484327856905674762/a3aIBH4E_normal.jpg"
"757659945487728640","1513552736243048457","2022-04-11 16:21:07","32BeatWriters","Eagles RB Miles Sanders ""taking it a little more personal"" entering final season of rookie deal: ""A lot of people don't respect all the work I've done, and I've still got a lot to prove""

https://t.co/lxKcLULFe2 https://t.co/K87JfSiCHy","Twitter for iPhone",140,,,,false,true,0,11,,,"","","","","","","","","","","","",,"","","en",,,,,,,,,,,,,,,,"1513549441290018818","Eagles RB Miles Sanders ""taking it a little more personal"" entering final season of rookie deal: ""A lot of people don't respect all the work I've done, and I've still got a lot to prove""

https://t.co/lxKcLULFe2 https://t.co/K87JfSiCHy","2022-04-11 16:08:01","TweetDeck",114,11,"581971753","AroundTheNFL","Around The NFL",798567,567,197539,"","Online: https://t.co/6Ekf6gzRqa. In your ears: https://t.co/SWEODvdv5L…. Instagram: theatnpodcast In your heart: always.",true,,,,,,,"","","","https://twitter.com/32BeatWriters/status/1513552736243048457","NFL Beat Writers","Training camp","We follow all 32 NFL teams' beat writers so you don't have to, even though you should because they do great work. 
Creator of Little Football Guys - #LFG","https://t.co/EhQR4trGzl",false,44471,885,1362,24705,1666,"2016-07-25 19:33:02",false,"https://t.co/EhQR4trGzl","https://discord.gg/qqXkfc3GPs",,"https://pbs.twimg.com/profile_banners/757659945487728640/1645979972",,"http://pbs.twimg.com/profile_images/1484327856905674762/a3aIBH4E_normal.jpg"
"757659945487728640","1513519425625931785","2022-04-11 14:08:45","32BeatWriters","Kedon Slovis is the true contester of Drake London’s catches https://t.co/xb19h2B4NJ","Twitter Web App",97,,,,false,true,0,8,,,"","","","","","","","","","","","",,"","","en",,,,,,,,,,,,,,,,"1513170084864270338","Kedon Slovis is the true contester of Drake London’s catches https://t.co/xb19h2B4NJ","2022-04-10 15:00:36","Twitter for iPhone",156,8,"1302702201601622016","FF_RTDB","Jakob Sanderson",8219,1496,31740,"","Tony Pollard Cultist🥤 • Target share truther 📊• Co-Founder: @dynastytilt • Lead Analyst: @rotounderworld 😈 • It’s probably just variance",false,,,,,,,"","","","https://twitter.com/32BeatWriters/status/1513519425625931785","NFL Beat Writers","Training camp","We follow all 32 NFL teams' beat writers so you don't have to, even though you should because they do great work. 
Creator of Little Football Guys - #LFG","https://t.co/EhQR4trGzl",false,44471,885,1362,24705,1666,"2016-07-25 19:33:02",false,"https://t.co/EhQR4trGzl","https://discord.gg/qqXkfc3GPs",,"https://pbs.twimg.com/profile_banners/757659945487728640/1645979972",,"http://pbs.twimg.com/profile_images/1484327856905674762/a3aIBH4E_normal.jpg"
"757659945487728640","1512816617771704323","2022-04-09 15:36:03","32BeatWriters","This story was posted on the Local 10 website 20 mins ago. No ID yet ID yet of the victim but it was a 24-year-old male. https://t.co/78L3oGPcrL","Twitter for iPhone",138,,,,false,true,0,23,,,"","","","","","","","","","","","",,"","","en",,,,,,,,,,,,,,,,"1512814217715458052","This story was posted on the Local 10 website 20 mins ago. No ID yet ID yet of the victim but it was a 24-year-old male. https://t.co/78L3oGPcrL","2022-04-09 15:26:30","Twitter for iPhone",83,23,"29234146","AdamHBeasley","Adam Beasley",58065,1316,69905,"Miami, FL","NFL Director for Pro Football Network | Miami Herald alum | abeasley at PFN365 dot com | “The least awful."" -- Ryan Fitzpatrick",true,,,,,,,"","","","https://twitter.com/32BeatWriters/status/1512816617771704323","NFL Beat Writers","Training camp","We follow all 32 NFL teams' beat writers so you don't have to, even though you should because they do great work. 
Creator of Little Football Guys - #LFG","https://t.co/EhQR4trGzl",false,44471,885,1362,24705,1666,"2016-07-25 19:33:02",false,"https://t.co/EhQR4trGzl","https://discord.gg/qqXkfc3GPs",,"https://pbs.twimg.com/profile_banners/757659945487728640/1645979972",,"http://pbs.twimg.com/profile_images/1484327856905674762/a3aIBH4E_normal.jpg"
