"757659945487728640","1526227360189669379","2022-05-16 15:45:33","32BeatWriters","""I’ve maintained that White will beat out Ke’Shawn Vaughn for the No. 2 running back spot behind Leonard Fournette this year. After watching White in rookie mini-camp, I feel even better about that prediction.""","Twitter Web App",210,"1526227358415474694","757659945487728640","32BeatWriters",false,false,20,1,,,"","","","","","","","","","","","",,"","","en",,,,,,,,,,,,,,,,,,,,,,,,,,,,,,,,,,,,,"","","","https://twitter.com/32BeatWriters/status/1526227360189669379","NFL Beat Writers","Training camp","We follow all 32 NFL teams' beat writers so you don't have to, even though you should because they do great work.","https://t.co/EhQR4trGzl",false,44609,805,1378,25111,1705,"2016-07-25 19:33:02",false,"https://t.co/EhQR4trGzl","https://discord.gg/qqXkfc3GPs",,"https://pbs.twimg.com/profile_banners/757659945487728640/1650996834",,"http://pbs.twimg.com/profile_images/1484327856905674762/a3aIBH4E_normal.jpg"
"757659945487728640","1526227358415474694","2022-05-16 15:45:32","32BeatWriters","""Running back Rashaad White just looks the part. His build and the way he moves just resembles an NFL running back. White has natural hands and catches the ball effortlessly. When he runs the ball, he just glides on the field with long strides."" https://t.co/88aeDhlwra","Twitter Web App",245,,,,true,false,39,8,,,"","","","","","","","","","","","",,"","","en","1526226856520851457","#Bucs Monday Mailbag: Which Rookies Impressed?

Other topics include: Bruce Arians' role at practice, throwback creamsicles, and Ali Marpet in the Bucs Ring of Honor?

Presented by Amuni Financial

https://t.co/ZjVAo18B2a https://t.co/dTTPzj1v8A","2022-05-16 15:43:33","TweetDeck",5,0,"20450112","PewterReport","PewterReport",48241,2555,177581,"Tampa, FL","https://t.co/KxiSKoxkbj is a credentialed media site that has covered the #Bucs for decades. You want the best insight & analysis? You found it.",true,,,,,,,,,,,,,,,,,,,,,,"","","","https://twitter.com/32BeatWriters/status/1526227358415474694","NFL Beat Writers","Training camp","We follow all 32 NFL teams' beat writers so you don't have to, even though you should because they do great work.","https://t.co/EhQR4trGzl",false,44609,805,1378,25111,1705,"2016-07-25 19:33:02",false,"https://t.co/EhQR4trGzl","https://discord.gg/qqXkfc3GPs",,"https://pbs.twimg.com/profile_banners/757659945487728640/1650996834",,"http://pbs.twimg.com/profile_images/1484327856905674762/a3aIBH4E_normal.jpg"
"757659945487728640","1526172212583190528","2022-05-16 12:06:25","32BeatWriters","ICYMI this Arizona State RB could earn a valuable role as a rookie catching passes from Tom Brady. https://t.co/HSXgjrRH79","Twitter for iPhone",113,,,,false,true,0,6,,,"","","","","","","","","","","","",,"","","en",,,,,,,,,,,,,,,,"1526161531192352773","ICYMI this Arizona State RB could earn a valuable role as a rookie catching passes from Tom Brady. https://t.co/HSXgjrRH79","2022-05-16 11:23:58","Twitter for iPhone",56,6,"41407157","NFLSTROUD","Rick Stroud",50241,1992,55567,"Tampa Bay","Busy covering Bucs/NFL for Tampa Bay Times and the host of Sports Day Tampa Bay, a podcast available on Apple Podcasts (ITunes) and @tampabay.com",true,,,,,,,"","","","https://twitter.com/32BeatWriters/status/1526172212583190528","NFL Beat Writers","Training camp","We follow all 32 NFL teams' beat writers so you don't have to, even though you should because they do great work.","https://t.co/EhQR4trGzl",false,44609,805,1378,25111,1705,"2016-07-25 19:33:02",false,"https://t.co/EhQR4trGzl","https://discord.gg/qqXkfc3GPs",,"https://pbs.twimg.com/profile_banners/757659945487728640/1650996834",,"http://pbs.twimg.com/profile_images/1484327856905674762/a3aIBH4E_normal.jpg"
