"757659945487728640","1526625682285023235","2022-05-17 18:08:20","32BeatWriters","Free agent RB Tarik Cohen appears to have suffered a serious lower-leg injury during a workout streaming on IG Live. He’s been training for his comeback from a serious knee injury suffered in the 2020 season.","Twitter Web App",140,,,,false,true,0,91,,,"","","","","","","","","","","","",,"","","en",,,,,,,,,,,,,,,,"1526623962003910657","Free agent RB Tarik Cohen appears to have suffered a serious lower-leg injury during a workout streaming on IG Live. He’s been training for his comeback from a serious knee injury suffered in the 2020 season.","2022-05-17 18:01:30","Twitter for iPhone",540,91,"45975888","jjones9","Jonathan Jones",43548,1551,71092,"New England","Senior NFL reporter @CBSSports @CBSSportsHQ @CBSSportsNet. Shelby native formerly of @SINow @theobserver @dailytarheel. Email jonathan.jones@cbs.com",true,,,,,,,"","","","https://twitter.com/32BeatWriters/status/1526625682285023235","NFL Beat Writers","Training camp","We follow all 32 NFL teams' beat writers so you don't have to, even though you should because they do great work.","https://t.co/EhQR4trGzl",false,44609,805,1378,25111,1705,"2016-07-25 19:33:02",false,"https://t.co/EhQR4trGzl","https://discord.gg/qqXkfc3GPs",,"https://pbs.twimg.com/profile_banners/757659945487728640/1650996834",,"http://pbs.twimg.com/profile_images/1484327856905674762/a3aIBH4E_normal.jpg"
"757659945487728640","1526625221565894656","2022-05-17 18:06:30","32BeatWriters","Congrats to Phillip Lindsay ( @I_CU_boy ) agreeing to a one year deal with the @Colts","Twitter Web App",105,,,,false,true,0,219,,,"","","","","","","","","","","","",,"","","en",,,,,,,,,,,,,,,,"1526623975979327488","Congrats to Phillip Lindsay ( @I_CU_boy ) agreeing to a one year deal with the @Colts","2022-05-17 18:01:33","Twitter for iPhone",1423,219,"305208218","MikeMcCartney7","Mike McCartney",32419,491,2885,"","Christ-follower who loves his wife, 4 children & football. Former #NFL Pro Scouting Director blessed to rep great people at @VaynerSports.",true,,,,,,,"","","","https://twitter.com/32BeatWriters/status/1526625221565894656","NFL Beat Writers","Training camp","We follow all 32 NFL teams' beat writers so you don't have to, even though you should because they do great work.","https://t.co/EhQR4trGzl",false,44609,805,1378,25111,1705,"2016-07-25 19:33:02",false,"https://t.co/EhQR4trGzl","https://discord.gg/qqXkfc3GPs",,"https://pbs.twimg.com/profile_banners/757659945487728640/1650996834",,"http://pbs.twimg.com/profile_images/1484327856905674762/a3aIBH4E_normal.jpg"
"757659945487728640","1526597458062499840","2022-05-17 16:16:11","32BeatWriters","Asked about Lynn Bowden, McDaniel said he has an interesting skill set but has been “battling some hamstring stuff.” McDaniel said Bowden has been “diligent” in the classroom.","Twitter for iPhone",140,,,,false,true,0,7,,,"","","","","","","","","","","","",,"","","en",,,,,,,,,,,,,,,,"1526593952295575553","Asked about Lynn Bowden, McDaniel said he has an interesting skill set but has been “battling some hamstring stuff.” McDaniel said Bowden has been “diligent” in the classroom.","2022-05-17 16:02:15","Twitter for iPhone",28,7,"1022878914","DanielOyefusi","Daniel Oyefusi",12648,2340,41895,"Miami Lakes, FL","Dolphins Beat Reporter @MiamiHerald | Past: @baltimoresun | #MerrillMade | @sji_update | Music Maker | All that good stuff",true,,,,,,,"","","","https://twitter.com/32BeatWriters/status/1526597458062499840","NFL Beat Writers","Training camp","We follow all 32 NFL teams' beat writers so you don't have to, even though you should because they do great work.","https://t.co/EhQR4trGzl",false,44609,805,1378,25111,1705,"2016-07-25 19:33:02",false,"https://t.co/EhQR4trGzl","https://discord.gg/qqXkfc3GPs",,"https://pbs.twimg.com/profile_banners/757659945487728640/1650996834",,"http://pbs.twimg.com/profile_images/1484327856905674762/a3aIBH4E_normal.jpg"
"757659945487728640","1526597357416026112","2022-05-17 16:15:47","32BeatWriters","grier says tua's confidence is🚀

""i think w/ the additions we've done &amp; the players we added around him, it has him really excited...it’s been fun watching these guys, how they bought in w/ mike...even the defensive guys said they couldn't believe the transformation on offense"" https://t.co/LWAW4nDAlo","Twitter for iPhone",144,,,,false,true,0,15,,,"","","","","","","","","","","","",,"","","en",,,,,,,,,,,,,,,,"1526594506086285312","grier says tua's confidence is🚀

""i think w/ the additions we've done &amp; the players we added around him, it has him really excited...it’s been fun watching these guys, how they bought in w/ mike...even the defensive guys said they couldn't believe the transformation on offense"" https://t.co/LWAW4nDAlo","2022-05-17 16:04:27","Twitter Web App",127,15,"26429168","houtz","josh houtz",28919,1231,78940,"pencilvania","@miamidolphins stan | film dude | girldad ³ | writer & stuff | @thephinsider | @operationsports | @5reasonssports | former | pfn & s.i | #finsup | #sfb11 |🐧🐆",true,,,,,,,"","","","https://twitter.com/32BeatWriters/status/1526597357416026112","NFL Beat Writers","Training camp","We follow all 32 NFL teams' beat writers so you don't have to, even though you should because they do great work.","https://t.co/EhQR4trGzl",false,44609,805,1378,25111,1705,"2016-07-25 19:33:02",false,"https://t.co/EhQR4trGzl","https://discord.gg/qqXkfc3GPs",,"https://pbs.twimg.com/profile_banners/757659945487728640/1650996834",,"http://pbs.twimg.com/profile_images/1484327856905674762/a3aIBH4E_normal.jpg"
"757659945487728640","1526586222365315072","2022-05-17 15:31:32","32BeatWriters","#Bengals WRs Tyler Boyd and Ja’Marr Chase catching passes. Tee Higgins is present today but is working out on the stationary bike due to shoulder rehab https://t.co/gWYj2qUSba","Twitter for iPhone",140,,,,false,true,0,17,,,"","","","","","","","","","","","",,"","","en",,,,,,,,,,,,,,,,"1526585802507042817","#Bengals WRs Tyler Boyd and Ja’Marr Chase catching passes. Tee Higgins is present today but is working out on the stationary bike due to shoulder rehab https://t.co/gWYj2qUSba","2022-05-17 15:29:52","Twitter for iPhone",136,17,"3396154067","KelseyLConway","Kelsey Conway",30477,858,24080,"Cincinnati, OH","Cincinnati Bengals beat reporter for @enquirer, @EnqSports and @usatoday",true,,,,,,,"","","","https://twitter.com/32BeatWriters/status/1526586222365315072","NFL Beat Writers","Training camp","We follow all 32 NFL teams' beat writers so you don't have to, even though you should because they do great work.","https://t.co/EhQR4trGzl",false,44609,805,1378,25111,1705,"2016-07-25 19:33:02",false,"https://t.co/EhQR4trGzl","https://discord.gg/qqXkfc3GPs",,"https://pbs.twimg.com/profile_banners/757659945487728640/1650996834",,"http://pbs.twimg.com/profile_images/1484327856905674762/a3aIBH4E_normal.jpg"
"757659945487728640","1526584967362498563","2022-05-17 15:26:33","32BeatWriters","Don’t remember seeing Joe Burrow practice without a knee brace last year #Bengals https://t.co/cVJ4XsYgyc","Twitter for iPhone",120,,,,false,true,0,48,,,"","","","","","","","","","","","",,"","","en",,,,,,,,,,,,,,,,"1526582770679554049","Don’t remember seeing Joe Burrow practice without a knee brace last year #Bengals https://t.co/cVJ4XsYgyc","2022-05-17 15:17:49","Twitter for iPhone",946,48,"58817305","Dan_Hoard","Dan Hoard",44400,1303,23969,"Cincinnati, OH","Radio voice of Cincinnati Bengals, and University of Cincinnati #BearcatsVoice for Football/Basketball. @IMGCollege audio use reserved",false,,,,,,,"","","","https://twitter.com/32BeatWriters/status/1526584967362498563","NFL Beat Writers","Training camp","We follow all 32 NFL teams' beat writers so you don't have to, even though you should because they do great work.","https://t.co/EhQR4trGzl",false,44609,805,1378,25111,1705,"2016-07-25 19:33:02",false,"https://t.co/EhQR4trGzl","https://discord.gg/qqXkfc3GPs",,"https://pbs.twimg.com/profile_banners/757659945487728640/1650996834",,"http://pbs.twimg.com/profile_images/1484327856905674762/a3aIBH4E_normal.jpg"
"757659945487728640","1526584398992351234","2022-05-17 15:24:17","32BeatWriters","A pre-practice look at Ja’Marr Chase, Tyler Boyd and Tee Higgins https://t.co/QmX6naRVY7","Twitter Web App",105,,,,false,true,0,42,,,"","","","","","","","","","","","",,"","","en",,,,,,,,,,,,,,,,"1526582604128047104","A pre-practice look at Ja’Marr Chase, Tyler Boyd and Tee Higgins https://t.co/QmX6naRVY7","2022-05-17 15:17:10","Twitter for iPhone",779,42,"260729364","JamesRapien","James Rapien",25189,2884,80091,"513","Publisher of SI’s @AllBengals and @AllBearcats. Dog Dad🐶 @LockedOnBengals & Locked on NFL host. Subscribe on YouTube: https://t.co/HZvB4rVqTH",true,,,,,,,"","","","https://twitter.com/32BeatWriters/status/1526584398992351234","NFL Beat Writers","Training camp","We follow all 32 NFL teams' beat writers so you don't have to, even though you should because they do great work.","https://t.co/EhQR4trGzl",false,44609,805,1378,25111,1705,"2016-07-25 19:33:02",false,"https://t.co/EhQR4trGzl","https://discord.gg/qqXkfc3GPs",,"https://pbs.twimg.com/profile_banners/757659945487728640/1650996834",,"http://pbs.twimg.com/profile_images/1484327856905674762/a3aIBH4E_normal.jpg"
"757659945487728640","1526394544106905600","2022-05-17 02:49:53","32BeatWriters","Notes on Willis, Burks, Philips, and Haskins. https://t.co/F377I5vTZu","Twitter for iPhone",45,,,,true,false,12,1,,,"","","","","","","","","","","","",,"","","en","1526393588065640449","My first impressions on every member of the @Titans draft class following this weekend's rookie minicamp.

ICYMI https://t.co/lxdqkJHulP https://t.co/8WQAfuIyAK","2022-05-17 02:46:05","Twitter for iPhone",131,9,"41908847","jwyattsports","Jim Wyatt",104984,725,98219,"Nashville","Covered @Titans since the 1999 season, now with https://t.co/vXABIoW83W. Nashville native, Father Ryan grad. I bleed Dodger blue. Anchor Down!",true,,,,,,,,,,,,,,,,,,,,,,"","","","https://twitter.com/32BeatWriters/status/1526394544106905600","NFL Beat Writers","Training camp","We follow all 32 NFL teams' beat writers so you don't have to, even though you should because they do great work.","https://t.co/EhQR4trGzl",false,44609,805,1378,25111,1705,"2016-07-25 19:33:02",false,"https://t.co/EhQR4trGzl","https://discord.gg/qqXkfc3GPs",,"https://pbs.twimg.com/profile_banners/757659945487728640/1650996834",,"http://pbs.twimg.com/profile_images/1484327856905674762/a3aIBH4E_normal.jpg"
"757659945487728640","1526384207118860288","2022-05-17 02:08:48","32BeatWriters","Livin' the dream 🌴

🗣 @mcbtrey","Twitter for iPhone",47,,,,false,true,0,48,,,"","","","","","","","","","","","",,"","","en",,,,,,,,,,,,,,,,"1526384005360234496","Livin' the dream 🌴

🗣 @mcbtrey","2022-05-17 02:08:00","Twitter for Advertisers",547,48,"389038362","AZCardinals","Arizona Cardinals",1095848,356,55890,"Arizona","Bringing you fire content, but it’s a dry heat.",true,,,,,,,"","","","https://twitter.com/32BeatWriters/status/1526384207118860288","NFL Beat Writers","Training camp","We follow all 32 NFL teams' beat writers so you don't have to, even though you should because they do great work.","https://t.co/EhQR4trGzl",false,44609,805,1378,25111,1705,"2016-07-25 19:33:02",false,"https://t.co/EhQR4trGzl","https://discord.gg/qqXkfc3GPs",,"https://pbs.twimg.com/profile_banners/757659945487728640/1650996834",,"http://pbs.twimg.com/profile_images/1484327856905674762/a3aIBH4E_normal.jpg"
"757659945487728640","1526358909807648769","2022-05-17 00:28:17","32BeatWriters","""Baker Mayfield will never play another down for the Cleveland Browns,"" @egoldie80 on Fantasy Dirt @SiriusXMFantasy","Twitter for iPhone",136,,,,false,true,0,3,,,"","","","","","","","","","","","",,"","","en",,,,,,,,,,,,,,,,"1526358727934156800","""Baker Mayfield will never play another down for the Cleveland Browns,"" @egoldie80 on Fantasy Dirt @SiriusXMFantasy","2022-05-17 00:27:33","Twitter Web App",29,3,"37106040","Michael_Fabiano","Michael Fabiano",509382,3997,104355,"Los Angeles, CA","Senior Fantasy Analyst for Sports Illustrated. Host on SiriusXM Fantasy Sports Radio and Westwood One. FSWA Hall of Famer. Formerly of CBS Sports and NFL.",true,,,,,,,"","","","https://twitter.com/32BeatWriters/status/1526358909807648769","NFL Beat Writers","Training camp","We follow all 32 NFL teams' beat writers so you don't have to, even though you should because they do great work.","https://t.co/EhQR4trGzl",false,44609,805,1378,25111,1705,"2016-07-25 19:33:02",false,"https://t.co/EhQR4trGzl","https://discord.gg/qqXkfc3GPs",,"https://pbs.twimg.com/profile_banners/757659945487728640/1650996834",,"http://pbs.twimg.com/profile_images/1484327856905674762/a3aIBH4E_normal.jpg"
"757659945487728640","1526358309896347648","2022-05-17 00:25:54","32BeatWriters","The #Titans' potential QB of the future got his first taste of the NFL over the weekend.
Here are 5 early observations on Malik Willis:
https://t.co/JduPUvPewe

@AllTitansSI @SInow","Twitter for iPhone",140,,,,false,true,0,8,,,"","","","","","","","","","","","",,"","","en",,,,,,,,,,,,,,,,"1526353051149381635","The #Titans' potential QB of the future got his first taste of the NFL over the weekend.
Here are 5 early observations on Malik Willis:
https://t.co/JduPUvPewe

@AllTitansSI @SInow","2022-05-17 00:05:00","Twitter Web App",33,8,"116857325","glennonsports","John Glennon",24835,729,63292,"Nashville, TN","Titans writer, https://t.co/jKxUFxZlun; Preds writer https://t.co/aJWy0DNzx9. Previous: Titans/Preds for The Athletic, The Tennessean. Member: PFWA. UVa. grad. E-mail: glennonsports@gmail.com",true,,,,,,,"","","","https://twitter.com/32BeatWriters/status/1526358309896347648","NFL Beat Writers","Training camp","We follow all 32 NFL teams' beat writers so you don't have to, even though you should because they do great work.","https://t.co/EhQR4trGzl",false,44609,805,1378,25111,1705,"2016-07-25 19:33:02",false,"https://t.co/EhQR4trGzl","https://discord.gg/qqXkfc3GPs",,"https://pbs.twimg.com/profile_banners/757659945487728640/1650996834",,"http://pbs.twimg.com/profile_images/1484327856905674762/a3aIBH4E_normal.jpg"
"757659945487728640","1526358206007721984","2022-05-17 00:25:29","32BeatWriters","Sneaky-good NYG question from Kevin. No surprise. It's close but I'll give a slight edge to Robinson. Toney is probably a touch more talented but Wan'Dale has the ""this regime drafted me"" advantage. He'll get more opportunities. https://t.co/UpS90f5LaB","Twitter for iPhone",139,,,,false,true,0,5,,,"","","","","","","","","","","","",,"","","en",,,,,,,,,,,,,,,,"1526353434508771334","Sneaky-good NYG question from Kevin. No surprise. It's close but I'll give a slight edge to Robinson. Toney is probably a touch more talented but Wan'Dale has the ""this regime drafted me"" advantage. He'll get more opportunities. https://t.co/UpS90f5LaB","2022-05-17 00:06:31","Twitter Web App",19,5,"21668417","ChrisTrapasso","Chris Trapasso",24066,1949,108508,"Western New York","NFL Draft/young NFL player analyst @CBSSports. WNYer. Scouting Gradebook founder, the internet's first customizable player grading system. Buy one @ link below",true,,,,,,,"","","","https://twitter.com/32BeatWriters/status/1526358206007721984","NFL Beat Writers","Training camp","We follow all 32 NFL teams' beat writers so you don't have to, even though you should because they do great work.","https://t.co/EhQR4trGzl",false,44609,805,1378,25111,1705,"2016-07-25 19:33:02",false,"https://t.co/EhQR4trGzl","https://discord.gg/qqXkfc3GPs",,"https://pbs.twimg.com/profile_banners/757659945487728640/1650996834",,"http://pbs.twimg.com/profile_images/1484327856905674762/a3aIBH4E_normal.jpg"
"757659945487728640","1526357959416193027","2022-05-17 00:24:30","32BeatWriters","""Fine"" might be a good word to describe that group. Not dynamic or collection of WRs that scares the opposition but fine given Baltimore's offensive philosophy. Watch out for Makai Polk to be a Willie Snead type in the offense too. https://t.co/6kKZJezkGR","Twitter for iPhone",140,,,,false,true,0,2,,,"","","","","","","","","","","","",,"","","en",,,,,,,,,,,,,,,,"1526355759985983488","""Fine"" might be a good word to describe that group. Not dynamic or collection of WRs that scares the opposition but fine given Baltimore's offensive philosophy. Watch out for Makai Polk to be a Willie Snead type in the offense too. https://t.co/6kKZJezkGR","2022-05-17 00:15:46","Twitter Web App",6,2,"21668417","ChrisTrapasso","Chris Trapasso",24066,1949,108508,"Western New York","NFL Draft/young NFL player analyst @CBSSports. WNYer. Scouting Gradebook founder, the internet's first customizable player grading system. Buy one @ link below",true,,,,,,,"","","","https://twitter.com/32BeatWriters/status/1526357959416193027","NFL Beat Writers","Training camp","We follow all 32 NFL teams' beat writers so you don't have to, even though you should because they do great work.","https://t.co/EhQR4trGzl",false,44609,805,1378,25111,1705,"2016-07-25 19:33:02",false,"https://t.co/EhQR4trGzl","https://discord.gg/qqXkfc3GPs",,"https://pbs.twimg.com/profile_banners/757659945487728640/1650996834",,"http://pbs.twimg.com/profile_images/1484327856905674762/a3aIBH4E_normal.jpg"
"757659945487728640","1526308478825938953","2022-05-16 21:07:53","32BeatWriters","Jalen Tolbert: “Evaluating WRs in rookie minicamps can be tough because there's no previous rapport with the QBs. Didn't really see a contested-ball type of situation
where Tolbert was so successful in college, but he looked smooth in
his routes and got separation off the line.” https://t.co/pDDzmGhMrx","Twitter for iPhone",279,,,,true,false,8,3,,,"","","","","","","","","","","","",,"","","en","1526306358655598595","Are you wondering who stood out during last week's Rookie Mini Camp? We've got you covered! #Cowboys 
READ: https://t.co/O0Guh2nIhA","2022-05-16 20:59:27","Twitter Web App",9,2,"391574014","Kyle_Youmans","Kyle Youmans",9669,758,12786,"Texas, USA","🎙@DallasCowboys TV Host | Pregame/Postgame, Draft Analyst, @TalkinCowboys & @TheDraftShow | @Friday_Stars | 🤍@LCatherine12",true,,,,,,,,,,,,,,,,,,,,,,"","","","https://twitter.com/32BeatWriters/status/1526308478825938953","NFL Beat Writers","Training camp","We follow all 32 NFL teams' beat writers so you don't have to, even though you should because they do great work.","https://t.co/EhQR4trGzl",false,44609,805,1378,25111,1705,"2016-07-25 19:33:02",false,"https://t.co/EhQR4trGzl","https://discord.gg/qqXkfc3GPs",,"https://pbs.twimg.com/profile_banners/757659945487728640/1650996834",,"http://pbs.twimg.com/profile_images/1484327856905674762/a3aIBH4E_normal.jpg"
"757659945487728640","1526258101095211010","2022-05-16 17:47:42","32BeatWriters","What I've been told all along was that Watson would be one of the last, if not the last, person interviewed as part of the league's investigation. So this meeting is a sign we are getting closer to some sort of resolution on the football questions. https://t.co/XGoLeGlG5O","Twitter for iPhone",140,,,,false,true,0,45,,,"","","","","","","","","","","","",,"","","en",,,,,,,,,,,,,,,,"1526257707186933760","What I've been told all along was that Watson would be one of the last, if not the last, person interviewed as part of the league's investigation. So this meeting is a sign we are getting closer to some sort of resolution on the football questions. https://t.co/XGoLeGlG5O","2022-05-16 17:46:08","TweetDeck",221,45,"250271653","bylindsayhjones","Lindsay Jones",45322,2267,47431,"Denver, Colo.","Senior Writer at @theathleticnfl. President of @pfwawriters. Come for the NFL coverage, stay for the #momlife. 🏈 (🏃🏼‍♀️ #oisellevolee)",true,,,,,,,"","","","https://twitter.com/32BeatWriters/status/1526258101095211010","NFL Beat Writers","Training camp","We follow all 32 NFL teams' beat writers so you don't have to, even though you should because they do great work.","https://t.co/EhQR4trGzl",false,44609,805,1378,25111,1705,"2016-07-25 19:33:02",false,"https://t.co/EhQR4trGzl","https://discord.gg/qqXkfc3GPs",,"https://pbs.twimg.com/profile_banners/757659945487728640/1650996834",,"http://pbs.twimg.com/profile_images/1484327856905674762/a3aIBH4E_normal.jpg"
"757659945487728640","1526252432354955264","2022-05-16 17:25:10","32BeatWriters","Ian Rapoport doubling down that Baker Mayfield could start for the #Browns if Deshaun Watson faces a lengthy suspension. Hmmm.","Twitter Web App",139,,,,false,true,0,50,,,"","","","","","","","","","","","",,"","","en",,,,,,,,,,,,,,,,"1526249559084650496","Ian Rapoport doubling down that Baker Mayfield could start for the #Browns if Deshaun Watson faces a lengthy suspension. Hmmm.","2022-05-16 17:13:45","Twitter Web App",742,50,"1228890540","NickPedone12","Nick Pedone",6162,761,20733,"Cleveland, OH","Cleveland sports podcaster & writer. @KentStateMDJ Alum.",true,,,,,,,"","","","https://twitter.com/32BeatWriters/status/1526252432354955264","NFL Beat Writers","Training camp","We follow all 32 NFL teams' beat writers so you don't have to, even though you should because they do great work.","https://t.co/EhQR4trGzl",false,44609,805,1378,25111,1705,"2016-07-25 19:33:02",false,"https://t.co/EhQR4trGzl","https://discord.gg/qqXkfc3GPs",,"https://pbs.twimg.com/profile_banners/757659945487728640/1650996834",,"http://pbs.twimg.com/profile_images/1484327856905674762/a3aIBH4E_normal.jpg"
"757659945487728640","1526233690170441731","2022-05-16 16:10:42","32BeatWriters","Ezekiel Elliott before/after tearing his PCL in 2021:

Weeks 1-4: 79.9 PFF rush grade, 5.3 YPC, 3.4 YAC per carry, PPR RB6 (17.6 fantasy points per game)

Weeks 5-18: 66.4 PFF rush grade, 3.8 YPC, 2.5 YAC per carry, RB8 (14 fantasy points per game)","Twitter Web App",140,,,,false,true,0,10,,,"","","","","","","","","","","","",,"","","en",,,,,,,,,,,,,,,,"1526233561594044419","Ezekiel Elliott before/after tearing his PCL in 2021:

Weeks 1-4: 79.9 PFF rush grade, 5.3 YPC, 3.4 YAC per carry, PPR RB6 (17.6 fantasy points per game)

Weeks 5-18: 66.4 PFF rush grade, 3.8 YPC, 2.5 YAC per carry, RB8 (14 fantasy points per game)","2022-05-16 16:10:11","Twitter Web App",52,10,"43192090","Ihartitz","Ian Hartitz",94995,923,45561,"Cincinnati, OH","@PFF | President of the Cordarrelle Patterson fan club | Auden Tate WR1 | USFL why not | Great day to be great | Host: PFF Fantasy Football Podcast",false,,,,,,,"","","","https://twitter.com/32BeatWriters/status/1526233690170441731","NFL Beat Writers","Training camp","We follow all 32 NFL teams' beat writers so you don't have to, even though you should because they do great work.","https://t.co/EhQR4trGzl",false,44609,805,1378,25111,1705,"2016-07-25 19:33:02",false,"https://t.co/EhQR4trGzl","https://discord.gg/qqXkfc3GPs",,"https://pbs.twimg.com/profile_banners/757659945487728640/1650996834",,"http://pbs.twimg.com/profile_images/1484327856905674762/a3aIBH4E_normal.jpg"
"757659945487728640","1526233646054756352","2022-05-16 16:10:31","32BeatWriters","Just wanna Retire A Steeler","Twitter Web App",37,,,,false,true,0,5600,,,"","","","","","","","","","","","",,"","","en",,,,,,,,,,,,,,,,"1526232175372378113","Just wanna Retire A Steeler","2022-05-16 16:04:41","Twitter for iPhone",59303,5600,"224221596","AB84","AB",1638247,2095,19966,"Call God","Business Is Boomin #CallGod #84/7 Super Bowl Champion LV Himmothy",true,,,,,,,"","","","https://twitter.com/32BeatWriters/status/1526233646054756352","NFL Beat Writers","Training camp","We follow all 32 NFL teams' beat writers so you don't have to, even though you should because they do great work.","https://t.co/EhQR4trGzl",false,44609,805,1378,25111,1705,"2016-07-25 19:33:02",false,"https://t.co/EhQR4trGzl","https://discord.gg/qqXkfc3GPs",,"https://pbs.twimg.com/profile_banners/757659945487728640/1650996834",,"http://pbs.twimg.com/profile_images/1484327856905674762/a3aIBH4E_normal.jpg"
"757659945487728640","1526228938971918336","2022-05-16 15:51:49","32BeatWriters","I'm also told that NFL officials are currently scheduled to meet with #Browns QB Deshaun Watson in Texas this week, per league sources. 

@BovadaOfficial","Twitter Web App",140,,,,false,true,0,317,,,"","","","","","","","","","","","",,"","","en",,,,,,,,,,,,,,,,"1526228226300944386","I'm also told that NFL officials are currently scheduled to meet with #Browns QB Deshaun Watson in Texas this week, per league sources. 

@BovadaOfficial","2022-05-16 15:48:59","TweetDeck",1522,317,"41369172","JosinaAnderson","IG: JosinaAnderson",220906,4601,52738,"In Journalistic Freedom","Emmy & NABJ Award Winner, @CBSSportsHQ, Host of 'The Crew' & 'Undefined with Josina Anderson.' Alum ESPN, Showtime, FOX31. JA@UndefinedWithJosinaAnderson.com",true,,,,,,,"","","","https://twitter.com/32BeatWriters/status/1526228938971918336","NFL Beat Writers","Training camp","We follow all 32 NFL teams' beat writers so you don't have to, even though you should because they do great work.","https://t.co/EhQR4trGzl",false,44609,805,1378,25111,1705,"2016-07-25 19:33:02",false,"https://t.co/EhQR4trGzl","https://discord.gg/qqXkfc3GPs",,"https://pbs.twimg.com/profile_banners/757659945487728640/1650996834",,"http://pbs.twimg.com/profile_images/1484327856905674762/a3aIBH4E_normal.jpg"
