"user_id","status_id","created_at","screen_name","text","source","display_text_width","reply_to_status_id","reply_to_user_id","reply_to_screen_name","is_quote","is_retweet","favorite_count","retweet_count","quote_count","reply_count","hashtags","symbols","urls_url","urls_t.co","urls_expanded_url","media_url","media_t.co","media_expanded_url","media_type","ext_media_url","ext_media_t.co","ext_media_expanded_url","ext_media_type","mentions_user_id","mentions_screen_name","lang","quoted_status_id","quoted_text","quoted_created_at","quoted_source","quoted_favorite_count","quoted_retweet_count","quoted_user_id","quoted_screen_name","quoted_name","quoted_followers_count","quoted_friends_count","quoted_statuses_count","quoted_location","quoted_description","quoted_verified","retweet_status_id","retweet_text","retweet_created_at","retweet_source","retweet_favorite_count","retweet_retweet_count","retweet_user_id","retweet_screen_name","retweet_name","retweet_followers_count","retweet_friends_count","retweet_statuses_count","retweet_location","retweet_description","retweet_verified","place_url","place_name","place_full_name","place_type","country","country_code","geo_coords","coords_coords","bbox_coords","status_url","name","location","description","url","protected","followers_count","friends_count","listed_count","statuses_count","favourites_count","account_created_at","verified","profile_url","profile_expanded_url","account_lang","profile_banner_url","profile_background_url","profile_image_url"
"757659945487728640","1522037013788061696","2022-05-05 02:14:36","32BeatWriters","""I think the Falcons could line up Cordarrelle Patterson at wide receiver more than running back next season,"" @mikerothstein on Fantasy Dirt @SiriusXMFantasy.","Twitter Web App",140,,,,false,true,0,5,,,"","","","","","","","","","","","",,"","","en",,,,,,,,,,,,,,,,"1522010715971743744","""I think the Falcons could line up Cordarrelle Patterson at wide receiver more than running back next season,"" @mikerothstein on Fantasy Dirt @SiriusXMFantasy.","2022-05-05 00:30:06","Twitter Web App",28,5,"37106040","Michael_Fabiano","Michael Fabiano",509533,3980,104000,"Los Angeles, CA","Senior Fantasy Analyst for Sports Illustrated. Host on SiriusXM Fantasy Sports Radio and Westwood One. FSWA Hall of Famer. Formerly of CBS Sports and NFL.",true,,,,,,,"","","","https://twitter.com/32BeatWriters/status/1522037013788061696","NFL Beat Writers","Training camp","We follow all 32 NFL teams' beat writers so you don't have to, even though you should because they do great work.","https://t.co/EhQR4trGzl",false,44517,876,1370,24930,1689,"2016-07-25 19:33:02",false,"https://t.co/EhQR4trGzl","https://discord.gg/qqXkfc3GPs",,"https://pbs.twimg.com/profile_banners/757659945487728640/1650996834",,"http://pbs.twimg.com/profile_images/1484327856905674762/a3aIBH4E_normal.jpg"
"757659945487728640","1522036998353084418","2022-05-05 02:14:33","32BeatWriters","""There is absolutely a chance that Tyler Allgeier could be the Falcons early down back [as a rookie] and use Cordarrelle Patterson more in a hybrid role,"" @mikerothstein on Fantasy Dirt @SiriusXMFantasy.","Twitter Web App",140,,,,false,true,0,5,,,"","","","","","","","","","","","",,"","","en",,,,,,,,,,,,,,,,"1522012423300861952","""There is absolutely a chance that Tyler Allgeier could be the Falcons early down back [as a rookie] and use Cordarrelle Patterson more in a hybrid role,"" @mikerothstein on Fantasy Dirt @SiriusXMFantasy.","2022-05-05 00:36:53","Twitter Web App",33,5,"37106040","Michael_Fabiano","Michael Fabiano",509533,3980,104000,"Los Angeles, CA","Senior Fantasy Analyst for Sports Illustrated. Host on SiriusXM Fantasy Sports Radio and Westwood One. FSWA Hall of Famer. Formerly of CBS Sports and NFL.",true,,,,,,,"","","","https://twitter.com/32BeatWriters/status/1522036998353084418","NFL Beat Writers","Training camp","We follow all 32 NFL teams' beat writers so you don't have to, even though you should because they do great work.","https://t.co/EhQR4trGzl",false,44517,876,1370,24930,1689,"2016-07-25 19:33:02",false,"https://t.co/EhQR4trGzl","https://discord.gg/qqXkfc3GPs",,"https://pbs.twimg.com/profile_banners/757659945487728640/1650996834",,"http://pbs.twimg.com/profile_images/1484327856905674762/a3aIBH4E_normal.jpg"
"757659945487728640","1522036956410040321","2022-05-05 02:14:23","32BeatWriters","""If Ryan Tannehill returns to form and plays well, Malik Willis might not get a chance to start until 2024,"" @jwyattsports on Fantasy Dirt @SiriusXMFantasy.","Twitter Web App",140,,,,false,true,0,5,,,"","","","","","","","","","","","",,"","","en",,,,,,,,,,,,,,,,"1522027686738096128","""If Ryan Tannehill returns to form and plays well, Malik Willis might not get a chance to start until 2024,"" @jwyattsports on Fantasy Dirt @SiriusXMFantasy.","2022-05-05 01:37:33","Twitter Web App",17,5,"37106040","Michael_Fabiano","Michael Fabiano",509533,3980,104000,"Los Angeles, CA","Senior Fantasy Analyst for Sports Illustrated. Host on SiriusXM Fantasy Sports Radio and Westwood One. FSWA Hall of Famer. Formerly of CBS Sports and NFL.",true,,,,,,,"","","","https://twitter.com/32BeatWriters/status/1522036956410040321","NFL Beat Writers","Training camp","We follow all 32 NFL teams' beat writers so you don't have to, even though you should because they do great work.","https://t.co/EhQR4trGzl",false,44517,876,1370,24930,1689,"2016-07-25 19:33:02",false,"https://t.co/EhQR4trGzl","https://discord.gg/qqXkfc3GPs",,"https://pbs.twimg.com/profile_banners/757659945487728640/1650996834",,"http://pbs.twimg.com/profile_images/1484327856905674762/a3aIBH4E_normal.jpg"
"757659945487728640","1522036567837138944","2022-05-05 02:12:50","32BeatWriters","""I wouldn't be surprised if Kyle Philips makes an impact [for the Titans] in his rookie year,"" @jwyattsports on Fantasy Dirt @SiriusXMFantasy.","Twitter Web App",140,,,,false,true,0,2,,,"","","","","","","","","","","","",,"","","en",,,,,,,,,,,,,,,,"1522027385008230401","""I wouldn't be surprised if Kyle Philips makes an impact [for the Titans] in his rookie year,"" @jwyattsports on Fantasy Dirt @SiriusXMFantasy.","2022-05-05 01:36:21","Twitter Web App",18,2,"37106040","Michael_Fabiano","Michael Fabiano",509533,3980,104000,"Los Angeles, CA","Senior Fantasy Analyst for Sports Illustrated. Host on SiriusXM Fantasy Sports Radio and Westwood One. FSWA Hall of Famer. Formerly of CBS Sports and NFL.",true,,,,,,,"","","","https://twitter.com/32BeatWriters/status/1522036567837138944","NFL Beat Writers","Training camp","We follow all 32 NFL teams' beat writers so you don't have to, even though you should because they do great work.","https://t.co/EhQR4trGzl",false,44517,876,1370,24930,1689,"2016-07-25 19:33:02",false,"https://t.co/EhQR4trGzl","https://discord.gg/qqXkfc3GPs",,"https://pbs.twimg.com/profile_banners/757659945487728640/1650996834",,"http://pbs.twimg.com/profile_images/1484327856905674762/a3aIBH4E_normal.jpg"
"757659945487728640","1521680240501829633","2022-05-04 02:36:55","32BeatWriters","“We can’t wait to get you here and throw you the ball a whole bunch.”

@Greg_Dulcich gets “The Call” from the 303! https://t.co/KrhpmqGwt5","Twitter for iPhone",140,,,,false,true,0,105,,,"","","","","","","","","","","","",,"","","en",,,,,,,,,,,,,,,,"1520274497668059136","“We can’t wait to get you here and throw you the ball a whole bunch.”

@Greg_Dulcich gets “The Call” from the 303! https://t.co/KrhpmqGwt5","2022-04-30 05:31:00","Twitter Media Studio",783,105,"18734310","Broncos","Denver Broncos",2722167,4785,70610,"Denver, CO","Twitter home of the three-time Super Bowl champions: XXXII, XXXIII and #SB50",true,,,,,,,"","","","https://twitter.com/32BeatWriters/status/1521680240501829633","NFL Beat Writers","Training camp","We follow all 32 NFL teams' beat writers so you don't have to, even though you should because they do great work.","https://t.co/EhQR4trGzl",false,44517,876,1370,24930,1689,"2016-07-25 19:33:02",false,"https://t.co/EhQR4trGzl","https://discord.gg/qqXkfc3GPs",,"https://pbs.twimg.com/profile_banners/757659945487728640/1650996834",,"http://pbs.twimg.com/profile_images/1484327856905674762/a3aIBH4E_normal.jpg"
