"757659945487728640","1529135968422346755","2022-05-24 16:23:19","32BeatWriters","Panthers RB Christian McCaffrey out at OTAs here doing Christian McCaffrey things. Looks extremely fast and quick.","Twitter Web App",131,,,,false,true,0,11,,,"","","","","","","","","","","","",,"","","en",,,,,,,,,,,,,,,,"1529135683310346240","Panthers RB Christian McCaffrey out at OTAs here doing Christian McCaffrey things. Looks extremely fast and quick.","2022-05-24 16:22:11","Twitter for iPhone",79,11,"62934861","SteveReedAP","Steve Reed",20798,206,49822,"Charlotte, North Carolina","Sports Writer for The Associated Press in Charlotte, N.C., covering the Carolina Panthers, Charlotte Hornets, Winter Olympics & anything else sports related.",true,,,,,,,"","","","https://twitter.com/32BeatWriters/status/1529135968422346755","NFL Beat Writers","Training camp","We follow all 32 NFL teams' beat writers so you don't have to, even though you should because they do great work.","https://t.co/EhQR4trGzl",false,44921,814,1377,25251,1716,"2016-07-25 19:33:02",false,"https://t.co/EhQR4trGzl","https://discord.gg/qqXkfc3GPs",,"https://pbs.twimg.com/profile_banners/757659945487728640/1650996834",,"http://pbs.twimg.com/profile_images/1484327856905674762/a3aIBH4E_normal.jpg"
"757659945487728640","1529135937665499137","2022-05-24 16:23:12","32BeatWriters","Vrabel: Malik Willis making strides, and every day is a learning process for him. Has a great attitude @Titans","Twitter Web App",128,,,,false,true,0,23,,,"","","","","","","","","","","","",,"","","en",,,,,,,,,,,,,,,,"1529135718794240006","Vrabel: Malik Willis making strides, and every day is a learning process for him. Has a great attitude @Titans","2022-05-24 16:22:19","TweetDeck",427,23,"41908847","jwyattsports","Jim Wyatt",105128,725,98279,"Nashville","Covered @Titans since the 1999 season, now with https://t.co/vXABIoW83W. Nashville native, Father Ryan grad. I bleed Dodger blue. Anchor Down!",true,,,,,,,"","","","https://twitter.com/32BeatWriters/status/1529135937665499137","NFL Beat Writers","Training camp","We follow all 32 NFL teams' beat writers so you don't have to, even though you should because they do great work.","https://t.co/EhQR4trGzl",false,44921,814,1377,25251,1716,"2016-07-25 19:33:02",false,"https://t.co/EhQR4trGzl","https://discord.gg/qqXkfc3GPs",,"https://pbs.twimg.com/profile_banners/757659945487728640/1650996834",,"http://pbs.twimg.com/profile_images/1484327856905674762/a3aIBH4E_normal.jpg"
"757659945487728640","1529135727560298496","2022-05-24 16:22:22","32BeatWriters","Zach Wilson just dumped it down to Breece hall and he turned on the Jets and showed an explosive burst.","Twitter Web App",119,,,,false,true,0,30,,,"","","","","","","","","","","","",,"","","en",,,,,,,,,,,,,,,,"1529135553266032640","Zach Wilson just dumped it down to Breece hall and he turned on the Jets and showed an explosive burst.","2022-05-24 16:21:40","Twitter for iPhone",836,30,"334179189","Djbienaime","DJ Bien-Aime",20862,1455,67077,"Miami ✈️New York, USA","Galatians 5:22| Jets beat reporter for @NYDNsports| @columbiajourn & @uofltrackxc alum. #JUCO #NABJ. 🇭🇹. Disagreements are healthy. RT=/=endorsement",true,,,,,,,"","","","https://twitter.com/32BeatWriters/status/1529135727560298496","NFL Beat Writers","Training camp","We follow all 32 NFL teams' beat writers so you don't have to, even though you should because they do great work.","https://t.co/EhQR4trGzl",false,44921,814,1377,25251,1716,"2016-07-25 19:33:02",false,"https://t.co/EhQR4trGzl","https://discord.gg/qqXkfc3GPs",,"https://pbs.twimg.com/profile_banners/757659945487728640/1650996834",,"http://pbs.twimg.com/profile_images/1484327856905674762/a3aIBH4E_normal.jpg"
"757659945487728640","1529135513424252934","2022-05-24 16:21:31","32BeatWriters","Panthers WR DJ Moore collided on a deep cross with DB Myles Hartsfield, who was also going for the ball at OTAs.Moore was seen stretching his shoulder afterward but returned to practice two plays later and appears fine.","Twitter Web App",139,,,,false,true,0,5,,,"","","","","","","","","","","","",,"","","en",,,,,,,,,,,,,,,,"1529135285447151617","Panthers WR DJ Moore collided on a deep cross with DB Myles Hartsfield, who was also going for the ball at OTAs.Moore was seen stretching his shoulder afterward but returned to practice two plays later and appears fine.","2022-05-24 16:20:36","Twitter for iPhone",89,5,"62934861","SteveReedAP","Steve Reed",20798,206,49822,"Charlotte, North Carolina","Sports Writer for The Associated Press in Charlotte, N.C., covering the Carolina Panthers, Charlotte Hornets, Winter Olympics & anything else sports related.",true,,,,,,,"","","","https://twitter.com/32BeatWriters/status/1529135513424252934","NFL Beat Writers","Training camp","We follow all 32 NFL teams' beat writers so you don't have to, even though you should because they do great work.","https://t.co/EhQR4trGzl",false,44921,814,1377,25251,1716,"2016-07-25 19:33:02",false,"https://t.co/EhQR4trGzl","https://discord.gg/qqXkfc3GPs",,"https://pbs.twimg.com/profile_banners/757659945487728640/1650996834",,"http://pbs.twimg.com/profile_images/1484327856905674762/a3aIBH4E_normal.jpg"
"757659945487728640","1529135500841328640","2022-05-24 16:21:28","32BeatWriters","Wilson - Wilson on skinny post. Pass little low &amp; behind Garrett. No completion. #Jets","Twitter Web App",111,,,,false,true,0,8,,,"","","","","","","","","","","","",,"","","en",,,,,,,,,,,,,,,,"1529135386219499522","Wilson - Wilson on skinny post. Pass little low &amp; behind Garrett. No completion. #Jets","2022-05-24 16:21:00","Twitter for iPhone",282,8,"314776155","Connor_J_Hughes","Connor Hughes",56039,963,83097,"Princeton, NJ","Covering the Jets for @TheAthletic | Analyst & TV guy for @SNYtv, @CBSNewYork | #CantWait podcast co-host | Big fan of my dog",true,,,,,,,"","","","https://twitter.com/32BeatWriters/status/1529135500841328640","NFL Beat Writers","Training camp","We follow all 32 NFL teams' beat writers so you don't have to, even though you should because they do great work.","https://t.co/EhQR4trGzl",false,44921,814,1377,25251,1716,"2016-07-25 19:33:02",false,"https://t.co/EhQR4trGzl","https://discord.gg/qqXkfc3GPs",,"https://pbs.twimg.com/profile_banners/757659945487728640/1650996834",,"http://pbs.twimg.com/profile_images/1484327856905674762/a3aIBH4E_normal.jpg"
"757659945487728640","1529132079782297601","2022-05-24 16:07:52","32BeatWriters","Sammy Watkins is also not here. LaFleur said he’s been here for the majority of the offseason so far, however.","Twitter Web App",130,,,,false,true,0,12,,,"","","","","","","","","","","","",,"","","en",,,,,,,,,,,,,,,,"1529132012145188865","Sammy Watkins is also not here. LaFleur said he’s been here for the majority of the offseason so far, however.","2022-05-24 16:07:36","Twitter for iPhone",213,12,"1087647560","mattschneidman","Matt Schneidman",54107,675,34299,"Green Bay","Green Bay Packers beat writer for The Athletic • Podcast: Head of the Pack • @dailyorange alum • mschneidman@theathletic.com",true,,,,,,,"","","","https://twitter.com/32BeatWriters/status/1529132079782297601","NFL Beat Writers","Training camp","We follow all 32 NFL teams' beat writers so you don't have to, even though you should because they do great work.","https://t.co/EhQR4trGzl",false,44921,814,1377,25251,1716,"2016-07-25 19:33:02",false,"https://t.co/EhQR4trGzl","https://discord.gg/qqXkfc3GPs",,"https://pbs.twimg.com/profile_banners/757659945487728640/1650996834",,"http://pbs.twimg.com/profile_images/1484327856905674762/a3aIBH4E_normal.jpg"
"757659945487728640","1529131371419009024","2022-05-24 16:05:03","32BeatWriters","#Packers coach Matt LaFleur says Aaron Rodgers is not at OTAs, which are voluntary. He spoke with the QB last night -- ""which was great -- about tweaks to offense and such, says Rodgers was in ""good spirits."" Doesn't know if he'll be at OTAs next week. It'll be Rodgers' choice.","Twitter Web App",140,,,,false,true,0,7,,,"","","","","","","","","","","","",,"","","en",,,,,,,,,,,,,,,,"1529131172994985984","#Packers coach Matt LaFleur says Aaron Rodgers is not at OTAs, which are voluntary. He spoke with the QB last night -- ""which was great -- about tweaks to offense and such, says Rodgers was in ""good spirits."" Doesn't know if he'll be at OTAs next week. It'll be Rodgers' choice.","2022-05-24 16:04:16","TweetDeck",167,7,"1686423121","ByRyanWood","Ryan Wood",50050,499,41774,"Green Bay, Wisc.","Packers beat writer for Green Bay Press-Gazette, @USATODAY Network. “That Dude” for WSSP. Storyteller. Proud dad. From the cornfields of Indiana. Off he goes…",true,,,,,,,"","","","https://twitter.com/32BeatWriters/status/1529131371419009024","NFL Beat Writers","Training camp","We follow all 32 NFL teams' beat writers so you don't have to, even though you should because they do great work.","https://t.co/EhQR4trGzl",false,44921,814,1377,25251,1716,"2016-07-25 19:33:02",false,"https://t.co/EhQR4trGzl","https://discord.gg/qqXkfc3GPs",,"https://pbs.twimg.com/profile_banners/757659945487728640/1650996834",,"http://pbs.twimg.com/profile_images/1484327856905674762/a3aIBH4E_normal.jpg"
"757659945487728640","1529129977295388672","2022-05-24 15:59:31","32BeatWriters","New #Jets RB Breece Hall https://t.co/Zy3zE05FRD","Twitter Web App",69,,,,false,true,0,44,,,"","","","","","","","","","","","",,"","","en",,,,,,,,,,,,,,,,"1529129553272229888","New #Jets RB Breece Hall https://t.co/Zy3zE05FRD","2022-05-24 15:57:50","Twitter for iPhone",876,44,"314776155","Connor_J_Hughes","Connor Hughes",56039,963,83097,"Princeton, NJ","Covering the Jets for @TheAthletic | Analyst & TV guy for @SNYtv, @CBSNewYork | #CantWait podcast co-host | Big fan of my dog",true,,,,,,,"","","","https://twitter.com/32BeatWriters/status/1529129977295388672","NFL Beat Writers","Training camp","We follow all 32 NFL teams' beat writers so you don't have to, even though you should because they do great work.","https://t.co/EhQR4trGzl",false,44921,814,1377,25251,1716,"2016-07-25 19:33:02",false,"https://t.co/EhQR4trGzl","https://discord.gg/qqXkfc3GPs",,"https://pbs.twimg.com/profile_banners/757659945487728640/1650996834",,"http://pbs.twimg.com/profile_images/1484327856905674762/a3aIBH4E_normal.jpg"
"757659945487728640","1529129500306558978","2022-05-24 15:57:37","32BeatWriters","Ryan Tannehill, Logan Woodside and Malik Willis working through individual drills. First bumps at the end from QB coach Pat O'Hara https://t.co/sTccDMVSSr","Twitter Web App",140,,,,false,true,0,19,,,"","","","","","","","","","","","",,"","","en",,,,,,,,,,,,,,,,"1529129180738232323","Ryan Tannehill, Logan Woodside and Malik Willis working through individual drills. First bumps at the end from QB coach Pat O'Hara https://t.co/sTccDMVSSr","2022-05-24 15:56:21","Twitter for iPhone",306,19,"2303367752","BuckReising","Buck Reising",23961,909,54127,"Music City","Covering #Titans for @AtoZSports | Weekdays 10-1 on @1045TheZone | The Install with @gregcosell | Primetime 8pm CT | 615 Sessions Pod",true,,,,,,,"","","","https://twitter.com/32BeatWriters/status/1529129500306558978","NFL Beat Writers","Training camp","We follow all 32 NFL teams' beat writers so you don't have to, even though you should because they do great work.","https://t.co/EhQR4trGzl",false,44921,814,1377,25251,1716,"2016-07-25 19:33:02",false,"https://t.co/EhQR4trGzl","https://discord.gg/qqXkfc3GPs",,"https://pbs.twimg.com/profile_banners/757659945487728640/1650996834",,"http://pbs.twimg.com/profile_images/1484327856905674762/a3aIBH4E_normal.jpg"
"757659945487728640","1529129353187102720","2022-05-24 15:57:02","32BeatWriters","Asked abotu Tua, Coach said the word that comes to mind is instictiveness. How Tua thinks about the game of football through the lens of the QB position, it's hard to describe, but  Coach McDaniel says he now has a better feel for what people said about Tua and that instictivenes","Twitter Web App",140,,,,false,true,0,9,,,"","","","","","","","","","","","",,"","","en",,,,,,,,,,,,,,,,"1529129117718876160","Asked abotu Tua, Coach said the word that comes to mind is instictiveness. How Tua thinks about the game of football through the lens of the QB position, it's hard to describe, but  Coach McDaniel says he now has a better feel for what people said about Tua and that instictivenes","2022-05-24 15:56:06","Twitter Web App",82,9,"763497955936444416","WingfieldNFL","Travis Wingfield",36641,686,71385,"Miami, FL","Host of the Drive Time Podcast, part of the @MiamiDolphins Podcast Network. Writer https://t.co/4zmBWubD1q, PNW ✈️ MIA, Washington State University alum",true,,,,,,,"","","","https://twitter.com/32BeatWriters/status/1529129353187102720","NFL Beat Writers","Training camp","We follow all 32 NFL teams' beat writers so you don't have to, even though you should because they do great work.","https://t.co/EhQR4trGzl",false,44921,814,1377,25251,1716,"2016-07-25 19:33:02",false,"https://t.co/EhQR4trGzl","https://discord.gg/qqXkfc3GPs",,"https://pbs.twimg.com/profile_banners/757659945487728640/1650996834",,"http://pbs.twimg.com/profile_images/1484327856905674762/a3aIBH4E_normal.jpg"
"757659945487728640","1529129307049697282","2022-05-24 15:56:51","32BeatWriters","Antonio Gibson addressing the media. He’s excited to get to work with the rest of the offense and was impressed with Carson Wentz today","Twitter Web App",140,,,,false,true,0,3,,,"","","","","","","","","","","","",,"","","en",,,,,,,,,,,,,,,,"1529129076006559744","Antonio Gibson addressing the media. He’s excited to get to work with the rest of the offense and was impressed with Carson Wentz today","2022-05-24 15:55:56","Twitter for iPhone",35,3,"2247155275","ZachSelbyWC","Zach Selby",5068,832,11312,"Washington, DC","Washington Commanders Staff Writer @Commanders | #HTTC | @merrillcollege '18 | @MaryvilleC '15 | https://t.co/PatKYHLk0c",false,,,,,,,"","","","https://twitter.com/32BeatWriters/status/1529129307049697282","NFL Beat Writers","Training camp","We follow all 32 NFL teams' beat writers so you don't have to, even though you should because they do great work.","https://t.co/EhQR4trGzl",false,44921,814,1377,25251,1716,"2016-07-25 19:33:02",false,"https://t.co/EhQR4trGzl","https://discord.gg/qqXkfc3GPs",,"https://pbs.twimg.com/profile_banners/757659945487728640/1650996834",,"http://pbs.twimg.com/profile_images/1484327856905674762/a3aIBH4E_normal.jpg"
"757659945487728640","1529129278360657921","2022-05-24 15:56:44","32BeatWriters","Mike McDaniel, on Tua: ""Instinctiveness...You can tell the player's played the position for a long time and he thinks the game of football through the QB position. Been very encouraged"" about Tua's development.","Twitter Web App",140,,,,false,true,0,8,,,"","","","","","","","","","","","",,"","","en",,,,,,,,,,,,,,,,"1529129043886473216","Mike McDaniel, on Tua: ""Instinctiveness...You can tell the player's played the position for a long time and he thinks the game of football through the QB position. Been very encouraged"" about Tua's development.","2022-05-24 15:55:48","Twitter Web App",49,8,"29234146","AdamHBeasley","Adam Beasley",58423,1321,70139,"Miami, FL","NFL Director for Pro Football Network | Miami Herald alum | abeasley at PFN365 dot com | “The least awful."" -- Ryan Fitzpatrick",true,,,,,,,"","","","https://twitter.com/32BeatWriters/status/1529129278360657921","NFL Beat Writers","Training camp","We follow all 32 NFL teams' beat writers so you don't have to, even though you should because they do great work.","https://t.co/EhQR4trGzl",false,44921,814,1377,25251,1716,"2016-07-25 19:33:02",false,"https://t.co/EhQR4trGzl","https://discord.gg/qqXkfc3GPs",,"https://pbs.twimg.com/profile_banners/757659945487728640/1650996834",,"http://pbs.twimg.com/profile_images/1484327856905674762/a3aIBH4E_normal.jpg"
"757659945487728640","1529128858326384641","2022-05-24 15:55:04","32BeatWriters","So we can’t tell you the order of the quarterback reps… https://t.co/xAENnVDGQM","Twitter Web App",94,,,,false,true,0,4,,,"","","","","","","","","","","","",,"","","en",,,,,,,,,,,,,,,,"1529128588468953090","So we can’t tell you the order of the quarterback reps… https://t.co/xAENnVDGQM","2022-05-24 15:53:59","Twitter for iPhone",23,4,"314199445","jhathhorn","Jeff Hathhorn",10859,582,10760,"Pittsburgh","Sports Director of 93.7 the Fan",true,,,,,,,"","","","https://twitter.com/32BeatWriters/status/1529128858326384641","NFL Beat Writers","Training camp","We follow all 32 NFL teams' beat writers so you don't have to, even though you should because they do great work.","https://t.co/EhQR4trGzl",false,44921,814,1377,25251,1716,"2016-07-25 19:33:02",false,"https://t.co/EhQR4trGzl","https://discord.gg/qqXkfc3GPs",,"https://pbs.twimg.com/profile_banners/757659945487728640/1650996834",,"http://pbs.twimg.com/profile_images/1484327856905674762/a3aIBH4E_normal.jpg"
"757659945487728640","1529128073601421319","2022-05-24 15:51:57","32BeatWriters","Neither Treylon Burks nor Robert Woods were full practice. Burks left the field at least twice, not sure why.","Twitter Web App",128,,,,false,true,0,7,,,"","","","","","","","","","","","",,"","","en",,,,,,,,,,,,,,,,"1529127489133588481","Neither Treylon Burks nor Robert Woods were full practice. Burks left the field at least twice, not sure why.","2022-05-24 15:49:37","Twitter for iPhone",62,7,"116857325","glennonsports","John Glennon",24870,729,63338,"Nashville, TN","Titans writer, https://t.co/jKxUFxZlun; Preds writer https://t.co/aJWy0DNzx9. Previous: Titans/Preds for The Athletic, The Tennessean. Member: PFWA. UVa. grad. E-mail: glennonsports@gmail.com",true,,,,,,,"","","","https://twitter.com/32BeatWriters/status/1529128073601421319","NFL Beat Writers","Training camp","We follow all 32 NFL teams' beat writers so you don't have to, even though you should because they do great work.","https://t.co/EhQR4trGzl",false,44921,814,1377,25251,1716,"2016-07-25 19:33:02",false,"https://t.co/EhQR4trGzl","https://discord.gg/qqXkfc3GPs",,"https://pbs.twimg.com/profile_banners/757659945487728640/1650996834",,"http://pbs.twimg.com/profile_images/1484327856905674762/a3aIBH4E_normal.jpg"
"757659945487728640","1529127963412905990","2022-05-24 15:51:30","32BeatWriters","Philips and Burks. #Titans. https://t.co/eNZRsDYQgJ","Twitter Web App",72,,,,false,true,0,7,,,"","","","","","","","","","","","",,"","","en",,,,,,,,,,,,,,,,"1529127409974398978","Philips and Burks. #Titans. https://t.co/eNZRsDYQgJ","2022-05-24 15:49:19","Twitter for iPhone",91,7,"19357128","PaulKuharskyNFL","Paul Kuharsky",98979,1804,118955,"Nashville, TN","Too much a cynic. Write at https://t.co/ll99sNooYp. Broadcast @OutKick360. Land-locked beach lover. Springsteen addict. Columbia alum. RPS HOF 2017.",true,,,,,,,"","","","https://twitter.com/32BeatWriters/status/1529127963412905990","NFL Beat Writers","Training camp","We follow all 32 NFL teams' beat writers so you don't have to, even though you should because they do great work.","https://t.co/EhQR4trGzl",false,44921,814,1377,25251,1716,"2016-07-25 19:33:02",false,"https://t.co/EhQR4trGzl","https://discord.gg/qqXkfc3GPs",,"https://pbs.twimg.com/profile_banners/757659945487728640/1650996834",,"http://pbs.twimg.com/profile_images/1484327856905674762/a3aIBH4E_normal.jpg"
"757659945487728640","1529127929631973376","2022-05-24 15:51:22","32BeatWriters","Malik Willis sorts through pressure. #Titans. https://t.co/xDS6OgLeyY","Twitter Web App",90,,,,false,true,0,17,,,"","","","","","","","","","","","",,"","","en",,,,,,,,,,,,,,,,"1529127290210336771","Malik Willis sorts through pressure. #Titans. https://t.co/xDS6OgLeyY","2022-05-24 15:48:50","Twitter for iPhone",115,17,"19357128","PaulKuharskyNFL","Paul Kuharsky",98979,1804,118955,"Nashville, TN","Too much a cynic. Write at https://t.co/ll99sNooYp. Broadcast @OutKick360. Land-locked beach lover. Springsteen addict. Columbia alum. RPS HOF 2017.",true,,,,,,,"","","","https://twitter.com/32BeatWriters/status/1529127929631973376","NFL Beat Writers","Training camp","We follow all 32 NFL teams' beat writers so you don't have to, even though you should because they do great work.","https://t.co/EhQR4trGzl",false,44921,814,1377,25251,1716,"2016-07-25 19:33:02",false,"https://t.co/EhQR4trGzl","https://discord.gg/qqXkfc3GPs",,"https://pbs.twimg.com/profile_banners/757659945487728640/1650996834",,"http://pbs.twimg.com/profile_images/1484327856905674762/a3aIBH4E_normal.jpg"
"757659945487728640","1529127559329357829","2022-05-24 15:49:54","32BeatWriters","First look at @robertwoods at Tuesday’s @Titans OTA. https://t.co/sFHVRB3pmu","Twitter Web App",94,,,,false,true,0,29,,,"","","","","","","","","","","","",,"","","en",,,,,,,,,,,,,,,,"1529127137357271040","First look at @robertwoods at Tuesday’s @Titans OTA. https://t.co/sFHVRB3pmu","2022-05-24 15:48:14","Twitter for iPhone",386,29,"41908847","jwyattsports","Jim Wyatt",105128,725,98279,"Nashville","Covered @Titans since the 1999 season, now with https://t.co/vXABIoW83W. Nashville native, Father Ryan grad. I bleed Dodger blue. Anchor Down!",true,,,,,,,"","","","https://twitter.com/32BeatWriters/status/1529127559329357829","NFL Beat Writers","Training camp","We follow all 32 NFL teams' beat writers so you don't have to, even though you should because they do great work.","https://t.co/EhQR4trGzl",false,44921,814,1377,25251,1716,"2016-07-25 19:33:02",false,"https://t.co/EhQR4trGzl","https://discord.gg/qqXkfc3GPs",,"https://pbs.twimg.com/profile_banners/757659945487728640/1650996834",,"http://pbs.twimg.com/profile_images/1484327856905674762/a3aIBH4E_normal.jpg"
"757659945487728640","1529127361786019841","2022-05-24 15:49:07","32BeatWriters","""Gibson's touches should remain high (he ranked fourth in the NFL with 300 last season), though his usage could vary weekly"" 

Keim also indicates Robinson could get short yardage work 🤔

Also: ""Off the field, they worked with a chef to lower Gibson's body fat from 18% to 12%"" https://t.co/YWKjfhaS6g","Twitter Web App",140,,,,false,true,0,10,,,"","","","","","","","","","","","",,"","","en",,,,,,,,,,,,,,,,"1529125334775382019","""Gibson's touches should remain high (he ranked fourth in the NFL with 300 last season), though his usage could vary weekly"" 

Keim also indicates Robinson could get short yardage work 🤔

Also: ""Off the field, they worked with a chef to lower Gibson's body fat from 18% to 12%"" https://t.co/YWKjfhaS6g","2022-05-24 15:41:04","Twitter Web App",55,10,"23481561","SigmundBloom","Sigmund Bloom",98450,2509,276939,"New Orleans, LA","Co-owner, http://t.co/uDGde9QZgF, We're here to get each other through this thing, whatever it is.",false,,,,,,,"","","","https://twitter.com/32BeatWriters/status/1529127361786019841","NFL Beat Writers","Training camp","We follow all 32 NFL teams' beat writers so you don't have to, even though you should because they do great work.","https://t.co/EhQR4trGzl",false,44921,814,1377,25251,1716,"2016-07-25 19:33:02",false,"https://t.co/EhQR4trGzl","https://discord.gg/qqXkfc3GPs",,"https://pbs.twimg.com/profile_banners/757659945487728640/1650996834",,"http://pbs.twimg.com/profile_images/1484327856905674762/a3aIBH4E_normal.jpg"
"757659945487728640","1529127346816573445","2022-05-24 15:49:03","32BeatWriters","A “beefy” &amp; “thicc” Zach Wilson works through individuals #Jets https://t.co/mxvHQtdtsu","Twitter Web App",112,,,,false,true,0,20,,,"","","","","","","","","","","","",,"","","en",,,,,,,,,,,,,,,,"1529125289846091779","A “beefy” &amp; “thicc” Zach Wilson works through individuals #Jets https://t.co/mxvHQtdtsu","2022-05-24 15:40:53","Twitter for iPhone",458,20,"314776155","Connor_J_Hughes","Connor Hughes",56039,963,83097,"Princeton, NJ","Covering the Jets for @TheAthletic | Analyst & TV guy for @SNYtv, @CBSNewYork | #CantWait podcast co-host | Big fan of my dog",true,,,,,,,"","","","https://twitter.com/32BeatWriters/status/1529127346816573445","NFL Beat Writers","Training camp","We follow all 32 NFL teams' beat writers so you don't have to, even though you should because they do great work.","https://t.co/EhQR4trGzl",false,44921,814,1377,25251,1716,"2016-07-25 19:33:02",false,"https://t.co/EhQR4trGzl","https://discord.gg/qqXkfc3GPs",,"https://pbs.twimg.com/profile_banners/757659945487728640/1650996834",,"http://pbs.twimg.com/profile_images/1484327856905674762/a3aIBH4E_normal.jpg"
"757659945487728640","1529127299555151873","2022-05-24 15:48:52","32BeatWriters","Zach Wilson to Corey Davis drills https://t.co/X7NWtGqRGO","Twitter Web App",73,,,,false,true,0,9,,,"","","","","","","","","","","","",,"","","en",,,,,,,,,,,,,,,,"1529125687604482048","Zach Wilson to Corey Davis drills https://t.co/X7NWtGqRGO","2022-05-24 15:42:28","Twitter for iPhone",158,9,"334179189","Djbienaime","DJ Bien-Aime",20862,1455,67077,"Miami ✈️New York, USA","Galatians 5:22| Jets beat reporter for @NYDNsports| @columbiajourn & @uofltrackxc alum. #JUCO #NABJ. 🇭🇹. Disagreements are healthy. RT=/=endorsement",true,,,,,,,"","","","https://twitter.com/32BeatWriters/status/1529127299555151873","NFL Beat Writers","Training camp","We follow all 32 NFL teams' beat writers so you don't have to, even though you should because they do great work.","https://t.co/EhQR4trGzl",false,44921,814,1377,25251,1716,"2016-07-25 19:33:02",false,"https://t.co/EhQR4trGzl","https://discord.gg/qqXkfc3GPs",,"https://pbs.twimg.com/profile_banners/757659945487728640/1650996834",,"http://pbs.twimg.com/profile_images/1484327856905674762/a3aIBH4E_normal.jpg"
