"757659945487728640","1529093496958816261","2022-05-24 13:34:33","32BeatWriters","Heinicke with a nice deep throw in 11v11. Wentz had a good one to sideline that got broken up too. Very clear Wentz has a live arm.","Twitter for iPhone",140,,,,false,true,0,17,,,"","","","","","","","","","","","",,"","","en",,,,,,,,,,,,,,,,"1529091600407732226","Heinicke with a nice deep throw in 11v11. Wentz had a good one to sideline that got broken up too. Very clear Wentz has a live arm.","2022-05-24 13:27:01","Twitter for iPhone",408,17,"39736881","JPFinlayNBCS","JP Finlay",66328,968,83377,"DC","hate when folks say nobody is from DC | weekdays 10-2 @1067theFan | Podcast/TV/all things Commanders for @nbcswashington",true,,,,,,,"","","","https://twitter.com/32BeatWriters/status/1529093496958816261","NFL Beat Writers","Training camp","We follow all 32 NFL teams' beat writers so you don't have to, even though you should because they do great work.","https://t.co/EhQR4trGzl",false,44921,814,1377,25251,1716,"2016-07-25 19:33:02",false,"https://t.co/EhQR4trGzl","https://discord.gg/qqXkfc3GPs",,"https://pbs.twimg.com/profile_banners/757659945487728640/1650996834",,"http://pbs.twimg.com/profile_images/1484327856905674762/a3aIBH4E_normal.jpg"
"757659945487728640","1529093339768922112","2022-05-24 13:33:56","32BeatWriters","Carson Wentz looks for Jahan Dotson and finds him on a 15-20 yard pass before the rookie steps out of bounds","Twitter for iPhone",125,,,,false,true,0,9,,,"","","","","","","","","","","","",,"","","en",,,,,,,,,,,,,,,,"1529092490619404291","Carson Wentz looks for Jahan Dotson and finds him on a 15-20 yard pass before the rookie steps out of bounds","2022-05-24 13:30:33","Twitter for iPhone",113,9,"2247155275","ZachSelbyWC","Zach Selby",5068,832,11312,"Washington, DC","Washington Commanders Staff Writer @Commanders | #HTTC | @merrillcollege '18 | @MaryvilleC '15 | https://t.co/PatKYHLk0c",false,,,,,,,"","","","https://twitter.com/32BeatWriters/status/1529093339768922112","NFL Beat Writers","Training camp","We follow all 32 NFL teams' beat writers so you don't have to, even though you should because they do great work.","https://t.co/EhQR4trGzl",false,44921,814,1377,25251,1716,"2016-07-25 19:33:02",false,"https://t.co/EhQR4trGzl","https://discord.gg/qqXkfc3GPs",,"https://pbs.twimg.com/profile_banners/757659945487728640/1650996834",,"http://pbs.twimg.com/profile_images/1484327856905674762/a3aIBH4E_normal.jpg"
"757659945487728640","1529093068137308160","2022-05-24 13:32:51","32BeatWriters","Curtis Samuel. Quick feet. Looks good. Bouncy. https://t.co/alIP9R0Qbv","Twitter for iPhone",88,,,,false,true,0,22,,,"","","","","","","","","","","","",,"","","en",,,,,,,,,,,,,,,,"1529092766063640580","Curtis Samuel. Quick feet. Looks good. Bouncy. https://t.co/alIP9R0Qbv","2022-05-24 13:31:39","Twitter for iPhone",156,22,"39736881","JPFinlayNBCS","JP Finlay",66328,968,83377,"DC","hate when folks say nobody is from DC | weekdays 10-2 @1067theFan | Podcast/TV/all things Commanders for @nbcswashington",true,,,,,,,"","","","https://twitter.com/32BeatWriters/status/1529093068137308160","NFL Beat Writers","Training camp","We follow all 32 NFL teams' beat writers so you don't have to, even though you should because they do great work.","https://t.co/EhQR4trGzl",false,44921,814,1377,25251,1716,"2016-07-25 19:33:02",false,"https://t.co/EhQR4trGzl","https://discord.gg/qqXkfc3GPs",,"https://pbs.twimg.com/profile_banners/757659945487728640/1650996834",,"http://pbs.twimg.com/profile_images/1484327856905674762/a3aIBH4E_normal.jpg"
"757659945487728640","1529093001208815619","2022-05-24 13:32:35","32BeatWriters","Nice one-handed grab by Dyami Brown from Wentz. Wet out here too. On the defensive side I’ve seen mostly 2 LBs (Holcomb and Davis) and then 3 safeties with 2 corners. Unless/until they sign a vet LB I’d expect to see that look a lot","Twitter for iPhone",140,,,,false,true,0,26,,,"","","","","","","","","","","","",,"","","en",,,,,,,,,,,,,,,,"1529092906270736389","Nice one-handed grab by Dyami Brown from Wentz. Wet out here too. On the defensive side I’ve seen mostly 2 LBs (Holcomb and Davis) and then 3 safeties with 2 corners. Unless/until they sign a vet LB I’d expect to see that look a lot","2022-05-24 13:32:12","Twitter for iPhone",277,26,"39736881","JPFinlayNBCS","JP Finlay",66328,968,83377,"DC","hate when folks say nobody is from DC | weekdays 10-2 @1067theFan | Podcast/TV/all things Commanders for @nbcswashington",true,,,,,,,"","","","https://twitter.com/32BeatWriters/status/1529093001208815619","NFL Beat Writers","Training camp","We follow all 32 NFL teams' beat writers so you don't have to, even though you should because they do great work.","https://t.co/EhQR4trGzl",false,44921,814,1377,25251,1716,"2016-07-25 19:33:02",false,"https://t.co/EhQR4trGzl","https://discord.gg/qqXkfc3GPs",,"https://pbs.twimg.com/profile_banners/757659945487728640/1650996834",,"http://pbs.twimg.com/profile_images/1484327856905674762/a3aIBH4E_normal.jpg"
"757659945487728640","1529086269472575493","2022-05-24 13:05:50","32BeatWriters","@TheDraftNetwork https://t.co/vv92LvqyPM","Twitter for iPhone",0,"1529084944366043138","70624996","TheDraftNetwork",false,false,2,0,,,"","","","","","","","","","","","",,"","","und",,,,,,,,,,,,,,,,,,,,,,,,,,,,,,,,,,,,,"","","","https://twitter.com/32BeatWriters/status/1529086269472575493","NFL Beat Writers","Training camp","We follow all 32 NFL teams' beat writers so you don't have to, even though you should because they do great work.","https://t.co/EhQR4trGzl",false,44921,814,1377,25251,1716,"2016-07-25 19:33:02",false,"https://t.co/EhQR4trGzl","https://discord.gg/qqXkfc3GPs",,"https://pbs.twimg.com/profile_banners/757659945487728640/1650996834",,"http://pbs.twimg.com/profile_images/1484327856905674762/a3aIBH4E_normal.jpg"
"757659945487728640","1529068237148893185","2022-05-24 11:54:11","32BeatWriters","“(Mac) Jones also said he’s put more focus into his diet in order to work on his physical build.‘I’ve learned more this offseason than I probably ever have about nutrition, sleep, wellness, all that stuff…’ he noted. ‘I’ve definitely trimmed down on the body fat a little bit…’” https://t.co/363xsUPsJT","Twitter for iPhone",278,,,,true,false,13,0,,,"","","","","","","","","","","","",,"","","en","1529066178261532672","Patriots OTAs Day 1 Notebook. @985TheSportsHub https://t.co/WyCJ6isEPO","2022-05-24 11:46:00","TweetDeck",5,0,"259035071","RealAlexBarth","Alex Barth",10616,617,55685,"Boston, MA","✍🏻&🗣️ Boston Sports for @985TheSportsHub | Host @CallinItPodcast | Formerly @CLNSMedia @NBCSBoston @ESPNIthaca | Always #BostonStrong",true,,,,,,,,,,,,,,,,,,,,,,"","","","https://twitter.com/32BeatWriters/status/1529068237148893185","NFL Beat Writers","Training camp","We follow all 32 NFL teams' beat writers so you don't have to, even though you should because they do great work.","https://t.co/EhQR4trGzl",false,44921,814,1377,25251,1716,"2016-07-25 19:33:02",false,"https://t.co/EhQR4trGzl","https://discord.gg/qqXkfc3GPs",,"https://pbs.twimg.com/profile_banners/757659945487728640/1650996834",,"http://pbs.twimg.com/profile_images/1484327856905674762/a3aIBH4E_normal.jpg"
"757659945487728640","1529066261254135814","2022-05-24 11:46:20","32BeatWriters","TE Jonnu Smith met with reporters after Monday’s practice. He was usually the first TE through drills (Hunter Henry was limited).

“My (2021 offseason) was choppy and I missed some quality time here. I recognize how valuable that time is. I’m here to take advantage of that.” https://t.co/1LsqnJtfQx","Twitter for iPhone",140,,,,false,true,0,41,,,"","","","","","","","","","","","",,"","","en",,,,,,,,,,,,,,,,"1529066088486649856","TE Jonnu Smith met with reporters after Monday’s practice. He was usually the first TE through drills (Hunter Henry was limited).

“My (2021 offseason) was choppy and I missed some quality time here. I recognize how valuable that time is. I’m here to take advantage of that.” https://t.co/1LsqnJtfQx","2022-05-24 11:45:38","Twitter for iPhone",873,41,"35017255","MikeReiss","Mike Reiss",363294,990,94355,"Foxborough, MA","ESPN NFL Nation reporter covering the New England Patriots. IG: mikereisspatriots",true,,,,,,,"","","","https://twitter.com/32BeatWriters/status/1529066261254135814","NFL Beat Writers","Training camp","We follow all 32 NFL teams' beat writers so you don't have to, even though you should because they do great work.","https://t.co/EhQR4trGzl",false,44921,814,1377,25251,1716,"2016-07-25 19:33:02",false,"https://t.co/EhQR4trGzl","https://discord.gg/qqXkfc3GPs",,"https://pbs.twimg.com/profile_banners/757659945487728640/1650996834",,"http://pbs.twimg.com/profile_images/1484327856905674762/a3aIBH4E_normal.jpg"
"757659945487728640","1528890421937467392","2022-05-24 00:07:36","32BeatWriters","Justin Fields' Leadership Coming Across As OTAs Continue At Halas Hall https://t.co/uReqbE1BXm","Twitter Web App",115,,,,false,true,0,10,,,"","","","","","","","","","","","",,"","","en",,,,,,,,,,,,,,,,"1528889966922588160","Justin Fields' Leadership Coming Across As OTAs Continue At Halas Hall https://t.co/uReqbE1BXm","2022-05-24 00:05:48","Periscope",24,10,"1386715527997972484","clubdub_podcast","Club Dub Podcast",421,26,587,"Chicago","The doors to Club Dub are open! 
Chicago #Bears Podcast, presented by @SportsMockery.
Hosts: @Wells15Kevin | @ErikLambert1 | @DhruvKoul",false,,,,,,,"","","","https://twitter.com/32BeatWriters/status/1528890421937467392","NFL Beat Writers","Training camp","We follow all 32 NFL teams' beat writers so you don't have to, even though you should because they do great work.","https://t.co/EhQR4trGzl",false,44921,814,1377,25251,1716,"2016-07-25 19:33:02",false,"https://t.co/EhQR4trGzl","https://discord.gg/qqXkfc3GPs",,"https://pbs.twimg.com/profile_banners/757659945487728640/1650996834",,"http://pbs.twimg.com/profile_images/1484327856905674762/a3aIBH4E_normal.jpg"
"757659945487728640","1528851685820489731","2022-05-23 21:33:41","32BeatWriters","I believe DEN keeps five WRs, but there will be a push to  six. TE room is packed, loved what I saw from Greg Dulcich again - Okwuegbunam imposing - Saubert with great effort. Some tough decisions for George Paton when it comes to roster building #Broncos @1043TheFan","Twitter Web App",140,,,,false,true,0,1,,,"","","","","","","","","","","","",,"","","en",,,,,,,,,,,,,,,,"1528851596062650368","I believe DEN keeps five WRs, but there will be a push to  six. TE room is packed, loved what I saw from Greg Dulcich again - Okwuegbunam imposing - Saubert with great effort. Some tough decisions for George Paton when it comes to roster building #Broncos @1043TheFan","2022-05-23 21:33:19","Twitter Web App",32,1,"32908126","CecilLammey","Cecil Lammey",52030,997,68201,"","Digital Talent https://t.co/n3WHEzlRuV - Broncos, NFL Draft, Fantasy Football - senior writer https://t.co/H6i9E96Hp4 - PFWA member - Co-owner/writer/artist https://t.co/KfHwxwIiaw",true,,,,,,,"","","","https://twitter.com/32BeatWriters/status/1528851685820489731","NFL Beat Writers","Training camp","We follow all 32 NFL teams' beat writers so you don't have to, even though you should because they do great work.","https://t.co/EhQR4trGzl",false,44921,814,1377,25251,1716,"2016-07-25 19:33:02",false,"https://t.co/EhQR4trGzl","https://discord.gg/qqXkfc3GPs",,"https://pbs.twimg.com/profile_banners/757659945487728640/1650996834",,"http://pbs.twimg.com/profile_images/1484327856905674762/a3aIBH4E_normal.jpg"
"757659945487728640","1528851277131784192","2022-05-23 21:32:03","32BeatWriters","No Melvin Gordon. That's....interesting. I know, I know, he always skips voluntary workouts. However, his dream was to play with Russell Wilson again...and he was on the market for some time. Would've been nice to see him here. #Broncos @1043TheFan","Twitter for iPhone",140,,,,false,true,0,3,,,"","","","","","","","","","","","",,"","","en",,,,,,,,,,,,,,,,"1528851239886548993","No Melvin Gordon. That's....interesting. I know, I know, he always skips voluntary workouts. However, his dream was to play with Russell Wilson again...and he was on the market for some time. Would've been nice to see him here. #Broncos @1043TheFan","2022-05-23 21:31:54","Twitter Web App",60,3,"32908126","CecilLammey","Cecil Lammey",52030,997,68201,"","Digital Talent https://t.co/n3WHEzlRuV - Broncos, NFL Draft, Fantasy Football - senior writer https://t.co/H6i9E96Hp4 - PFWA member - Co-owner/writer/artist https://t.co/KfHwxwIiaw",true,,,,,,,"","","","https://twitter.com/32BeatWriters/status/1528851277131784192","NFL Beat Writers","Training camp","We follow all 32 NFL teams' beat writers so you don't have to, even though you should because they do great work.","https://t.co/EhQR4trGzl",false,44921,814,1377,25251,1716,"2016-07-25 19:33:02",false,"https://t.co/EhQR4trGzl","https://discord.gg/qqXkfc3GPs",,"https://pbs.twimg.com/profile_banners/757659945487728640/1650996834",,"http://pbs.twimg.com/profile_images/1484327856905674762/a3aIBH4E_normal.jpg"
"757659945487728640","1528851118872317954","2022-05-23 21:31:26","32BeatWriters","Players are going ALL OUT to catch passes from Russell Wilson. You love to see it. Very few passes hit the ground, and when they do a herculean effort is given to make the play. #Broncos @1043TheFan (shout out to Kendall Hinton today, looked great catching from RW)","Twitter for iPhone",140,,,,false,true,0,5,,,"","","","","","","","","","","","",,"","","en",,,,,,,,,,,,,,,,"1528850962605314048","Players are going ALL OUT to catch passes from Russell Wilson. You love to see it. Very few passes hit the ground, and when they do a herculean effort is given to make the play. #Broncos @1043TheFan (shout out to Kendall Hinton today, looked great catching from RW)","2022-05-23 21:30:48","Twitter Web App",43,5,"32908126","CecilLammey","Cecil Lammey",52030,997,68201,"","Digital Talent https://t.co/n3WHEzlRuV - Broncos, NFL Draft, Fantasy Football - senior writer https://t.co/H6i9E96Hp4 - PFWA member - Co-owner/writer/artist https://t.co/KfHwxwIiaw",true,,,,,,,"","","","https://twitter.com/32BeatWriters/status/1528851118872317954","NFL Beat Writers","Training camp","We follow all 32 NFL teams' beat writers so you don't have to, even though you should because they do great work.","https://t.co/EhQR4trGzl",false,44921,814,1377,25251,1716,"2016-07-25 19:33:02",false,"https://t.co/EhQR4trGzl","https://discord.gg/qqXkfc3GPs",,"https://pbs.twimg.com/profile_banners/757659945487728640/1650996834",,"http://pbs.twimg.com/profile_images/1484327856905674762/a3aIBH4E_normal.jpg"
"757659945487728640","1528850941130297344","2022-05-23 21:30:43","32BeatWriters","And it begins https://t.co/zHVEABkYWS","Twitter for iPhone",13,,,,true,false,74,5,,,"","","","","","","","","","","","",,"","","en","1528850835802796032","Carroll says Rashaad Penny is resting a slight hamstring issue.","2022-05-23 21:30:18","Twitter for iPhone",492,27,"20602082","bcondotta","Bob Condotta",83862,1999,129435,"Seattle, WA.","Bob Condotta now covers the Seattle Seahawks and other sports for The Seattle Times. Covered Washington football for 16 years ---likely to Tweet about anything.",false,,,,,,,,,,,,,,,,,,,,,,"","","","https://twitter.com/32BeatWriters/status/1528850941130297344","NFL Beat Writers","Training camp","We follow all 32 NFL teams' beat writers so you don't have to, even though you should because they do great work.","https://t.co/EhQR4trGzl",false,44921,814,1377,25251,1716,"2016-07-25 19:33:02",false,"https://t.co/EhQR4trGzl","https://discord.gg/qqXkfc3GPs",,"https://pbs.twimg.com/profile_banners/757659945487728640/1650996834",,"http://pbs.twimg.com/profile_images/1484327856905674762/a3aIBH4E_normal.jpg"
"757659945487728640","1528850241876787200","2022-05-23 21:27:56","32BeatWriters","Kendrick Bourne says Tyquan Thornton is ""blazing"" but ""we gotta get some weight on my guy, though."" Said he had to do the same thing when he got to the league. Bourne says if Thornton buys in, the results will come.","Twitter for iPhone",140,,,,false,true,0,32,,,"","","","","","","","","","","","",,"","","en",,,,,,,,,,,,,,,,"1528795013404139522","Kendrick Bourne says Tyquan Thornton is ""blazing"" but ""we gotta get some weight on my guy, though."" Said he had to do the same thing when he got to the league. Bourne says if Thornton buys in, the results will come.","2022-05-23 17:48:29","Twitter Web App",456,32,"95260821","PhilAPerry","Phil Perry",50517,2677,54533,"","Covering the Patriots. Yapping about the Red Sox, Celtics and Bruins. Hanging out on your TV... or phone... or laptop... for NBCS Boston.

https://t.co/t5uJr9hOcz",true,,,,,,,"","","","https://twitter.com/32BeatWriters/status/1528850241876787200","NFL Beat Writers","Training camp","We follow all 32 NFL teams' beat writers so you don't have to, even though you should because they do great work.","https://t.co/EhQR4trGzl",false,44921,814,1377,25251,1716,"2016-07-25 19:33:02",false,"https://t.co/EhQR4trGzl","https://discord.gg/qqXkfc3GPs",,"https://pbs.twimg.com/profile_banners/757659945487728640/1650996834",,"http://pbs.twimg.com/profile_images/1484327856905674762/a3aIBH4E_normal.jpg"
"757659945487728640","1528850200638410753","2022-05-23 21:27:47","32BeatWriters","- Cole Strange &amp; Pierre Strong “majored” in outside zone in college

- Tyquan Thornton was in zone guru Jeff Grimes’s offense at Baylor 

With uncertainty around the #Patriots offense, could a scheme shift be coming as well? More on that in today’s observations from OTAs 👇 https://t.co/aaYZXQdnrP","Twitter for iPhone",143,,,,false,true,0,11,,,"","","","","","","","","","","","",,"","","en",,,,,,,,,,,,,,,,"1528843366670254082","- Cole Strange &amp; Pierre Strong “majored” in outside zone in college

- Tyquan Thornton was in zone guru Jeff Grimes’s offense at Baylor 

With uncertainty around the #Patriots offense, could a scheme shift be coming as well? More on that in today’s observations from OTAs 👇 https://t.co/aaYZXQdnrP","2022-05-23 21:00:37","Twitter for iPhone",99,11,"226037111","ezlazar","Evan Lazar",44413,1279,81645,"Boston, MA","Patriots beat reporter for @CLNSMedia and host of the #PatriotsBeat podcast. Lucky to have @guertin11 by my side. Thoughts are my own.",true,,,,,,,"","","","https://twitter.com/32BeatWriters/status/1528850200638410753","NFL Beat Writers","Training camp","We follow all 32 NFL teams' beat writers so you don't have to, even though you should because they do great work.","https://t.co/EhQR4trGzl",false,44921,814,1377,25251,1716,"2016-07-25 19:33:02",false,"https://t.co/EhQR4trGzl","https://discord.gg/qqXkfc3GPs",,"https://pbs.twimg.com/profile_banners/757659945487728640/1650996834",,"http://pbs.twimg.com/profile_images/1484327856905674762/a3aIBH4E_normal.jpg"
"757659945487728640","1528850104282664960","2022-05-23 21:27:24","32BeatWriters","We didn’t get to see much from Tyquan Thornton on Monday. But did capture him going through one drill early on in practice. #Patriots https://t.co/zTRHzMPWms","Twitter for iPhone",140,,,,false,true,0,8,,,"","","","","","","","","","","","",,"","","en",,,,,,,,,,,,,,,,"1528846551480782849","We didn’t get to see much from Tyquan Thornton on Monday. But did capture him going through one drill early on in practice. #Patriots https://t.co/zTRHzMPWms","2022-05-23 21:13:17","Twitter for iPhone",126,8,"226037111","ezlazar","Evan Lazar",44413,1279,81645,"Boston, MA","Patriots beat reporter for @CLNSMedia and host of the #PatriotsBeat podcast. Lucky to have @guertin11 by my side. Thoughts are my own.",true,,,,,,,"","","","https://twitter.com/32BeatWriters/status/1528850104282664960","NFL Beat Writers","Training camp","We follow all 32 NFL teams' beat writers so you don't have to, even though you should because they do great work.","https://t.co/EhQR4trGzl",false,44921,814,1377,25251,1716,"2016-07-25 19:33:02",false,"https://t.co/EhQR4trGzl","https://discord.gg/qqXkfc3GPs",,"https://pbs.twimg.com/profile_banners/757659945487728640/1650996834",,"http://pbs.twimg.com/profile_images/1484327856905674762/a3aIBH4E_normal.jpg"
"757659945487728640","1528839424783572993","2022-05-23 20:44:57","32BeatWriters","the justin herbert swole evolution 
continues https://t.co/zSWJCPYsaI","Twitter for iPhone",89,,,,false,true,0,127,,,"","","","","","","","","","","","",,"","","en",,,,,,,,,,,,,,,,"1528395674538090496","the justin herbert swole evolution 
continues https://t.co/zSWJCPYsaI","2022-05-22 15:21:39","TweetDeck",1962,127,"93910940","NFL_DovKleiman","Dov Kleiman",73581,737,132951,"","Independent reporter. I report on NFL news and keep people updated about transactions. Contact via DM.",true,,,,,,,"","","","https://twitter.com/32BeatWriters/status/1528839424783572993","NFL Beat Writers","Training camp","We follow all 32 NFL teams' beat writers so you don't have to, even though you should because they do great work.","https://t.co/EhQR4trGzl",false,44921,814,1377,25251,1716,"2016-07-25 19:33:02",false,"https://t.co/EhQR4trGzl","https://discord.gg/qqXkfc3GPs",,"https://pbs.twimg.com/profile_banners/757659945487728640/1650996834",,"http://pbs.twimg.com/profile_images/1484327856905674762/a3aIBH4E_normal.jpg"
"757659945487728640","1528838453105987584","2022-05-23 20:41:06","32BeatWriters","Trevor to Travis. Wonderful to see. https://t.co/nichXKftn9","Twitter for iPhone",76,,,,false,true,0,77,,,"","","","","","","","","","","","",,"","","en",,,,,,,,,,,,,,,,"1528756507440971776","Trevor to Travis. Wonderful to see. https://t.co/nichXKftn9","2022-05-23 15:15:28","Twitter for iPhone",802,77,"259278522","HaysCarlyon","Hays Carlyon",17936,811,27449,"Jacksonville","Jaguars reporter for @1010XL 92.5 FM. Co-host of The Frangie Show 3-6 p.m. Email: haysc@1010xl.com. Avery and Jackson's dad. Married to the lovely Jean Page.",false,,,,,,,"","","","https://twitter.com/32BeatWriters/status/1528838453105987584","NFL Beat Writers","Training camp","We follow all 32 NFL teams' beat writers so you don't have to, even though you should because they do great work.","https://t.co/EhQR4trGzl",false,44921,814,1377,25251,1716,"2016-07-25 19:33:02",false,"https://t.co/EhQR4trGzl","https://discord.gg/qqXkfc3GPs",,"https://pbs.twimg.com/profile_banners/757659945487728640/1650996834",,"http://pbs.twimg.com/profile_images/1484327856905674762/a3aIBH4E_normal.jpg"
"757659945487728640","1528837278004654080","2022-05-23 20:36:26","32BeatWriters","Someone told Justin Herbert he looked “swole” and asked him what he has been doing this offseason 

Herbert deadpans: “Just lifting.” https://t.co/vpgKt9CciV","Twitter for iPhone",140,,,,false,true,0,53,,,"","","","","","","","","","","","",,"","","en",,,,,,,,,,,,,,,,"1528837199260971009","Someone told Justin Herbert he looked “swole” and asked him what he has been doing this offseason 

Herbert deadpans: “Just lifting.” https://t.co/vpgKt9CciV","2022-05-23 20:36:07","Twitter for iPhone",1202,53,"191323454","danielrpopper","Daniel Popper",29128,998,15473,"Venice","Senior Writer @TheAthletic covering the Chargers",true,,,,,,,"","","","https://twitter.com/32BeatWriters/status/1528837278004654080","NFL Beat Writers","Training camp","We follow all 32 NFL teams' beat writers so you don't have to, even though you should because they do great work.","https://t.co/EhQR4trGzl",false,44921,814,1377,25251,1716,"2016-07-25 19:33:02",false,"https://t.co/EhQR4trGzl","https://discord.gg/qqXkfc3GPs",,"https://pbs.twimg.com/profile_banners/757659945487728640/1650996834",,"http://pbs.twimg.com/profile_images/1484327856905674762/a3aIBH4E_normal.jpg"
"757659945487728640","1528835201450889218","2022-05-23 20:28:11","32BeatWriters","Russell Wilson called Javonte Williams a “world-class back”","Twitter for iPhone",79,,,,false,true,0,24,,,"","","","","","","","","","","","",,"","","en",,,,,,,,,,,,,,,,"1528834846310682624","Russell Wilson called Javonte Williams a “world-class back”","2022-05-23 20:26:46","Twitter for iPhone",723,24,"37002193","ZacStevensDNVR","Zac Stevens",30469,957,57243,"Denver, CO","Denver Broncos beat reporter for @DNVR_Broncos @DNVR_Sports — Colorado guy covering Colorado's team — @PFWAwriters",false,,,,,,,"","","","https://twitter.com/32BeatWriters/status/1528835201450889218","NFL Beat Writers","Training camp","We follow all 32 NFL teams' beat writers so you don't have to, even though you should because they do great work.","https://t.co/EhQR4trGzl",false,44921,814,1377,25251,1716,"2016-07-25 19:33:02",false,"https://t.co/EhQR4trGzl","https://discord.gg/qqXkfc3GPs",,"https://pbs.twimg.com/profile_banners/757659945487728640/1650996834",,"http://pbs.twimg.com/profile_images/1484327856905674762/a3aIBH4E_normal.jpg"
