"757659945487728640","1529188968109047810","2022-05-24 19:53:55","32BeatWriters","Zach Wilson said he finished last season at 208 pounds and is now 221 pounds.","Twitter for iPhone",97,,,,false,true,0,17,,,"","","","","","","","","","","","",,"","","en",,,,,,,,,,,,,,,,"1529186399454433283","Zach Wilson said he finished last season at 208 pounds and is now 221 pounds.","2022-05-24 19:43:43","TweetDeck",155,17,"625086194","EGreenbergJets","Ethan Greenberg",7450,719,5434,"New York, NY","Team Reporter, @nyjets. Proud alum, @SyracuseU. Sucker for player intros.",true,,,,,,,"","","","https://twitter.com/32BeatWriters/status/1529188968109047810","NFL Beat Writers","Training camp","We follow all 32 NFL teams' beat writers so you don't have to, even though you should because they do great work.","https://t.co/EhQR4trGzl",false,44921,814,1377,25251,1716,"2016-07-25 19:33:02",false,"https://t.co/EhQR4trGzl","https://discord.gg/qqXkfc3GPs",,"https://pbs.twimg.com/profile_banners/757659945487728640/1650996834",,"http://pbs.twimg.com/profile_images/1484327856905674762/a3aIBH4E_normal.jpg"
"757659945487728640","1529167101054881793","2022-05-24 18:27:02","32BeatWriters","low key camp battle to watch. 

Jaylen Samuels, Eno Benjamin, Jonathan Ward, Keaontay Ingram battling for 2 roster spots. https://t.co/07ddIPAs2E","Twitter Web App",140,,,,false,true,0,2,,,"","","","","","","","","","","","",,"","","en",,,,,,,,,,,,,,,,"1529165975194509312","low key camp battle to watch. 

Jaylen Samuels, Eno Benjamin, Jonathan Ward, Keaontay Ingram battling for 2 roster spots. https://t.co/07ddIPAs2E","2022-05-24 18:22:33","TweetDeck",26,2,"19055674","senorjessroot","Jess Root",3616,838,83006,"Gilbert, AZ","Site editor, @Cards_Wire. @Riseupseered host. Spanish Teacher, @WFHS_husd, @RiosaladoOnline. AZ native. 2x ASU grad. Husband. Father. Member @Ch_JesusChrist",true,,,,,,,"","","","https://twitter.com/32BeatWriters/status/1529167101054881793","NFL Beat Writers","Training camp","We follow all 32 NFL teams' beat writers so you don't have to, even though you should because they do great work.","https://t.co/EhQR4trGzl",false,44921,814,1377,25251,1716,"2016-07-25 19:33:02",false,"https://t.co/EhQR4trGzl","https://discord.gg/qqXkfc3GPs",,"https://pbs.twimg.com/profile_banners/757659945487728640/1650996834",,"http://pbs.twimg.com/profile_images/1484327856905674762/a3aIBH4E_normal.jpg"
"757659945487728640","1529163149466796033","2022-05-24 18:11:19","32BeatWriters","Three 🏈🏈🏈 from @TreylonBurks in Tuesday’s @Titans OTA. https://t.co/yyjMVTH7hQ","Twitter Web App",96,,,,false,true,0,13,,,"","","","","","","","","","","","",,"","","en",,,,,,,,,,,,,,,,"1529158128192966658","Three 🏈🏈🏈 from @TreylonBurks in Tuesday’s @Titans OTA. https://t.co/yyjMVTH7hQ","2022-05-24 17:51:22","Twitter for iPhone",171,13,"41908847","jwyattsports","Jim Wyatt",105128,725,98279,"Nashville","Covered @Titans since the 1999 season, now with https://t.co/vXABIoW83W. Nashville native, Father Ryan grad. I bleed Dodger blue. Anchor Down!",true,,,,,,,"","","","https://twitter.com/32BeatWriters/status/1529163149466796033","NFL Beat Writers","Training camp","We follow all 32 NFL teams' beat writers so you don't have to, even though you should because they do great work.","https://t.co/EhQR4trGzl",false,44921,814,1377,25251,1716,"2016-07-25 19:33:02",false,"https://t.co/EhQR4trGzl","https://discord.gg/qqXkfc3GPs",,"https://pbs.twimg.com/profile_banners/757659945487728640/1650996834",,"http://pbs.twimg.com/profile_images/1484327856905674762/a3aIBH4E_normal.jpg"
"757659945487728640","1529163116344377348","2022-05-24 18:11:12","32BeatWriters","Breaking: FA RB Darrel Williams is signing with the #AZCardinals, per source. 

I’m also told Patrick Mahomes vouched for Williams, informing Arizona that he was a back he both liked/trusted. DW had a great season w/over 1,000 scrimmage yards, 8 TDs/zero fumbles (191 touches).","Twitter Web App",140,,,,false,true,0,265,,,"","","","","","","","","","","","",,"","","en",,,,,,,,,,,,,,,,"1529150809979736068","Breaking: FA RB Darrel Williams is signing with the #AZCardinals, per source. 

I’m also told Patrick Mahomes vouched for Williams, informing Arizona that he was a back he both liked/trusted. DW had a great season w/over 1,000 scrimmage yards, 8 TDs/zero fumbles (191 touches).","2022-05-24 17:22:18","Twitter for iPhone",2475,265,"52712735","Schultz_Report","Jordan Schultz",122198,20448,37717,"NYC","Insider/analyst, host @PullUpPod w/@CJMcCollum, host Game Plan @Boardroom, host @thegamedaynfl, IG: @jordanschultz, TikTok: @realjordanschultz",true,,,,,,,"","","","https://twitter.com/32BeatWriters/status/1529163116344377348","NFL Beat Writers","Training camp","We follow all 32 NFL teams' beat writers so you don't have to, even though you should because they do great work.","https://t.co/EhQR4trGzl",false,44921,814,1377,25251,1716,"2016-07-25 19:33:02",false,"https://t.co/EhQR4trGzl","https://discord.gg/qqXkfc3GPs",,"https://pbs.twimg.com/profile_banners/757659945487728640/1650996834",,"http://pbs.twimg.com/profile_images/1484327856905674762/a3aIBH4E_normal.jpg"
"757659945487728640","1529163084304097280","2022-05-24 18:11:04","32BeatWriters","Sam Darnold says he's ""confident I can be one of the best quarterbacks in the league.'' Improving footwork is something he has to improve. “There were times last year when my feet got very … just loose is a good term . . . chaotic.’’","Twitter Web App",140,,,,false,true,0,6,,,"","","","","","","","","","","","",,"","","en",,,,,,,,,,,,,,,,"1529158460088143874","Sam Darnold says he's ""confident I can be one of the best quarterbacks in the league.'' Improving footwork is something he has to improve. “There were times last year when my feet got very … just loose is a good term . . . chaotic.’’","2022-05-24 17:52:41","Twitter Web App",40,6,"26330763","DNewtonespn","David Newton",41231,1052,70988,"Charlotte, N.C.","ESPN NFL Nation Reporter David Newton covers Carolina Panthers. https://t.co/YcZ7XyKV0N",true,,,,,,,"","","","https://twitter.com/32BeatWriters/status/1529163084304097280","NFL Beat Writers","Training camp","We follow all 32 NFL teams' beat writers so you don't have to, even though you should because they do great work.","https://t.co/EhQR4trGzl",false,44921,814,1377,25251,1716,"2016-07-25 19:33:02",false,"https://t.co/EhQR4trGzl","https://discord.gg/qqXkfc3GPs",,"https://pbs.twimg.com/profile_banners/757659945487728640/1650996834",,"http://pbs.twimg.com/profile_images/1484327856905674762/a3aIBH4E_normal.jpg"
"757659945487728640","1529163001122758656","2022-05-24 18:10:44","32BeatWriters","Come to see @RobTonJr cutting up with @DavidBakhtiari 

Stay to watch as the Packers TE gets back on the field this summer, rehabbing. RB Kylin Hill also working with him on the side. https://t.co/0nOzWhfleR","Twitter Web App",140,,,,false,true,0,2,,,"","","","","","","","","","","","",,"","","en",,,,,,,,,,,,,,,,"1529158617852674048","Come to see @RobTonJr cutting up with @DavidBakhtiari 

Stay to watch as the Packers TE gets back on the field this summer, rehabbing. RB Kylin Hill also working with him on the side. https://t.co/0nOzWhfleR","2022-05-24 17:53:19","Twitter for iPhone",10,2,"80978471","KassidyGHill","Kassidy Hill",9086,1083,43130,"Bama✈️Gainesville✈️Green Bay","Reporter for @PGPackersNews and @journalsentinel ~Future @Jeopardy winner~Bama native~Ross wasn't good enough for Rachel~Galatians 6:9",false,,,,,,,"","","","https://twitter.com/32BeatWriters/status/1529163001122758656","NFL Beat Writers","Training camp","We follow all 32 NFL teams' beat writers so you don't have to, even though you should because they do great work.","https://t.co/EhQR4trGzl",false,44921,814,1377,25251,1716,"2016-07-25 19:33:02",false,"https://t.co/EhQR4trGzl","https://discord.gg/qqXkfc3GPs",,"https://pbs.twimg.com/profile_banners/757659945487728640/1650996834",,"http://pbs.twimg.com/profile_images/1484327856905674762/a3aIBH4E_normal.jpg"
"757659945487728640","1529162904381046789","2022-05-24 18:10:21","32BeatWriters","I thought, and some media colleagues agreed, that Malik Willis’ throwing motion already looks tighter and more compact. #Titans. https://t.co/cVboxh8684","Twitter Web App",140,,,,false,true,0,44,,,"","","","","","","","","","","","",,"","","en",,,,,,,,,,,,,,,,"1529158909080092672","I thought, and some media colleagues agreed, that Malik Willis’ throwing motion already looks tighter and more compact. #Titans. https://t.co/cVboxh8684","2022-05-24 17:54:28","Twitter for iPhone",479,44,"19357128","PaulKuharskyNFL","Paul Kuharsky",98979,1804,118955,"Nashville, TN","Too much a cynic. Write at https://t.co/ll99sNooYp. Broadcast @OutKick360. Land-locked beach lover. Springsteen addict. Columbia alum. RPS HOF 2017.",true,,,,,,,"","","","https://twitter.com/32BeatWriters/status/1529162904381046789","NFL Beat Writers","Training camp","We follow all 32 NFL teams' beat writers so you don't have to, even though you should because they do great work.","https://t.co/EhQR4trGzl",false,44921,814,1377,25251,1716,"2016-07-25 19:33:02",false,"https://t.co/EhQR4trGzl","https://discord.gg/qqXkfc3GPs",,"https://pbs.twimg.com/profile_banners/757659945487728640/1650996834",,"http://pbs.twimg.com/profile_images/1484327856905674762/a3aIBH4E_normal.jpg"
"757659945487728640","1529162779462144006","2022-05-24 18:09:51","32BeatWriters","Quads &amp; catches.

@ajdillon7 🙌 🏈

#GoPackGo https://t.co/tH839ic6Y9","Twitter Web App",84,,,,false,true,0,46,,,"","","","","","","","","","","","",,"","","en",,,,,,,,,,,,,,,,"1529159423293378560","Quads &amp; catches.

@ajdillon7 🙌 🏈

#GoPackGo https://t.co/tH839ic6Y9","2022-05-24 17:56:31","Twitter for iPhone",606,46,"35865630","packers","Green Bay Packers",2514769,182,76808,"Green Bay, WI","The official Twitter account of the 13-time World Champion Green Bay Packers. Super Bowl Champions I, II, XXXI, XLV.",true,,,,,,,"","","","https://twitter.com/32BeatWriters/status/1529162779462144006","NFL Beat Writers","Training camp","We follow all 32 NFL teams' beat writers so you don't have to, even though you should because they do great work.","https://t.co/EhQR4trGzl",false,44921,814,1377,25251,1716,"2016-07-25 19:33:02",false,"https://t.co/EhQR4trGzl","https://discord.gg/qqXkfc3GPs",,"https://pbs.twimg.com/profile_banners/757659945487728640/1650996834",,"http://pbs.twimg.com/profile_images/1484327856905674762/a3aIBH4E_normal.jpg"
"757659945487728640","1529162527166406662","2022-05-24 18:08:51","32BeatWriters","Three clips of Robert Woods (No. 2, with knee brace) and two clips of rookie Treylon Burks (No. 16) at #Titans OTA session today: https://t.co/2wQ0Ydwrxn","Twitter Web App",140,,,,false,true,0,6,,,"","","","","","","","","","","","",,"","","en",,,,,,,,,,,,,,,,"1529161630604476417","Three clips of Robert Woods (No. 2, with knee brace) and two clips of rookie Treylon Burks (No. 16) at #Titans OTA session today: https://t.co/2wQ0Ydwrxn","2022-05-24 18:05:17","Twitter for iPhone",47,6,"116857325","glennonsports","John Glennon",24870,729,63338,"Nashville, TN","Titans writer, https://t.co/jKxUFxZlun; Preds writer https://t.co/aJWy0DNzx9. Previous: Titans/Preds for The Athletic, The Tennessean. Member: PFWA. UVa. grad. E-mail: glennonsports@gmail.com",true,,,,,,,"","","","https://twitter.com/32BeatWriters/status/1529162527166406662","NFL Beat Writers","Training camp","We follow all 32 NFL teams' beat writers so you don't have to, even though you should because they do great work.","https://t.co/EhQR4trGzl",false,44921,814,1377,25251,1716,"2016-07-25 19:33:02",false,"https://t.co/EhQR4trGzl","https://discord.gg/qqXkfc3GPs",,"https://pbs.twimg.com/profile_banners/757659945487728640/1650996834",,"http://pbs.twimg.com/profile_images/1484327856905674762/a3aIBH4E_normal.jpg"
"757659945487728640","1529162353237008384","2022-05-24 18:08:10","32BeatWriters","I thought seventh-round pick Skylar Thompson had a really strong practice. Play of the day was a deep shot to Braylon Sanders over two defenders. Also hit Waddle over the middle twice.","Twitter Web App",140,,,,false,true,0,8,,,"","","","","","","","","","","","",,"","","en",,,,,,,,,,,,,,,,"1529154139049050114","I thought seventh-round pick Skylar Thompson had a really strong practice. Play of the day was a deep shot to Braylon Sanders over two defenders. Also hit Waddle over the middle twice.","2022-05-24 17:35:31","Twitter for iPhone",102,8,"1022878914","DanielOyefusi","Daniel Oyefusi",12757,2341,41985,"Miami Lakes, FL","Dolphins Beat Reporter @MiamiHerald | Past: @baltimoresun | #MerrillMade | @sji_update | Music Maker | All that good stuff",true,,,,,,,"","","","https://twitter.com/32BeatWriters/status/1529162353237008384","NFL Beat Writers","Training camp","We follow all 32 NFL teams' beat writers so you don't have to, even though you should because they do great work.","https://t.co/EhQR4trGzl",false,44921,814,1377,25251,1716,"2016-07-25 19:33:02",false,"https://t.co/EhQR4trGzl","https://discord.gg/qqXkfc3GPs",,"https://pbs.twimg.com/profile_banners/757659945487728640/1650996834",,"http://pbs.twimg.com/profile_images/1484327856905674762/a3aIBH4E_normal.jpg"
"757659945487728640","1529161438383771648","2022-05-24 18:04:32","32BeatWriters","Tyreek Hill was asked after practice about how active he was for a practice in May, running countless routes.

“That’s what I do,” he said. “When I signed here I came here to work. I signed up to be a team leader and show this team how I do things. How I do things is I run hard.”","Twitter for iPhone",140,,,,false,true,0,57,,,"","","","","","","","","","","","",,"","","en",,,,,,,,,,,,,,,,"1529161368489820161","Tyreek Hill was asked after practice about how active he was for a practice in May, running countless routes.

“That’s what I do,” he said. “When I signed here I came here to work. I signed up to be a team leader and show this team how I do things. How I do things is I run hard.”","2022-05-24 18:04:15","Twitter for iPhone",635,57,"763497955936444416","WingfieldNFL","Travis Wingfield",36641,686,71385,"Miami, FL","Host of the Drive Time Podcast, part of the @MiamiDolphins Podcast Network. Writer https://t.co/4zmBWubD1q, PNW ✈️ MIA, Washington State University alum",true,,,,,,,"","","","https://twitter.com/32BeatWriters/status/1529161438383771648","NFL Beat Writers","Training camp","We follow all 32 NFL teams' beat writers so you don't have to, even though you should because they do great work.","https://t.co/EhQR4trGzl",false,44921,814,1377,25251,1716,"2016-07-25 19:33:02",false,"https://t.co/EhQR4trGzl","https://discord.gg/qqXkfc3GPs",,"https://pbs.twimg.com/profile_banners/757659945487728640/1650996834",,"http://pbs.twimg.com/profile_images/1484327856905674762/a3aIBH4E_normal.jpg"
"757659945487728640","1529137861521461248","2022-05-24 16:30:50","32BeatWriters","Zac Taylor says Tee Higgins, Logan Wilson and Joseph Ossai (all players dealing with injuries but are present at practice doing rehab work) are expected to be able to participate in training camp #Bengala","Twitter for iPhone",140,,,,false,true,0,3,,,"","","","","","","","","","","","",,"","","en",,,,,,,,,,,,,,,,"1529137659595177984","Zac Taylor says Tee Higgins, Logan Wilson and Joseph Ossai (all players dealing with injuries but are present at practice doing rehab work) are expected to be able to participate in training camp #Bengala","2022-05-24 16:30:02","Twitter for iPhone",51,3,"3396154067","KelseyLConway","Kelsey Conway",30500,859,24106,"Cincinnati, OH","Cincinnati Bengals beat reporter for @enquirer, @EnqSports and @usatoday",true,,,,,,,"","","","https://twitter.com/32BeatWriters/status/1529137861521461248","NFL Beat Writers","Training camp","We follow all 32 NFL teams' beat writers so you don't have to, even though you should because they do great work.","https://t.co/EhQR4trGzl",false,44921,814,1377,25251,1716,"2016-07-25 19:33:02",false,"https://t.co/EhQR4trGzl","https://discord.gg/qqXkfc3GPs",,"https://pbs.twimg.com/profile_banners/757659945487728640/1650996834",,"http://pbs.twimg.com/profile_images/1484327856905674762/a3aIBH4E_normal.jpg"
"757659945487728640","1529137714469257217","2022-05-24 16:30:15","32BeatWriters","#Titans' Vrabel: Loves Hooper's attitude. Was at a charity in California last week for foster children, then took a red-eye flight back to Nashville for OTA session the next day.","Twitter for iPhone",140,,,,false,true,0,11,,,"","","","","","","","","","","","",,"","","en",,,,,,,,,,,,,,,,"1529137518897242117","#Titans' Vrabel: Loves Hooper's attitude. Was at a charity in California last week for foster children, then took a red-eye flight back to Nashville for OTA session the next day.","2022-05-24 16:29:29","Twitter Web App",151,11,"116857325","glennonsports","John Glennon",24870,729,63338,"Nashville, TN","Titans writer, https://t.co/jKxUFxZlun; Preds writer https://t.co/aJWy0DNzx9. Previous: Titans/Preds for The Athletic, The Tennessean. Member: PFWA. UVa. grad. E-mail: glennonsports@gmail.com",true,,,,,,,"","","","https://twitter.com/32BeatWriters/status/1529137714469257217","NFL Beat Writers","Training camp","We follow all 32 NFL teams' beat writers so you don't have to, even though you should because they do great work.","https://t.co/EhQR4trGzl",false,44921,814,1377,25251,1716,"2016-07-25 19:33:02",false,"https://t.co/EhQR4trGzl","https://discord.gg/qqXkfc3GPs",,"https://pbs.twimg.com/profile_banners/757659945487728640/1650996834",,"http://pbs.twimg.com/profile_images/1484327856905674762/a3aIBH4E_normal.jpg"
"757659945487728640","1529136649275420672","2022-05-24 16:26:01","32BeatWriters","Panthers QB Sam Darnold has looked sharp throwing the ball. But everyone out here in shorts and no contact or pressure on the QB in these OTAs.","Twitter Web App",139,,,,false,true,0,3,,,"","","","","","","","","","","","",,"","","en",,,,,,,,,,,,,,,,"1529136269199933440","Panthers QB Sam Darnold has looked sharp throwing the ball. But everyone out here in shorts and no contact or pressure on the QB in these OTAs.","2022-05-24 16:24:31","Twitter for iPhone",20,3,"62934861","SteveReedAP","Steve Reed",20798,206,49822,"Charlotte, North Carolina","Sports Writer for The Associated Press in Charlotte, N.C., covering the Carolina Panthers, Charlotte Hornets, Winter Olympics & anything else sports related.",true,,,,,,,"","","","https://twitter.com/32BeatWriters/status/1529136649275420672","NFL Beat Writers","Training camp","We follow all 32 NFL teams' beat writers so you don't have to, even though you should because they do great work.","https://t.co/EhQR4trGzl",false,44921,814,1377,25251,1716,"2016-07-25 19:33:02",false,"https://t.co/EhQR4trGzl","https://discord.gg/qqXkfc3GPs",,"https://pbs.twimg.com/profile_banners/757659945487728640/1650996834",,"http://pbs.twimg.com/profile_images/1484327856905674762/a3aIBH4E_normal.jpg"
"757659945487728640","1529136642824581121","2022-05-24 16:26:00","32BeatWriters",".@dpeoplesjones with the toe tap 👀 https://t.co/lz6BtnwEnx","Twitter Web App",70,,,,false,true,0,43,,,"","","","","","","","","","","","",,"","","en",,,,,,,,,,,,,,,,"1529136321331175427",".@dpeoplesjones with the toe tap 👀 https://t.co/lz6BtnwEnx","2022-05-24 16:24:43","Twitter for iPhone",611,43,"40358743","Browns","Cleveland Browns",1521490,424,56323,"Cleveland, OH","",true,,,,,,,"","","","https://twitter.com/32BeatWriters/status/1529136642824581121","NFL Beat Writers","Training camp","We follow all 32 NFL teams' beat writers so you don't have to, even though you should because they do great work.","https://t.co/EhQR4trGzl",false,44921,814,1377,25251,1716,"2016-07-25 19:33:02",false,"https://t.co/EhQR4trGzl","https://discord.gg/qqXkfc3GPs",,"https://pbs.twimg.com/profile_banners/757659945487728640/1650996834",,"http://pbs.twimg.com/profile_images/1484327856905674762/a3aIBH4E_normal.jpg"
"757659945487728640","1529136578823585792","2022-05-24 16:25:45","32BeatWriters","Zach fires a AN ABSOLUTE SITTER over the middle to DJ Montgomery for a huge gain","Twitter Web App",96,,,,false,true,0,27,,,"","","","","","","","","","","","",,"","","en",,,,,,,,,,,,,,,,"1529136488260198403","Zach fires a AN ABSOLUTE SITTER over the middle to DJ Montgomery for a huge gain","2022-05-24 16:25:23","Twitter for iPhone",686,27,"334179189","Djbienaime","DJ Bien-Aime",20862,1455,67077,"Miami ✈️New York, USA","Galatians 5:22| Jets beat reporter for @NYDNsports| @columbiajourn & @uofltrackxc alum. #JUCO #NABJ. 🇭🇹. Disagreements are healthy. RT=/=endorsement",true,,,,,,,"","","","https://twitter.com/32BeatWriters/status/1529136578823585792","NFL Beat Writers","Training camp","We follow all 32 NFL teams' beat writers so you don't have to, even though you should because they do great work.","https://t.co/EhQR4trGzl",false,44921,814,1377,25251,1716,"2016-07-25 19:33:02",false,"https://t.co/EhQR4trGzl","https://discord.gg/qqXkfc3GPs",,"https://pbs.twimg.com/profile_banners/757659945487728640/1650996834",,"http://pbs.twimg.com/profile_images/1484327856905674762/a3aIBH4E_normal.jpg"
"757659945487728640","1529136250300530688","2022-05-24 16:24:26","32BeatWriters","#Titans' Vrabel: Says there's no limitations for Treylon Burks. Asked if Burks is dealing with allergies at all, he said he wouldn't get into talking about things like that.","Twitter Web App",140,,,,false,true,0,4,,,"","","","","","","","","","","","",,"","","en",,,,,,,,,,,,,,,,"1529135966849536000","#Titans' Vrabel: Says there's no limitations for Treylon Burks. Asked if Burks is dealing with allergies at all, he said he wouldn't get into talking about things like that.","2022-05-24 16:23:19","Twitter Web App",78,4,"116857325","glennonsports","John Glennon",24870,729,63338,"Nashville, TN","Titans writer, https://t.co/jKxUFxZlun; Preds writer https://t.co/aJWy0DNzx9. Previous: Titans/Preds for The Athletic, The Tennessean. Member: PFWA. UVa. grad. E-mail: glennonsports@gmail.com",true,,,,,,,"","","","https://twitter.com/32BeatWriters/status/1529136250300530688","NFL Beat Writers","Training camp","We follow all 32 NFL teams' beat writers so you don't have to, even though you should because they do great work.","https://t.co/EhQR4trGzl",false,44921,814,1377,25251,1716,"2016-07-25 19:33:02",false,"https://t.co/EhQR4trGzl","https://discord.gg/qqXkfc3GPs",,"https://pbs.twimg.com/profile_banners/757659945487728640/1650996834",,"http://pbs.twimg.com/profile_images/1484327856905674762/a3aIBH4E_normal.jpg"
"757659945487728640","1529136221884121089","2022-05-24 16:24:19","32BeatWriters","Mike Vrabel praises rookie QB Malik Willis for coming in early every day, doing it with a great attitude and taking advantage of his opportunities. #Titans","Twitter Web App",140,,,,false,true,0,15,,,"","","","","","","","","","","","",,"","","en",,,,,,,,,,,,,,,,"1529136075498733568","Mike Vrabel praises rookie QB Malik Willis for coming in early every day, doing it with a great attitude and taking advantage of his opportunities. #Titans","2022-05-24 16:23:45","Twitter for Android",74,15,"105147367","MikeGiardi","Mike Giardi",79337,388,85802,"Boston, MA","Football @nflnetwork. We're going to hell.  Make sure you bring your sunblock.",true,,,,,,,"","","","https://twitter.com/32BeatWriters/status/1529136221884121089","NFL Beat Writers","Training camp","We follow all 32 NFL teams' beat writers so you don't have to, even though you should because they do great work.","https://t.co/EhQR4trGzl",false,44921,814,1377,25251,1716,"2016-07-25 19:33:02",false,"https://t.co/EhQR4trGzl","https://discord.gg/qqXkfc3GPs",,"https://pbs.twimg.com/profile_banners/757659945487728640/1650996834",,"http://pbs.twimg.com/profile_images/1484327856905674762/a3aIBH4E_normal.jpg"
"757659945487728640","1529136125742395393","2022-05-24 16:23:57","32BeatWriters","Treylon Burks was in and out of practice. Vrabel said that everyone comes along differently and he is working hard. Would not comment on his conditioning or if he had any allergy problems.","Twitter for iPhone",140,,,,false,true,0,6,,,"","","","","","","","","","","","",,"","","en",,,,,,,,,,,,,,,,"1529136018988969990","Treylon Burks was in and out of practice. Vrabel said that everyone comes along differently and he is working hard. Would not comment on his conditioning or if he had any allergy problems.","2022-05-24 16:23:31","Twitter for iPhone",22,6,"129605773","terrymc13","Terry McCormick",17705,874,49512,"Nashville, TN","Titans beat writer since 1997. Publisher of https://t.co/8stmRMCt1q, Co-host of ""George Plaster Show"" on WNSR-AM 560. Appear on Fox 17.",false,,,,,,,"","","","https://twitter.com/32BeatWriters/status/1529136125742395393","NFL Beat Writers","Training camp","We follow all 32 NFL teams' beat writers so you don't have to, even though you should because they do great work.","https://t.co/EhQR4trGzl",false,44921,814,1377,25251,1716,"2016-07-25 19:33:02",false,"https://t.co/EhQR4trGzl","https://discord.gg/qqXkfc3GPs",,"https://pbs.twimg.com/profile_banners/757659945487728640/1650996834",,"http://pbs.twimg.com/profile_images/1484327856905674762/a3aIBH4E_normal.jpg"
