"757659945487728640","1477678926470201344","2022-01-02 16:31:24","32BeatWriters","Lamar Jackson is INACTIVE https://t.co/TF1xO9wU7m","Twitter for iPhone",25,,,,true,false,7,1,,,"","","","","","","","","","","","",,"","","en","1477678658563502081","Today’s inactives vs. the Rams. https://t.co/cXPYoV5jnX","2022-01-02 16:30:20","Twitter for iPhone",715,130,"22146282","Ravens","Baltimore Ravens",1702039,157,85211,"Baltimore, MD","Official Twitter account of the Baltimore Ravens | Instagram: Ravens | 👻: BLTRavens | TikTok: Ravens | @RavensPromos | @RavensCommunity | #RavensFlock",true,,,,,,,,,,,,,,,,,,,,,,"","","","https://twitter.com/32BeatWriters/status/1477678926470201344","NFL Beat Writers","Training camp","We follow all 32 NFL teams' beat writers so you don't have to. Follow us to help win your fantasy football league. https://t.co/KK0FOK2MQ1","https://t.co/IJHGG4qFGm",false,44422,774,1339,23882,1528,"2016-07-25 19:33:02",false,"https://t.co/IJHGG4qFGm","https://www.patreon.com/32beatwriters",,"https://pbs.twimg.com/profile_banners/757659945487728640/1597874950",,"http://pbs.twimg.com/profile_images/1438327029976424451/eBZhywAU_normal.jpg"
"757659945487728640","1477678846132596745","2022-01-02 16:31:05","32BeatWriters","Antonio Brown, Mike Evans, Antoine Winfield, Jr., Jamel Dean and Sean Murphy-Bunting are all ACTIVE for the Buccaneers today.","Twitter for iPhone",140,,,,false,true,0,49,,,"","","","","","","","","","","","",,"","","en",,,,,,,,,,,,,,,,"1477678640888520705","Antonio Brown, Mike Evans, Antoine Winfield, Jr., Jamel Dean and Sean Murphy-Bunting are all ACTIVE for the Buccaneers today.","2022-01-02 16:30:16","Twitter Web App",582,49,"1732564220","ScottSBucs","Scott Smith",30802,401,14148,"Tampa, FL","Senior writer/editor for the Tampa Bay Buccaneers.",true,,,,,,,"","","","https://twitter.com/32BeatWriters/status/1477678846132596745","NFL Beat Writers","Training camp","We follow all 32 NFL teams' beat writers so you don't have to. Follow us to help win your fantasy football league. https://t.co/KK0FOK2MQ1","https://t.co/IJHGG4qFGm",false,44422,774,1339,23882,1528,"2016-07-25 19:33:02",false,"https://t.co/IJHGG4qFGm","https://www.patreon.com/32beatwriters",,"https://pbs.twimg.com/profile_banners/757659945487728640/1597874950",,"http://pbs.twimg.com/profile_images/1438327029976424451/eBZhywAU_normal.jpg"
"757659945487728640","1477678689844346883","2022-01-02 16:30:28","32BeatWriters","Parris Campbell was not activated from the IR this week, but he is on the field doing some pregame work. Seems like a decent chance the WR plays in the season finale next week at Jacksonville. #Colts","Twitter for iPhone",139,,,,false,true,0,12,,,"","","","","","","","","","","","",,"","","en",,,,,,,,,,,,,,,,"1477678388076859395","Parris Campbell was not activated from the IR this week, but he is on the field doing some pregame work. Seems like a decent chance the WR plays in the season finale next week at Jacksonville. #Colts","2022-01-02 16:29:16","Twitter Web App",87,12,"117875048","gmbremer","George Bremer",14149,948,76218,"Anderson, IN","CNHI Sports Indiana executive editor, Indianapolis Colts beat writer and sports editor for The Herald Bulletin in Anderson, Ind. @PFWAwriters",false,,,,,,,"","","","https://twitter.com/32BeatWriters/status/1477678689844346883","NFL Beat Writers","Training camp","We follow all 32 NFL teams' beat writers so you don't have to. Follow us to help win your fantasy football league. https://t.co/KK0FOK2MQ1","https://t.co/IJHGG4qFGm",false,44422,774,1339,23882,1528,"2016-07-25 19:33:02",false,"https://t.co/IJHGG4qFGm","https://www.patreon.com/32beatwriters",,"https://pbs.twimg.com/profile_banners/757659945487728640/1597874950",,"http://pbs.twimg.com/profile_images/1438327029976424451/eBZhywAU_normal.jpg"
"757659945487728640","1477678337141223429","2022-01-02 16:29:04","32BeatWriters","Cooper Kupp against the Ravens secondary today https://t.co/G8lVF5t1C5","Twitter for iPhone",46,,,,false,false,61,5,,,"","","","","","","","","","","","",,"","","en",,,,,,,,,,,,,,,,,,,,,,,,,,,,,,,,,,,,,"","","","https://twitter.com/32BeatWriters/status/1477678337141223429","NFL Beat Writers","Training camp","We follow all 32 NFL teams' beat writers so you don't have to. Follow us to help win your fantasy football league. https://t.co/KK0FOK2MQ1","https://t.co/IJHGG4qFGm",false,44422,774,1339,23882,1528,"2016-07-25 19:33:02",false,"https://t.co/IJHGG4qFGm","https://www.patreon.com/32beatwriters",,"https://pbs.twimg.com/profile_banners/757659945487728640/1597874950",,"http://pbs.twimg.com/profile_images/1438327029976424451/eBZhywAU_normal.jpg"
"757659945487728640","1477677860420730892","2022-01-02 16:27:10","32BeatWriters","Jakobi Meyers is now out on the field catching passes. Good sign. https://t.co/F6SsdzqJxI","Twitter for iPhone",86,,,,false,true,0,4,,,"","","","","","","","","","","","",,"","","en",,,,,,,,,,,,,,,,"1477677143345741830","Jakobi Meyers is now out on the field catching passes. Good sign. https://t.co/F6SsdzqJxI","2022-01-02 16:24:19","TweetDeck",17,4,"2868106332","_AndrewCallahan","Andrew Callahan",9352,978,41036,"Boston, MA","Patriots beat writer @BostonHerald. Rule No. 76: No excuses, play like a champion.",false,,,,,,,"","","","https://twitter.com/32BeatWriters/status/1477677860420730892","NFL Beat Writers","Training camp","We follow all 32 NFL teams' beat writers so you don't have to. Follow us to help win your fantasy football league. https://t.co/KK0FOK2MQ1","https://t.co/IJHGG4qFGm",false,44422,774,1339,23882,1528,"2016-07-25 19:33:02",false,"https://t.co/IJHGG4qFGm","https://www.patreon.com/32beatwriters",,"https://pbs.twimg.com/profile_banners/757659945487728640/1597874950",,"http://pbs.twimg.com/profile_images/1438327029976424451/eBZhywAU_normal.jpg"
"757659945487728640","1477677838748864520","2022-01-02 16:27:05","32BeatWriters","Jordan Howard just took the field for warmups here at FedEx Field. The #Eagles RB entered questionable with a stinger, but he's expected to be active.","Twitter for iPhone",140,,,,false,true,0,22,,,"","","","","","","","","","","","",,"","","en",,,,,,,,,,,,,,,,"1477676518591680512","Jordan Howard just took the field for warmups here at FedEx Field. The #Eagles RB entered questionable with a stinger, but he's expected to be active.","2022-01-02 16:21:50","Twitter Web App",145,22,"39545742","Jeff_McLane","Jeff McLane",117851,211,65292,"Philadelphia","Eagles reporter for Phila Inquirer, https://t.co/RKhpvmquMM. I am a journalist / I write to you to show you / I am an incurable / And nothing else behaves like me",true,,,,,,,"","","","https://twitter.com/32BeatWriters/status/1477677838748864520","NFL Beat Writers","Training camp","We follow all 32 NFL teams' beat writers so you don't have to. Follow us to help win your fantasy football league. https://t.co/KK0FOK2MQ1","https://t.co/IJHGG4qFGm",false,44422,774,1339,23882,1528,"2016-07-25 19:33:02",false,"https://t.co/IJHGG4qFGm","https://www.patreon.com/32beatwriters",,"https://pbs.twimg.com/profile_banners/757659945487728640/1597874950",,"http://pbs.twimg.com/profile_images/1438327029976424451/eBZhywAU_normal.jpg"
"757659945487728640","1477674317609680898","2022-01-02 16:13:05","32BeatWriters","RB Damien Harris on the field for his regular warmup. https://t.co/VSDbPyrUBj","Twitter for iPhone",92,,,,false,true,0,32,,,"","","","","","","","","","","","",,"","","en",,,,,,,,,,,,,,,,"1477674263297642501","RB Damien Harris on the field for his regular warmup. https://t.co/VSDbPyrUBj","2022-01-02 16:12:52","Twitter for iPhone",551,32,"35017255","MikeReiss","Mike Reiss",348526,961,92893,"Foxborough, MA","ESPN NFL Nation reporter covering the New England Patriots. IG: mikereisspatriots",true,,,,,,,"","","","https://twitter.com/32BeatWriters/status/1477674317609680898","NFL Beat Writers","Training camp","We follow all 32 NFL teams' beat writers so you don't have to. Follow us to help win your fantasy football league. https://t.co/KK0FOK2MQ1","https://t.co/IJHGG4qFGm",false,44422,774,1339,23882,1528,"2016-07-25 19:33:02",false,"https://t.co/IJHGG4qFGm","https://www.patreon.com/32beatwriters",,"https://pbs.twimg.com/profile_banners/757659945487728640/1597874950",,"http://pbs.twimg.com/profile_images/1438327029976424451/eBZhywAU_normal.jpg"
"757659945487728640","1477671930505445384","2022-01-02 16:03:36","32BeatWriters","We’re 30 minutes away from inactives, and no sign of Lamar Jackson (ankle) warming up on the field. 

All indications are that Tyler Huntley will start again today.","Twitter for iPhone",140,,,,false,true,0,9,,,"","","","","","","","","","","","",,"","","en",,,,,,,,,,,,,,,,"1477671785365749763","We’re 30 minutes away from inactives, and no sign of Lamar Jackson (ankle) warming up on the field. 

All indications are that Tyler Huntley will start again today.","2022-01-02 16:03:02","Twitter for iPhone",95,9,"38530641","jonas_shaffer","Jonas Shaffer",9061,587,19825,"DMV","Sports @baltimoresun. … Born-and-raised Marylander. … Formerly of @DBKSports, @CNSmd, @capecodtimes and @PostSports.",true,,,,,,,"","","","https://twitter.com/32BeatWriters/status/1477671930505445384","NFL Beat Writers","Training camp","We follow all 32 NFL teams' beat writers so you don't have to. Follow us to help win your fantasy football league. https://t.co/KK0FOK2MQ1","https://t.co/IJHGG4qFGm",false,44422,774,1339,23882,1528,"2016-07-25 19:33:02",false,"https://t.co/IJHGG4qFGm","https://www.patreon.com/32beatwriters",,"https://pbs.twimg.com/profile_banners/757659945487728640/1597874950",,"http://pbs.twimg.com/profile_images/1438327029976424451/eBZhywAU_normal.jpg"
"757659945487728640","1477671914831331329","2022-01-02 16:03:32","32BeatWriters","Colts TE Jack Doyle is out on the field warming up, my bet is he plays. (Could be his last game in Lucas Oil Stadium). Not sure about Eric Fisher; if he doesn't go, it'll be Matt Pryor at left tackle.","Twitter for iPhone",140,,,,false,true,0,36,,,"","","","","","","","","","","","",,"","","en",,,,,,,,,,,,,,,,"1477671802004455429","Colts TE Jack Doyle is out on the field warming up, my bet is he plays. (Could be his last game in Lucas Oil Stadium). Not sure about Eric Fisher; if he doesn't go, it'll be Matt Pryor at left tackle.","2022-01-02 16:03:06","Twitter Web App",516,36,"37568810","zkeefer","Zak Keefer",53025,1256,50077,"","Dad to two awesome little girls, cover the Colts and the NFL for @TheAthletic, analyst for @WISH_TV and adjunct professor at @IUMediaSchool.",true,,,,,,,"","","","https://twitter.com/32BeatWriters/status/1477671914831331329","NFL Beat Writers","Training camp","We follow all 32 NFL teams' beat writers so you don't have to. Follow us to help win your fantasy football league. https://t.co/KK0FOK2MQ1","https://t.co/IJHGG4qFGm",false,44422,774,1339,23882,1528,"2016-07-25 19:33:02",false,"https://t.co/IJHGG4qFGm","https://www.patreon.com/32beatwriters",,"https://pbs.twimg.com/profile_banners/757659945487728640/1597874950",,"http://pbs.twimg.com/profile_images/1438327029976424451/eBZhywAU_normal.jpg"
"757659945487728640","1477671425976721410","2022-01-02 16:01:36","32BeatWriters","The #Cardinals have an NFL-high 22 rushing touchdowns. They want to run the ball today against the #Cowboys. While a final decision on RB James Conner won’t be made until team determines how he’s feeling on game day, there seems pessimism about him playing.","Twitter for iPhone",140,,,,false,true,0,21,,,"","","","","","","","","","","","",,"","","en",,,,,,,,,,,,,,,,"1477658876434653192","The #Cardinals have an NFL-high 22 rushing touchdowns. They want to run the ball today against the #Cowboys. While a final decision on RB James Conner won’t be made until team determines how he’s feeling on game day, there seems pessimism about him playing.","2022-01-02 15:11:44","Twitter for iPhone",96,21,"613542402","WerderEdESPN","Ed Werder",228826,731,116964,"","McCann Award winner. ESPN reporter with sense of humor seldom revealed on TV, fan of country music because it’s genre of poets/storytellers. #Doomsday pod",true,,,,,,,"","","","https://twitter.com/32BeatWriters/status/1477671425976721410","NFL Beat Writers","Training camp","We follow all 32 NFL teams' beat writers so you don't have to. Follow us to help win your fantasy football league. https://t.co/KK0FOK2MQ1","https://t.co/IJHGG4qFGm",false,44422,774,1339,23882,1528,"2016-07-25 19:33:02",false,"https://t.co/IJHGG4qFGm","https://www.patreon.com/32beatwriters",,"https://pbs.twimg.com/profile_banners/757659945487728640/1597874950",,"http://pbs.twimg.com/profile_images/1438327029976424451/eBZhywAU_normal.jpg"
"757659945487728640","1477671325460307969","2022-01-02 16:01:12","32BeatWriters","Bills WR Emmanuel Sanders, listed as questionable with a knee injury, is not expected to play today vs. Falcons, per source. Another good opportunity for Gabriel Davis and others.","Twitter for iPhone",140,,,,false,true,0,56,,,"","","","","","","","","","","","",,"","","en",,,,,,,,,,,,,,,,"1477667732267098113","Bills WR Emmanuel Sanders, listed as questionable with a knee injury, is not expected to play today vs. Falcons, per source. Another good opportunity for Gabriel Davis and others.","2022-01-02 15:46:55","Twitter Web App",264,56,"594257142","JFowlerESPN","Jeremy Fowler",91672,2143,28540,"Pittsburgh, PA","ESPN senior NFL reporter. @SportsCenter weekend insider. ABQ-MCO-GNV-MSP-MDW-CLE-PIT-BDL.",true,,,,,,,"","","","https://twitter.com/32BeatWriters/status/1477671325460307969","NFL Beat Writers","Training camp","We follow all 32 NFL teams' beat writers so you don't have to. Follow us to help win your fantasy football league. https://t.co/KK0FOK2MQ1","https://t.co/IJHGG4qFGm",false,44422,774,1339,23882,1528,"2016-07-25 19:33:02",false,"https://t.co/IJHGG4qFGm","https://www.patreon.com/32beatwriters",,"https://pbs.twimg.com/profile_banners/757659945487728640/1597874950",,"http://pbs.twimg.com/profile_images/1438327029976424451/eBZhywAU_normal.jpg"
"757659945487728640","1477654376655249414","2022-01-02 14:53:51","32BeatWriters","#Colts HC Frank Reich just confirmed to me that Carson Wentz has been medically cleared to play this afternoon against the #Raiders. @nflnetwork","Twitter for iPhone",140,,,,false,true,0,204,,,"","","","","","","","","","","","",,"","","en",,,,,,,,,,,,,,,,"1477654179166392321","#Colts HC Frank Reich just confirmed to me that Carson Wentz has been medically cleared to play this afternoon against the #Raiders. @nflnetwork","2022-01-02 14:53:04","Twitter for iPhone",1138,204,"339787006","StaceyDales","StaceyDales",227598,1049,11067,"Chicago, IL","NFL Network, National Correspondent. 670 The Score Chicago, Contributor. WNBA All-Star. Olympian. Sooner.🇨🇦🇺🇸",true,,,,,,,"","","","https://twitter.com/32BeatWriters/status/1477654376655249414","NFL Beat Writers","Training camp","We follow all 32 NFL teams' beat writers so you don't have to. Follow us to help win your fantasy football league. https://t.co/KK0FOK2MQ1","https://t.co/IJHGG4qFGm",false,44422,774,1339,23882,1528,"2016-07-25 19:33:02",false,"https://t.co/IJHGG4qFGm","https://www.patreon.com/32beatwriters",,"https://pbs.twimg.com/profile_banners/757659945487728640/1597874950",,"http://pbs.twimg.com/profile_images/1438327029976424451/eBZhywAU_normal.jpg"
"757659945487728640","1477424284616306697","2022-01-01 23:39:33","32BeatWriters","This game… https://t.co/TbJlQ3nZ0A","Twitter for iPhone",10,,,,false,false,17,3,,,"","","","","","","","","","","","",,"","","en",,,,,,,,,,,,,,,,,,,,,,,,,,,,,,,,,,,,,"","","","https://twitter.com/32BeatWriters/status/1477424284616306697","NFL Beat Writers","Training camp","We follow all 32 NFL teams' beat writers so you don't have to. Follow us to help win your fantasy football league. https://t.co/KK0FOK2MQ1","https://t.co/IJHGG4qFGm",false,44422,774,1339,23882,1528,"2016-07-25 19:33:02",false,"https://t.co/IJHGG4qFGm","https://www.patreon.com/32beatwriters",,"https://pbs.twimg.com/profile_banners/757659945487728640/1597874950",,"http://pbs.twimg.com/profile_images/1438327029976424451/eBZhywAU_normal.jpg"
"757659945487728640","1477389059588857863","2022-01-01 21:19:35","32BeatWriters","Julio Jones stays on the COVID-19 list for the #Titans. He won’t play tomorrow. https://t.co/gphh3LTDS8","Twitter for iPhone",97,,,,false,true,0,74,,,"","","","","","","","","","","","",,"","","en",,,,,,,,,,,,,,,,"1477388731397066753","Julio Jones stays on the COVID-19 list for the #Titans. He won’t play tomorrow. https://t.co/gphh3LTDS8","2022-01-01 21:18:16","Twitter for iPhone",484,74,"12513132","MikeGarafolo","Mike Garafolo",374873,985,85541,"NY/NJ","Reporter, NFL Network. Co-host @GMFB Weekend. Distant cousin of @JimmyG_10. No relation to Pep Guardiola. IG: mike_garafolo",true,,,,,,,"","","","https://twitter.com/32BeatWriters/status/1477389059588857863","NFL Beat Writers","Training camp","We follow all 32 NFL teams' beat writers so you don't have to. Follow us to help win your fantasy football league. https://t.co/KK0FOK2MQ1","https://t.co/IJHGG4qFGm",false,44422,774,1339,23882,1528,"2016-07-25 19:33:02",false,"https://t.co/IJHGG4qFGm","https://www.patreon.com/32beatwriters",,"https://pbs.twimg.com/profile_banners/757659945487728640/1597874950",,"http://pbs.twimg.com/profile_images/1438327029976424451/eBZhywAU_normal.jpg"
"757659945487728640","1477374968690360320","2022-01-01 20:23:35","32BeatWriters","Someone give Terry McLaurin a hug. https://t.co/s8MPfgoc9x","Twitter for iPhone",77,,,,false,true,0,44,,,"","","","","","","","","","","","",,"","","en",,,,,,,,,,,,,,,,"1477374668931797003","Someone give Terry McLaurin a hug. https://t.co/s8MPfgoc9x","2022-01-01 20:22:24","Twitter Web App",325,44,"14212076","NickiJhabvala","Nicki Jhabvala",44830,6881,62602,"","Washington Football Team reporter for @washingtonpost. Previously w/ The Athletic, Denver Post, New York Times & Sports Illustrated. nicki.jhabvala@washpost.com",true,,,,,,,"","","","https://twitter.com/32BeatWriters/status/1477374968690360320","NFL Beat Writers","Training camp","We follow all 32 NFL teams' beat writers so you don't have to. Follow us to help win your fantasy football league. https://t.co/KK0FOK2MQ1","https://t.co/IJHGG4qFGm",false,44422,774,1339,23882,1528,"2016-07-25 19:33:02",false,"https://t.co/IJHGG4qFGm","https://www.patreon.com/32beatwriters",,"https://pbs.twimg.com/profile_banners/757659945487728640/1597874950",,"http://pbs.twimg.com/profile_images/1438327029976424451/eBZhywAU_normal.jpg"
"757659945487728640","1477374827791110145","2022-01-01 20:23:01","32BeatWriters","Source: #Broncos WR Courtland Sutton, who Vic Fangio said could land on COVID list, has been cleared to travel with the team to LA with the expectation of playing Sunday vs the #Chargers.","Twitter for iPhone",139,,,,false,true,0,133,,,"","","","","","","","","","","","",,"","","en",,,,,,,,,,,,,,,,"1477373673678028800","Source: #Broncos WR Courtland Sutton, who Vic Fangio said could land on COVID list, has been cleared to travel with the team to LA with the expectation of playing Sunday vs the #Chargers.","2022-01-01 20:18:26","TweetDeck",1523,133,"16403943","RapSheet","Ian Rapoport",3048918,728,151706,"New York","National Insider for NFL Network and https://t.co/NIVZ6FP1b6. Husband of @thebanktress. Made seven cameos in the movie, Draft Day.",true,,,,,,,"","","","https://twitter.com/32BeatWriters/status/1477374827791110145","NFL Beat Writers","Training camp","We follow all 32 NFL teams' beat writers so you don't have to. Follow us to help win your fantasy football league. https://t.co/KK0FOK2MQ1","https://t.co/IJHGG4qFGm",false,44422,774,1339,23882,1528,"2016-07-25 19:33:02",false,"https://t.co/IJHGG4qFGm","https://www.patreon.com/32beatwriters",,"https://pbs.twimg.com/profile_banners/757659945487728640/1597874950",,"http://pbs.twimg.com/profile_images/1438327029976424451/eBZhywAU_normal.jpg"
"757659945487728640","1477372676863897600","2022-01-01 20:14:29","32BeatWriters","The #Browns have ruled out John Johnson III (hamstring), Troy Hill (knee) and Ronnie Harrison (ankle) for Monday's game against the Steelers. 

Kareem Hunt (ankle) and Malik Jackson (knee) are listed as questionable.","Twitter for iPhone",140,,,,false,true,0,30,,,"","","","","","","","","","","","",,"","","en",,,,,,,,,,,,,,,,"1477370554827091970","The #Browns have ruled out John Johnson III (hamstring), Troy Hill (knee) and Ronnie Harrison (ankle) for Monday's game against the Steelers. 

Kareem Hunt (ankle) and Malik Jackson (knee) are listed as questionable.","2022-01-01 20:06:03","TweetDeck",376,30,"32893049","camijustice","Camryn Justice",25249,1415,15156,"","@WEWS Digital Content Producer | Emmy-nominated sports journalist | Browns | Cavs | Guardians | Covering news/sports in Northeast Ohio | Just a kid from Akron",true,,,,,,,"","","","https://twitter.com/32BeatWriters/status/1477372676863897600","NFL Beat Writers","Training camp","We follow all 32 NFL teams' beat writers so you don't have to. Follow us to help win your fantasy football league. https://t.co/KK0FOK2MQ1","https://t.co/IJHGG4qFGm",false,44422,774,1339,23882,1528,"2016-07-25 19:33:02",false,"https://t.co/IJHGG4qFGm","https://www.patreon.com/32beatwriters",,"https://pbs.twimg.com/profile_banners/757659945487728640/1597874950",,"http://pbs.twimg.com/profile_images/1438327029976424451/eBZhywAU_normal.jpg"
"757659945487728640","1477372631192162306","2022-01-01 20:14:18","32BeatWriters","Been hearing good reports on Trey Sermon. When #49ers activate him off IR, it will create a good problem of which RBs to suit up on the 48-man game day roster and which RBs to make inactive. Their RBs will be Elijah Mitchell, Jeff Wilson, JaMycal Hasty, Brian Hill and Sermon.","Twitter for iPhone",140,,,,false,true,0,34,,,"","","","","","","","","","","","",,"","","en",,,,,,,,,,,,,,,,"1477366924568899584","Been hearing good reports on Trey Sermon. When #49ers activate him off IR, it will create a good problem of which RBs to suit up on the 48-man game day roster and which RBs to make inactive. Their RBs will be Elijah Mitchell, Jeff Wilson, JaMycal Hasty, Brian Hill and Sermon.","2022-01-01 19:51:37","Twitter Web App",594,34,"27796499","MaioccoNBCS","Matt Maiocco",124976,1391,60378,"San Francisco","🇺🇸 NBC Sports Bay Area. KNBR-680. Season No. 27 covering the 49ers. Pro Football Hall of Fame Selection Committee. Subscribe to 49ers Talk podcast. 🇺🇸",true,,,,,,,"","","","https://twitter.com/32BeatWriters/status/1477372631192162306","NFL Beat Writers","Training camp","We follow all 32 NFL teams' beat writers so you don't have to. Follow us to help win your fantasy football league. https://t.co/KK0FOK2MQ1","https://t.co/IJHGG4qFGm",false,44422,774,1339,23882,1528,"2016-07-25 19:33:02",false,"https://t.co/IJHGG4qFGm","https://www.patreon.com/32beatwriters",,"https://pbs.twimg.com/profile_banners/757659945487728640/1597874950",,"http://pbs.twimg.com/profile_images/1438327029976424451/eBZhywAU_normal.jpg"
"757659945487728640","1477372332058595331","2022-01-01 20:13:06","32BeatWriters","Antonio Gandy Golden cut. 2020 4th rounder never came around.","Twitter for iPhone",79,,,,false,true,0,55,,,"","","","","","","","","","","","",,"","","en",,,,,,,,,,,,,,,,"1477370891340324870","Antonio Gandy Golden cut. 2020 4th rounder never came around.","2022-01-01 20:07:23","Twitter for iPhone",493,55,"39736881","JPFinlayNBCS","JP Finlay",59122,1087,80703,"DC","hate when folks say nobody is from DC | weekdays 10-2 @1067theFan | Podcast/TV/all things Washington Football for @nbcswashington",true,,,,,,,"","","","https://twitter.com/32BeatWriters/status/1477372332058595331","NFL Beat Writers","Training camp","We follow all 32 NFL teams' beat writers so you don't have to. Follow us to help win your fantasy football league. https://t.co/KK0FOK2MQ1","https://t.co/IJHGG4qFGm",false,44422,774,1339,23882,1528,"2016-07-25 19:33:02",false,"https://t.co/IJHGG4qFGm","https://www.patreon.com/32beatwriters",,"https://pbs.twimg.com/profile_banners/757659945487728640/1597874950",,"http://pbs.twimg.com/profile_images/1438327029976424451/eBZhywAU_normal.jpg"
"757659945487728640","1477372273770311681","2022-01-01 20:12:52","32BeatWriters","The #Colts activated QB Carson Wentz from the Reserve/COVID-19 list -- a procedural move that needed to happen by 4 p.m. today.

Final clearance can't come until Sunday morning, but the full expectation is Wentz gets it and starts against the #Raiders.","Twitter for iPhone",139,,,,false,true,0,85,,,"","","","","","","","","","","","",,"","","en",,,,,,,,,,,,,,,,"1477356537567920132","The #Colts activated QB Carson Wentz from the Reserve/COVID-19 list -- a procedural move that needed to happen by 4 p.m. today.

Final clearance can't come until Sunday morning, but the full expectation is Wentz gets it and starts against the #Raiders.","2022-01-01 19:10:21","TweetDeck",508,85,"36089053","TomPelissero","Tom Pelissero",363284,1292,76626,"","Reporter, @NFLNetwork. Host, @SiriusXMNFL. Husband, @SaraPelissero. Dad, the best girls ever.",true,,,,,,,"","","","https://twitter.com/32BeatWriters/status/1477372273770311681","NFL Beat Writers","Training camp","We follow all 32 NFL teams' beat writers so you don't have to. Follow us to help win your fantasy football league. https://t.co/KK0FOK2MQ1","https://t.co/IJHGG4qFGm",false,44422,774,1339,23882,1528,"2016-07-25 19:33:02",false,"https://t.co/IJHGG4qFGm","https://www.patreon.com/32beatwriters",,"https://pbs.twimg.com/profile_banners/757659945487728640/1597874950",,"http://pbs.twimg.com/profile_images/1438327029976424451/eBZhywAU_normal.jpg"
