"757659945487728640","1430570745684496386","2021-08-25 16:40:19","32BeatWriters","Offensive coordinator Greg Roman on #Ravens backup RBs Ty'Son Williams, Nate McCrary: ""They just come out every day and get better and make plays and show up. This is the ultimate meritocracy. You do a good job, you get rewarded. So they're making a strong case.""","Twitter Web App",140,,,,false,true,0,3,,,"","","","","","","","","","","","",,"","","en",,,,,,,,,,,,,,,,"1430570633356881922","Offensive coordinator Greg Roman on #Ravens backup RBs Ty'Son Williams, Nate McCrary: ""They just come out every day and get better and make plays and show up. This is the ultimate meritocracy. You do a good job, you get rewarded. So they're making a strong case.""","2021-08-25 16:39:52","TweetDeck",12,3,"36724078","bsmolka","Bo Smolka",3817,922,33548,"Baltimore, MD","Ravens beat writer for PressBox, former BaltSun desk editor, Bucknell SID. Past winner CoSIDA National Story of the Year. Above all else, husband and father",false,,,,,,,"","","","https://twitter.com/32BeatWriters/status/1430570745684496386","NFL Beat Writers","Training camp","We follow all 32 NFL teams' beat writers so you don't have to. Follow us to help win your fantasy football league. https://t.co/KK0FOJLbrr",,false,39672,755,1183,21619,1324,"2016-07-25 19:33:02",false,,,,"https://pbs.twimg.com/profile_banners/757659945487728640/1597874950",,"http://pbs.twimg.com/profile_images/1408078731051143171/SrpTaIsQ_normal.jpg"
"757659945487728640","1430570611617812484","2021-08-25 16:39:47","32BeatWriters","“If you have zero turnovers you also have zero explosive plays.” Zach Wilson said it’s about finding the balance of when to take chances, and when not. 

Thought this was a great answer #Jets https://t.co/bcEdQsHcHH","Twitter Web App",140,,,,false,true,0,101,,,"","","","","","","","","","","","",,"","","en",,,,,,,,,,,,,,,,"1430569754620841992","“If you have zero turnovers you also have zero explosive plays.” Zach Wilson said it’s about finding the balance of when to take chances, and when not. 

Thought this was a great answer #Jets https://t.co/bcEdQsHcHH","2021-08-25 16:36:22","Twitter for iPhone",1463,101,"314776155","Connor_J_Hughes","Connor Hughes",44854,969,77493,"Princeton, NJ","Covering the Jets for @TheAthletic | Analyst & TV guy for @SNYtv, @CBSNewYork | #CantWait podcast co-host | Big fan of my dog",true,,,,,,,"","","","https://twitter.com/32BeatWriters/status/1430570611617812484","NFL Beat Writers","Training camp","We follow all 32 NFL teams' beat writers so you don't have to. Follow us to help win your fantasy football league. https://t.co/KK0FOJLbrr",,false,39672,755,1183,21619,1324,"2016-07-25 19:33:02",false,,,,"https://pbs.twimg.com/profile_banners/757659945487728640/1597874950",,"http://pbs.twimg.com/profile_images/1408078731051143171/SrpTaIsQ_normal.jpg"
"757659945487728640","1430569775986528261","2021-08-25 16:36:27","32BeatWriters","Damien Harris took the first handoff of every 11-on-11 period, which has been the case throughout the summer. Rhamondre Stevenson took the second handoff each period today, so he got the biggest bump following the Sony Michel trade.","Twitter Web App",140,,,,false,true,0,52,,,"","","","","","","","","","","","",,"","","en",,,,,,,,,,,,,,,,"1430568530194440194","Damien Harris took the first handoff of every 11-on-11 period, which has been the case throughout the summer. Rhamondre Stevenson took the second handoff each period today, so he got the biggest bump following the Sony Michel trade.","2021-08-25 16:31:30","Twitter for iPhone",564,52,"59001491","jeffphowe","Jeff Howe",121084,685,70521,"Boston","Patriots beat reporter for @TheAthleticNFL. Follow me. You'll feel better about yourself. https://t.co/FF7H3LYLgE",true,,,,,,,"","","","https://twitter.com/32BeatWriters/status/1430569775986528261","NFL Beat Writers","Training camp","We follow all 32 NFL teams' beat writers so you don't have to. Follow us to help win your fantasy football league. https://t.co/KK0FOJLbrr",,false,39672,755,1183,21619,1324,"2016-07-25 19:33:02",false,,,,"https://pbs.twimg.com/profile_banners/757659945487728640/1597874950",,"http://pbs.twimg.com/profile_images/1408078731051143171/SrpTaIsQ_normal.jpg"
"757659945487728640","1430569631513812998","2021-08-25 16:35:53","32BeatWriters","Some good news: Dak Prescott is expected to throw in 7-on-7 today.

His first competitive work since the first week of training camp.","Twitter Web App",140,,,,false,true,0,113,,,"","","","","","","","","","","","",,"","","en",,,,,,,,,,,,,,,,"1430567584638939137","Some good news: Dak Prescott is expected to throw in 7-on-7 today.

His first competitive work since the first week of training camp.","2021-08-25 16:27:45","Twitter for iPhone",1305,113,"1322996809","HelmanDC","David Helman",91964,2369,74133,"Dallas, Texas","Staff Writer for https://t.co/THXAyZ3ool. NOLA native, LSU grad, Emmy winner. Cowboys Twitter's foremost @BIGKRIT fan.",true,,,,,,,"","","","https://twitter.com/32BeatWriters/status/1430569631513812998","NFL Beat Writers","Training camp","We follow all 32 NFL teams' beat writers so you don't have to. Follow us to help win your fantasy football league. https://t.co/KK0FOJLbrr",,false,39672,755,1183,21619,1324,"2016-07-25 19:33:02",false,,,,"https://pbs.twimg.com/profile_banners/757659945487728640/1597874950",,"http://pbs.twimg.com/profile_images/1408078731051143171/SrpTaIsQ_normal.jpg"
"757659945487728640","1430567641496891396","2021-08-25 16:27:59","32BeatWriters","Saleh said he’s leaning toward playing Zach Wilson and starters on Friday night, but not more than a half. #Jets","Twitter Web App",128,,,,false,true,0,22,,,"","","","","","","","","","","","",,"","","en",,,,,,,,,,,,,,,,"1430565798544822274","Saleh said he’s leaning toward playing Zach Wilson and starters on Friday night, but not more than a half. #Jets","2021-08-25 16:20:39","Twitter for iPhone",418,22,"136026074","RichCimini","Rich Cimini",105525,1412,63642,"","ESPN NFL Nation reporter Rich Cimini covers the New York Jets. Proud Syracuse alum, member of the Suffolk County (N.Y.) and Sachem High Sports Halls of Fame.",true,,,,,,,"","","","https://twitter.com/32BeatWriters/status/1430567641496891396","NFL Beat Writers","Training camp","We follow all 32 NFL teams' beat writers so you don't have to. Follow us to help win your fantasy football league. https://t.co/KK0FOJLbrr",,false,39672,755,1183,21619,1324,"2016-07-25 19:33:02",false,,,,"https://pbs.twimg.com/profile_banners/757659945487728640/1597874950",,"http://pbs.twimg.com/profile_images/1408078731051143171/SrpTaIsQ_normal.jpg"
"757659945487728640","1430567601369927680","2021-08-25 16:27:49","32BeatWriters","Josh Oliver leads the Ravens in catches this preseason. This Greg Roman quote says a lot about his roster chances:

""When you watch him, you can envision using him in certain ways, and that's really, as a coach, what you're looking for. ... 'OK, now what can we do with him?' ""","Twitter Web App",140,,,,false,true,0,13,,,"","","","","","","","","","","","",,"","","en",,,,,,,,,,,,,,,,"1430563454742638596","Josh Oliver leads the Ravens in catches this preseason. This Greg Roman quote says a lot about his roster chances:

""When you watch him, you can envision using him in certain ways, and that's really, as a coach, what you're looking for. ... 'OK, now what can we do with him?' ""","2021-08-25 16:11:20","Twitter Web App",183,13,"38530641","jonas_shaffer","Jonas Shaffer",6987,555,16806,"DMV","Sports @baltimoresun. … Born-and-raised Marylander. … Formerly of @DBKSports, @CNSmd, @capecodtimes and @PostSports.",true,,,,,,,"","","","https://twitter.com/32BeatWriters/status/1430567601369927680","NFL Beat Writers","Training camp","We follow all 32 NFL teams' beat writers so you don't have to. Follow us to help win your fantasy football league. https://t.co/KK0FOJLbrr",,false,39672,755,1183,21619,1324,"2016-07-25 19:33:02",false,,,,"https://pbs.twimg.com/profile_banners/757659945487728640/1597874950",,"http://pbs.twimg.com/profile_images/1408078731051143171/SrpTaIsQ_normal.jpg"
"757659945487728640","1430567470558031874","2021-08-25 16:27:18","32BeatWriters","Mac Jones just threw a beautiful ball to Jakobi Meyers, a corner route for a TD. Meyers had snuck past two defenders. He was shaken up after hitting the turf but shook it off.","Twitter Web App",140,,,,false,true,0,45,,,"","","","","","","","","","","","",,"","","en",,,,,,,,,,,,,,,,"1430563318129991681","Mac Jones just threw a beautiful ball to Jakobi Meyers, a corner route for a TD. Meyers had snuck past two defenders. He was shaken up after hitting the turf but shook it off.","2021-08-25 16:10:48","Twitter for Android",458,45,"105147367","MikeGiardi","Michael Giardi",68173,389,79670,"Boston, MA","Football @nflnetwork. We're going to hell.  Make sure you bring your sunblock.",true,,,,,,,"","","","https://twitter.com/32BeatWriters/status/1430567470558031874","NFL Beat Writers","Training camp","We follow all 32 NFL teams' beat writers so you don't have to. Follow us to help win your fantasy football league. https://t.co/KK0FOJLbrr",,false,39672,755,1183,21619,1324,"2016-07-25 19:33:02",false,,,,"https://pbs.twimg.com/profile_banners/757659945487728640/1597874950",,"http://pbs.twimg.com/profile_images/1408078731051143171/SrpTaIsQ_normal.jpg"
"757659945487728640","1430567362248519686","2021-08-25 16:26:52","32BeatWriters","Bengals’ HC Zac Taylor said today that Joe Burrow will play a limited amount Sunday against Miami.","Twitter for iPhone",116,,,,false,true,0,171,,,"","","","","","","","","","","","",,"","","en",,,,,,,,,,,,,,,,"1430567258565316610","Bengals’ HC Zac Taylor said today that Joe Burrow will play a limited amount Sunday against Miami.","2021-08-25 16:26:27","Twitter for iPhone",2176,171,"51263592","AdamSchefter","Adam Schefter",8498882,3441,55716,"New York","ESPN Senior NFL Insider. 
Interview & Podcast Requests: ESPNPR@espn.com
Host of the Adam Schefter Podcast
https://t.co/oz43ix5jZU",true,,,,,,,"","","","https://twitter.com/32BeatWriters/status/1430567362248519686","NFL Beat Writers","Training camp","We follow all 32 NFL teams' beat writers so you don't have to. Follow us to help win your fantasy football league. https://t.co/KK0FOJLbrr",,false,39672,755,1183,21619,1324,"2016-07-25 19:33:02",false,,,,"https://pbs.twimg.com/profile_banners/757659945487728640/1597874950",,"http://pbs.twimg.com/profile_images/1408078731051143171/SrpTaIsQ_normal.jpg"
"757659945487728640","1430559722348990472","2021-08-25 15:56:30","32BeatWriters","#Jaguars HC Urban Meyer says Marvin Jones has an AC sprain, will be questionable for the game against Dallas. Should be fine for the opener.","Twitter Web App",140,,,,false,true,0,9,,,"","","","","","","","","","","","",,"","","en",,,,,,,,,,,,,,,,"1430559542501421060","#Jaguars HC Urban Meyer says Marvin Jones has an AC sprain, will be questionable for the game against Dallas. Should be fine for the opener.","2021-08-25 15:55:48","Twitter for iPhone",79,9,"15216982","Demetrius82","Demetrius Harvey",8340,1590,268192,"Jacksonville, FL","Deputy Editor for @SI_AllGators covering Gators athletics and Beat Writer covering Jaguars for @BigCatCountry || Opinions are my own. FAU 🦉 Alum. 🎙️ Pending",true,,,,,,,"","","","https://twitter.com/32BeatWriters/status/1430559722348990472","NFL Beat Writers","Training camp","We follow all 32 NFL teams' beat writers so you don't have to. Follow us to help win your fantasy football league. https://t.co/KK0FOJLbrr",,false,39672,755,1183,21619,1324,"2016-07-25 19:33:02",false,,,,"https://pbs.twimg.com/profile_banners/757659945487728640/1597874950",,"http://pbs.twimg.com/profile_images/1408078731051143171/SrpTaIsQ_normal.jpg"
"757659945487728640","1430558206229680131","2021-08-25 15:50:29","32BeatWriters","I have Mac Jones 13-for-15 in 11-on-11s and 25-for-29 overall so far today, with 19 straight completions at one point. Extremely efficient day for the rookie to this point.","Twitter for iPhone",140,,,,false,true,0,96,,,"","","","","","","","","","","","",,"","","en",,,,,,,,,,,,,,,,"1430557738988417033","I have Mac Jones 13-for-15 in 11-on-11s and 25-for-29 overall so far today, with 19 straight completions at one point. Extremely efficient day for the rookie to this point.","2021-08-25 15:48:38","Twitter for iPhone",940,96,"207765804","ZackCoxNESN","Zack Cox",23336,1539,52471,"Boston","Patriots beat writer at @NESN // co-host, NESN Patriots Podcast // @UofNH alum // Scrumhalf @CharlesRiverRFC // Tweener and a duck gets you on base.",true,,,,,,,"","","","https://twitter.com/32BeatWriters/status/1430558206229680131","NFL Beat Writers","Training camp","We follow all 32 NFL teams' beat writers so you don't have to. Follow us to help win your fantasy football league. https://t.co/KK0FOJLbrr",,false,39672,755,1183,21619,1324,"2016-07-25 19:33:02",false,,,,"https://pbs.twimg.com/profile_banners/757659945487728640/1597874950",,"http://pbs.twimg.com/profile_images/1408078731051143171/SrpTaIsQ_normal.jpg"
"757659945487728640","1430558115687174146","2021-08-25 15:50:07","32BeatWriters","Eagles and Jets finishing with 2 minute drills. 1s vs 1s. Hurts throws arguably 3 TDs (one may have been a sack, the other maybe Ward was stopped just short.) Final TD to DeVonta Smith working against good Bless Austin coverage.","Twitter for iPhone",140,,,,false,true,0,6,,,"","","","","","","","","","","","",,"","","en",,,,,,,,,,,,,,,,"1430557921801383937","Eagles and Jets finishing with 2 minute drills. 1s vs 1s. Hurts throws arguably 3 TDs (one may have been a sack, the other maybe Ward was stopped just short.) Final TD to DeVonta Smith working against good Bless Austin coverage.","2021-08-25 15:49:21","Twitter for iPhone",13,6,"45975888","jjones9","Jonathan Jones",38336,1426,67722,"","Senior NFL reporter @CBSSports @CBSSportsHQ @CBSSportsNet. Shelby native formerly of @SINow @theobserver @dailytarheel. Email jonathan.jones@cbs.com",true,,,,,,,"","","","https://twitter.com/32BeatWriters/status/1430558115687174146","NFL Beat Writers","Training camp","We follow all 32 NFL teams' beat writers so you don't have to. Follow us to help win your fantasy football league. https://t.co/KK0FOJLbrr",,false,39672,755,1183,21619,1324,"2016-07-25 19:33:02",false,,,,"https://pbs.twimg.com/profile_banners/757659945487728640/1597874950",,"http://pbs.twimg.com/profile_images/1408078731051143171/SrpTaIsQ_normal.jpg"
"757659945487728640","1430558072037167106","2021-08-25 15:49:57","32BeatWriters","Urban Meyer says Travis Etienne's injury was like a ""shot to the jaw."" Says Etienne was making plays in practice. They're still working through how to fill his absence","Twitter for iPhone",140,,,,false,true,0,16,,,"","","","","","","","","","","","",,"","","en",,,,,,,,,,,,,,,,"1430557956261744642","Urban Meyer says Travis Etienne's injury was like a ""shot to the jaw."" Says Etienne was making plays in practice. They're still working through how to fill his absence","2021-08-25 15:49:29","Twitter for iPhone",170,16,"797228195007385600","_John_Shipley","John Shipley",9451,1056,39129,"","Beat for @JaguarReport. UCF alum. Opinions/tweets are my own. Retweets aren't endorsements. Whateva happened to Gary Cooper? SDS♥️",false,,,,,,,"","","","https://twitter.com/32BeatWriters/status/1430558072037167106","NFL Beat Writers","Training camp","We follow all 32 NFL teams' beat writers so you don't have to. Follow us to help win your fantasy football league. https://t.co/KK0FOJLbrr",,false,39672,755,1183,21619,1324,"2016-07-25 19:33:02",false,,,,"https://pbs.twimg.com/profile_banners/757659945487728640/1597874950",,"http://pbs.twimg.com/profile_images/1408078731051143171/SrpTaIsQ_normal.jpg"
"757659945487728640","1430558016093499399","2021-08-25 15:49:44","32BeatWriters","𝐐𝐁𝟏 

#DUUUVAL https://t.co/uPhSGSii8P","Twitter for iPhone",51,,,,false,true,0,902,,,"","","","","","","","","","","","",,"","","und",,,,,,,,,,,,,,,,"1430557959625625609","𝐐𝐁𝟏 

#DUUUVAL https://t.co/uPhSGSii8P","2021-08-25 15:49:30","Twitter Web App",6363,902,"59471027","Jaguars","Jacksonville Jaguars",713324,600,62135,"Jacksonville, FL","Loading...",true,,,,,,,"","","","https://twitter.com/32BeatWriters/status/1430558016093499399","NFL Beat Writers","Training camp","We follow all 32 NFL teams' beat writers so you don't have to. Follow us to help win your fantasy football league. https://t.co/KK0FOJLbrr",,false,39672,755,1183,21619,1324,"2016-07-25 19:33:02",false,,,,"https://pbs.twimg.com/profile_banners/757659945487728640/1597874950",,"http://pbs.twimg.com/profile_images/1408078731051143171/SrpTaIsQ_normal.jpg"
"757659945487728640","1430548657313665030","2021-08-25 15:12:32","32BeatWriters","Khari and Parris Campbell getting veteran rest days, per Colts.","Twitter for iPhone",78,,,,false,true,0,9,,,"","","","","","","","","","","","",,"","","en",,,,,,,,,,,,,,,,"1430548439310479363","Khari and Parris Campbell getting veteran rest days, per Colts.","2021-08-25 15:11:40","Twitter for iPhone",169,9,"239928598","jimayello","Jim Ayello",9962,1800,34418,"Indianapolis","@IndyStar Colts Insider. Co-host of Colts Cover-2 podcast. Husband, dad, Mizzou alum, PFWA member.",true,,,,,,,"","","","https://twitter.com/32BeatWriters/status/1430548657313665030","NFL Beat Writers","Training camp","We follow all 32 NFL teams' beat writers so you don't have to. Follow us to help win your fantasy football league. https://t.co/KK0FOJLbrr",,false,39672,755,1183,21619,1324,"2016-07-25 19:33:02",false,,,,"https://pbs.twimg.com/profile_banners/757659945487728640/1597874950",,"http://pbs.twimg.com/profile_images/1408078731051143171/SrpTaIsQ_normal.jpg"
"757659945487728640","1430548611172085762","2021-08-25 15:12:21","32BeatWriters","TY Hilton back running routes in 7 on 7.","Twitter for iPhone",55,,,,false,true,0,3,,,"","","","","","","","","","","","",,"","","en",,,,,,,,,,,,,,,,"1430545108164808707","TY Hilton back running routes in 7 on 7.","2021-08-25 14:58:26","Twitter for iPhone",34,3,"239928598","jimayello","Jim Ayello",9962,1800,34418,"Indianapolis","@IndyStar Colts Insider. Co-host of Colts Cover-2 podcast. Husband, dad, Mizzou alum, PFWA member.",true,,,,,,,"","","","https://twitter.com/32BeatWriters/status/1430548611172085762","NFL Beat Writers","Training camp","We follow all 32 NFL teams' beat writers so you don't have to. Follow us to help win your fantasy football league. https://t.co/KK0FOJLbrr",,false,39672,755,1183,21619,1324,"2016-07-25 19:33:02",false,,,,"https://pbs.twimg.com/profile_banners/757659945487728640/1597874950",,"http://pbs.twimg.com/profile_images/1408078731051143171/SrpTaIsQ_normal.jpg"
"757659945487728640","1430548585364529156","2021-08-25 15:12:15","32BeatWriters","Patriots RB JJ Taylor is breaking Giants LBs’ ankles in 1-on-1 pass-catching drills. Finished with a deep completion from Mac Jones.","Twitter for iPhone",140,,,,false,true,0,60,,,"","","","","","","","","","","","",,"","","en",,,,,,,,,,,,,,,,"1430545418300149764","Patriots RB JJ Taylor is breaking Giants LBs’ ankles in 1-on-1 pass-catching drills. Finished with a deep completion from Mac Jones.","2021-08-25 14:59:40","Twitter for iPhone",826,60,"21995237","DougKyed","Doug Kyed",50329,799,84822,"MetroWest, Mass.","NFL reporter @PFF. Email: doug.kyed@pff.com. Insta: dougkyed. Last name rhymes with dyed.",true,,,,,,,"","","","https://twitter.com/32BeatWriters/status/1430548585364529156","NFL Beat Writers","Training camp","We follow all 32 NFL teams' beat writers so you don't have to. Follow us to help win your fantasy football league. https://t.co/KK0FOJLbrr",,false,39672,755,1183,21619,1324,"2016-07-25 19:33:02",false,,,,"https://pbs.twimg.com/profile_banners/757659945487728640/1597874950",,"http://pbs.twimg.com/profile_images/1408078731051143171/SrpTaIsQ_normal.jpg"
"757659945487728640","1430548095583068162","2021-08-25 15:10:18","32BeatWriters","The Bills have signed WR Steven Sims. https://t.co/DFPsuSUXbi","Twitter for iPhone",81,,,,false,true,0,85,,,"","","","","","","","","","","","",,"","","en",,,,,,,,,,,,,,,,"1430532969626800130","The Bills have signed WR Steven Sims. https://t.co/DFPsuSUXbi","2021-08-25 14:10:12","Twitter Web App",416,85,"2796217720","BuffaloBillsPR","Buffalo Bills PR",56307,217,5390,"","Official Twitter account of the @buffalobills Communications Department.",true,,,,,,,"","","","https://twitter.com/32BeatWriters/status/1430548095583068162","NFL Beat Writers","Training camp","We follow all 32 NFL teams' beat writers so you don't have to. Follow us to help win your fantasy football league. https://t.co/KK0FOJLbrr",,false,39672,755,1183,21619,1324,"2016-07-25 19:33:02",false,,,,"https://pbs.twimg.com/profile_banners/757659945487728640/1597874950",,"http://pbs.twimg.com/profile_images/1408078731051143171/SrpTaIsQ_normal.jpg"
"757659945487728640","1430548024867053569","2021-08-25 15:10:02","32BeatWriters","In team period, Daniel Jones just intercepted by Kyle Dugger. Pass intended for Darius Slayton.  Thrown right to Dugger.","Twitter for iPhone",140,,,,false,true,0,6,,,"","","","","","","","","","","","",,"","","en",,,,,,,,,,,,,,,,"1430547871422722054","In team period, Daniel Jones just intercepted by Kyle Dugger. Pass intended for Darius Slayton.  Thrown right to Dugger.","2021-08-25 15:09:25","Twitter for iPhone",26,6,"51190021","NYPost_Schwartz","Paul Schwartz",43100,454,64148,"","I've been The Post's Giants beat writer since 1994.",true,,,,,,,"","","","https://twitter.com/32BeatWriters/status/1430548024867053569","NFL Beat Writers","Training camp","We follow all 32 NFL teams' beat writers so you don't have to. Follow us to help win your fantasy football league. https://t.co/KK0FOJLbrr",,false,39672,755,1183,21619,1324,"2016-07-25 19:33:02",false,,,,"https://pbs.twimg.com/profile_banners/757659945487728640/1597874950",,"http://pbs.twimg.com/profile_images/1408078731051143171/SrpTaIsQ_normal.jpg"
"757659945487728640","1430547998271057923","2021-08-25 15:09:55","32BeatWriters","In red zone drill, Hurts had completions for TDs to Boston Scott and Goedert. Flacco had one to Greg Ward. But Hurts also had a bad incompletion in the flat. #Eagles","Twitter for iPhone",140,,,,false,true,0,6,,,"","","","","","","","","","","","",,"","","en",,,,,,,,,,,,,,,,"1430547466949124104","In red zone drill, Hurts had completions for TDs to Boston Scott and Goedert. Flacco had one to Greg Ward. But Hurts also had a bad incompletion in the flat. #Eagles","2021-08-25 15:07:49","Twitter for iPhone",28,6,"50447122","Mfranknfl","Martin Frank",7027,823,59500,"","Eagles/NFL writer for the Delaware News Journal. I also write about practically every other sport out there, so don't be fooled by the name.",true,,,,,,,"","","","https://twitter.com/32BeatWriters/status/1430547998271057923","NFL Beat Writers","Training camp","We follow all 32 NFL teams' beat writers so you don't have to. Follow us to help win your fantasy football league. https://t.co/KK0FOJLbrr",,false,39672,755,1183,21619,1324,"2016-07-25 19:33:02",false,,,,"https://pbs.twimg.com/profile_banners/757659945487728640/1597874950",,"http://pbs.twimg.com/profile_images/1408078731051143171/SrpTaIsQ_normal.jpg"
"757659945487728640","1430543806605189123","2021-08-25 14:53:16","32BeatWriters","#Patriots - #Giants initial notes:
- Mac Jones 4/6 in red-zone 7-on-7s, with a PBU in front of Nelson Agholor and near TD to Hunter Henry, who stepped out.
- Christian Barmore and Chase Winovich crushed 1-on-1 pass rush.
- David Andrews had a couple losses in 1-on-1 pass rush.","Twitter for iPhone",140,,,,false,true,0,4,,,"","","","","","","","","","","","",,"","","en",,,,,,,,,,,,,,,,"1430543712107499523","#Patriots - #Giants initial notes:
- Mac Jones 4/6 in red-zone 7-on-7s, with a PBU in front of Nelson Agholor and near TD to Hunter Henry, who stepped out.
- Christian Barmore and Chase Winovich crushed 1-on-1 pass rush.
- David Andrews had a couple losses in 1-on-1 pass rush.","2021-08-25 14:52:53","Twitter Web App",35,4,"2868106332","_AndrewCallahan","Andrew Callahan",8194,924,38244,"Boston, MA","Patriots beat writer @BostonHerald. Rule No. 76: No excuses, play like a champion.",false,,,,,,,"","","","https://twitter.com/32BeatWriters/status/1430543806605189123","NFL Beat Writers","Training camp","We follow all 32 NFL teams' beat writers so you don't have to. Follow us to help win your fantasy football league. https://t.co/KK0FOJLbrr",,false,39672,755,1183,21619,1324,"2016-07-25 19:33:02",false,,,,"https://pbs.twimg.com/profile_banners/757659945487728640/1597874950",,"http://pbs.twimg.com/profile_images/1408078731051143171/SrpTaIsQ_normal.jpg"
"757659945487728640","1430543675034120199","2021-08-25 14:52:45","32BeatWriters","#Eagles WR Devonta Smith is a wildly-impressive route runner.","Twitter for iPhone",82,,,,false,true,0,250,,,"","","","","","","","","","","","",,"","","en",,,,,,,,,,,,,,,,"1430542500306038789","#Eagles WR Devonta Smith is a wildly-impressive route runner.","2021-08-25 14:48:04","Twitter for iPhone",2724,250,"314776155","Connor_J_Hughes","Connor Hughes",44854,969,77493,"Princeton, NJ","Covering the Jets for @TheAthletic | Analyst & TV guy for @SNYtv, @CBSNewYork | #CantWait podcast co-host | Big fan of my dog",true,,,,,,,"","","","https://twitter.com/32BeatWriters/status/1430543675034120199","NFL Beat Writers","Training camp","We follow all 32 NFL teams' beat writers so you don't have to. Follow us to help win your fantasy football league. https://t.co/KK0FOJLbrr",,false,39672,755,1183,21619,1324,"2016-07-25 19:33:02",false,,,,"https://pbs.twimg.com/profile_banners/757659945487728640/1597874950",,"http://pbs.twimg.com/profile_images/1408078731051143171/SrpTaIsQ_normal.jpg"
