"user_id","status_id","created_at","screen_name","text","source","display_text_width","reply_to_status_id","reply_to_user_id","reply_to_screen_name","is_quote","is_retweet","favorite_count","retweet_count","quote_count","reply_count","hashtags","symbols","urls_url","urls_t.co","urls_expanded_url","media_url","media_t.co","media_expanded_url","media_type","ext_media_url","ext_media_t.co","ext_media_expanded_url","ext_media_type","mentions_user_id","mentions_screen_name","lang","quoted_status_id","quoted_text","quoted_created_at","quoted_source","quoted_favorite_count","quoted_retweet_count","quoted_user_id","quoted_screen_name","quoted_name","quoted_followers_count","quoted_friends_count","quoted_statuses_count","quoted_location","quoted_description","quoted_verified","retweet_status_id","retweet_text","retweet_created_at","retweet_source","retweet_favorite_count","retweet_retweet_count","retweet_user_id","retweet_screen_name","retweet_name","retweet_followers_count","retweet_friends_count","retweet_statuses_count","retweet_location","retweet_description","retweet_verified","place_url","place_name","place_full_name","place_type","country","country_code","geo_coords","coords_coords","bbox_coords","status_url","name","location","description","url","protected","followers_count","friends_count","listed_count","statuses_count","favourites_count","account_created_at","verified","profile_url","profile_expanded_url","account_lang","profile_banner_url","profile_background_url","profile_image_url"
"757659945487728640","1432301738019655684","2021-08-30 11:18:39","32BeatWriters","Breshad Perriman cut by the Lions, which seemed to become the expected outcome over the last 2 weeks https://t.co/Z83otg5wji","Twitter for iPhone",100,,,,true,false,11,1,,,"","","","","","","","","","","","",,"","","en","1432300198240337931","First of many cuts this week is a notable one: Lions have released WR Breshad Perriman, per source.","2021-08-30 11:12:32","Twitter for iPhone",3684,483,"51263592","AdamSchefter","Adam Schefter",8506627,3442,55756,"New York","ESPN Senior NFL Insider. 
Interview & Podcast Requests: ESPNPR@espn.com
Host of the Adam Schefter Podcast
https://t.co/oz43ix5jZU",true,,,,,,,,,,,,,,,,,,,,,,"","","","https://twitter.com/32BeatWriters/status/1432301738019655684","NFL Beat Writers","Training camp","We follow all 32 NFL teams' beat writers so you don't have to. Follow us to help win your fantasy football league. https://t.co/KK0FOJLbrr",,false,40071,755,1190,21673,1330,"2016-07-25 19:33:02",false,,,,"https://pbs.twimg.com/profile_banners/757659945487728640/1597874950",,"http://pbs.twimg.com/profile_images/1408078731051143171/SrpTaIsQ_normal.jpg"
"757659945487728640","1432151771682463746","2021-08-30 01:22:45","32BeatWriters","""No. We still have a lot of decisions to make."" - Bill Belichick when asked if he had made a decision on the starting QB yet. #Patriots","Twitter for iPhone",140,,,,false,true,0,94,,,"","","","","","","","","","","","",,"","","en",,,,,,,,,,,,,,,,"1432150440658018307","""No. We still have a lot of decisions to make."" - Bill Belichick when asked if he had made a decision on the starting QB yet. #Patriots","2021-08-30 01:17:27","TweetDeck",552,94,"105147367","MikeGiardi","Michael Giardi",68287,389,79737,"Boston, MA","Football @nflnetwork. We're going to hell.  Make sure you bring your sunblock.",true,,,,,,,"","","","https://twitter.com/32BeatWriters/status/1432151771682463746","NFL Beat Writers","Training camp","We follow all 32 NFL teams' beat writers so you don't have to. Follow us to help win your fantasy football league. https://t.co/KK0FOJLbrr",,false,40071,755,1190,21673,1330,"2016-07-25 19:33:02",false,,,,"https://pbs.twimg.com/profile_banners/757659945487728640/1597874950",,"http://pbs.twimg.com/profile_images/1408078731051143171/SrpTaIsQ_normal.jpg"
"757659945487728640","1432127354285953025","2021-08-29 23:45:43","32BeatWriters","Colts’ HC Frank Reich on WR T.Y. Hilton’s neck injury: “It was a disc issue, so that's a complicated issue. More meetings, more evaluation to come, more opinions to come….He will miss some games, we don't know exactly how many. We're optimistic it's not season-ending.”","Twitter for iPhone",140,,,,false,true,0,219,,,"","","","","","","","","","","","",,"","","en",,,,,,,,,,,,,,,,"1432127314872184833","Colts’ HC Frank Reich on WR T.Y. Hilton’s neck injury: “It was a disc issue, so that's a complicated issue. More meetings, more evaluation to come, more opinions to come….He will miss some games, we don't know exactly how many. We're optimistic it's not season-ending.”","2021-08-29 23:45:34","Twitter for iPhone",2130,219,"51263592","AdamSchefter","Adam Schefter",8506627,3442,55756,"New York","ESPN Senior NFL Insider. 
Interview & Podcast Requests: ESPNPR@espn.com
Host of the Adam Schefter Podcast
https://t.co/oz43ix5jZU",true,,,,,,,"","","","https://twitter.com/32BeatWriters/status/1432127354285953025","NFL Beat Writers","Training camp","We follow all 32 NFL teams' beat writers so you don't have to. Follow us to help win your fantasy football league. https://t.co/KK0FOJLbrr",,false,40071,755,1190,21673,1330,"2016-07-25 19:33:02",false,,,,"https://pbs.twimg.com/profile_banners/757659945487728640/1597874950",,"http://pbs.twimg.com/profile_images/1408078731051143171/SrpTaIsQ_normal.jpg"
"757659945487728640","1432119706761183245","2021-08-29 23:15:20","32BeatWriters","#Giants TE Evan Engram has been ruled out of the game with a calf injury. Not good.","Twitter for iPhone",97,,,,false,true,0,134,,,"","","","","","","","","","","","",,"","","en",,,,,,,,,,,,,,,,"1432119585092820998","#Giants TE Evan Engram has been ruled out of the game with a calf injury. Not good.","2021-08-29 23:14:51","Twitter for iPhone",1690,134,"16403943","RapSheet","Ian Rapoport",2810870,718,148600,"New York","National Insider for NFL Network and https://t.co/NIVZ6FP1b6. Husband of @thebanktress.",true,,,,,,,"","","","https://twitter.com/32BeatWriters/status/1432119706761183245","NFL Beat Writers","Training camp","We follow all 32 NFL teams' beat writers so you don't have to. Follow us to help win your fantasy football league. https://t.co/KK0FOJLbrr",,false,40071,755,1190,21673,1330,"2016-07-25 19:33:02",false,,,,"https://pbs.twimg.com/profile_banners/757659945487728640/1597874950",,"http://pbs.twimg.com/profile_images/1408078731051143171/SrpTaIsQ_normal.jpg"
"757659945487728640","1432113383868928004","2021-08-29 22:50:12","32BeatWriters","Daniel Jones was 8 of 10 for 67 yards before that awful INT. That was a pretty good performance considering the beating he was taking behind his offensive line.

That was a terrible throw, though. No one but D'Angelo Ross had a chance to catch that.","Twitter for iPhone",139,,,,false,true,0,6,,,"","","","","","","","","","","","",,"","","en",,,,,,,,,,,,,,,,"1432113332346032128","Daniel Jones was 8 of 10 for 67 yards before that awful INT. That was a pretty good performance considering the beating he was taking behind his offensive line.

That was a terrible throw, though. No one but D'Angelo Ross had a chance to catch that.","2021-08-29 22:50:00","Twitter Web App",53,6,"40679590","RVacchianoSNY","Ralph Vacchiano",81101,2013,135629,"New York, N.Y.","NFL Insider for SNY and https://t.co/Z4KEm3bLw0 covering the Giants and the Jets. 

The current state of New York football is not my fault.",true,,,,,,,"","","","https://twitter.com/32BeatWriters/status/1432113383868928004","NFL Beat Writers","Training camp","We follow all 32 NFL teams' beat writers so you don't have to. Follow us to help win your fantasy football league. https://t.co/KK0FOJLbrr",,false,40071,755,1190,21673,1330,"2016-07-25 19:33:02",false,,,,"https://pbs.twimg.com/profile_banners/757659945487728640/1597874950",,"http://pbs.twimg.com/profile_images/1408078731051143171/SrpTaIsQ_normal.jpg"
"757659945487728640","1432105652869111822","2021-08-29 22:19:29","32BeatWriters","Jakobi Meyers went horizontal for the grab 🔥 @jkbmyrs5 @Patriots 

📺: #NEvsNYG on @nflnetwork (or check local listings) https://t.co/wC1n2EIGRD","Twitter for iPhone",140,,,,false,true,0,25,,,"","","","","","","","","","","","",,"","","en",,,,,,,,,,,,,,,,"1432105008653160450","Jakobi Meyers went horizontal for the grab 🔥 @jkbmyrs5 @Patriots 

📺: #NEvsNYG on @nflnetwork (or check local listings) https://t.co/wC1n2EIGRD","2021-08-29 22:16:55","Twitter Web App",178,25,"67133275","thecheckdown","The Checkdown",457349,1411,47252,"","The best in the game. 🏈",true,,,,,,,"","","","https://twitter.com/32BeatWriters/status/1432105652869111822","NFL Beat Writers","Training camp","We follow all 32 NFL teams' beat writers so you don't have to. Follow us to help win your fantasy football league. https://t.co/KK0FOJLbrr",,false,40071,755,1190,21673,1330,"2016-07-25 19:33:02",false,,,,"https://pbs.twimg.com/profile_banners/757659945487728640/1597874950",,"http://pbs.twimg.com/profile_images/1408078731051143171/SrpTaIsQ_normal.jpg"
"757659945487728640","1432105542823157761","2021-08-29 22:19:03","32BeatWriters","That @Trevorlawrencee to @Viska2live connection is looking niiiiiice 💯

Second TD of the day for the @Jaguars QB!

📺: #JAXvsDAL on @NFLNetwork (or check local listings)
📱: https://t.co/38GyzbwYJW https://t.co/PM8lUA9oMf","Twitter for iPhone",140,,,,false,true,0,193,,,"","","","","","","","","","","","",,"","","en",,,,,,,,,,,,,,,,"1432037351560257546","That @Trevorlawrencee to @Viska2live connection is looking niiiiiice 💯

Second TD of the day for the @Jaguars QB!

📺: #JAXvsDAL on @NFLNetwork (or check local listings)
📱: https://t.co/38GyzbwYJW https://t.co/PM8lUA9oMf","2021-08-29 17:48:05","Twitter Media Studio - LiveCut",1319,193,"19426551","NFL","NFL",26988742,2697,223918,"","Official Twitter account of the National Football League.",true,,,,,,,"","","","https://twitter.com/32BeatWriters/status/1432105542823157761","NFL Beat Writers","Training camp","We follow all 32 NFL teams' beat writers so you don't have to. Follow us to help win your fantasy football league. https://t.co/KK0FOJLbrr",,false,40071,755,1190,21673,1330,"2016-07-25 19:33:02",false,,,,"https://pbs.twimg.com/profile_banners/757659945487728640/1597874950",,"http://pbs.twimg.com/profile_images/1408078731051143171/SrpTaIsQ_normal.jpg"
"757659945487728640","1432105533478158337","2021-08-29 22:19:01","32BeatWriters","Laviska will NOT GO DOWN. 😤

@Viska2live | @Jaguars 

📺: #JAXvsDAL on @NFLNetwork (or check local listings)
📱: https://t.co/38GyzbwYJW https://t.co/w5o0kJ2c8V","Twitter for iPhone",140,,,,false,true,0,175,,,"","","","","","","","","","","","",,"","","en",,,,,,,,,,,,,,,,"1432036709022240773","Laviska will NOT GO DOWN. 😤

@Viska2live | @Jaguars 

📺: #JAXvsDAL on @NFLNetwork (or check local listings)
📱: https://t.co/38GyzbwYJW https://t.co/w5o0kJ2c8V","2021-08-29 17:45:32","Twitter Media Studio - LiveCut",1496,175,"19426551","NFL","NFL",26988742,2697,223918,"","Official Twitter account of the National Football League.",true,,,,,,,"","","","https://twitter.com/32BeatWriters/status/1432105533478158337","NFL Beat Writers","Training camp","We follow all 32 NFL teams' beat writers so you don't have to. Follow us to help win your fantasy football league. https://t.co/KK0FOJLbrr",,false,40071,755,1190,21673,1330,"2016-07-25 19:33:02",false,,,,"https://pbs.twimg.com/profile_banners/757659945487728640/1597874950",,"http://pbs.twimg.com/profile_images/1408078731051143171/SrpTaIsQ_normal.jpg"
"757659945487728640","1432101830146863104","2021-08-29 22:04:18","32BeatWriters","https://t.co/ueiBkBWaI6 https://t.co/kB88Sk2XSr","Twitter for iPhone",23,,,,true,false,36,0,,,"","","","","","","","","","","","",,"","","und","1432079916783349760","Best Twitter around NFL roster cutdown is “local beat writer 53-man projection” Twitter. Nobody in national media knows what’s happening in camp like these men and women.","2021-08-29 20:37:13","Twitter for iPhone",906,55,"1030165930633060353","JimNagy_SB","Jim Nagy",77109,1550,12561,"Mobile, AL","Husband / Dad / Executive Director Reese's Senior Bowl / ESPN NFL draft analyst / 18-year NFL Scout/ 6x Super Bowl participant (4x SB champ) / Michigan Alum",true,,,,,,,,,,,,,,,,,,,,,,"","","","https://twitter.com/32BeatWriters/status/1432101830146863104","NFL Beat Writers","Training camp","We follow all 32 NFL teams' beat writers so you don't have to. Follow us to help win your fantasy football league. https://t.co/KK0FOJLbrr",,false,40071,755,1190,21673,1330,"2016-07-25 19:33:02",false,,,,"https://pbs.twimg.com/profile_banners/757659945487728640/1597874950",,"http://pbs.twimg.com/profile_images/1408078731051143171/SrpTaIsQ_normal.jpg"
"757659945487728640","1432093190132310017","2021-08-29 21:29:58","32BeatWriters","Woof. Same thing we saw last week. This is worrisome. https://t.co/zuBWsZCa68","Twitter for iPhone",73,,,,false,true,0,3,,,"","","","","","","","","","","","",,"","","en",,,,,,,,,,,,,,,,"1432092477956182016","Woof. Same thing we saw last week. This is worrisome. https://t.co/zuBWsZCa68","2021-08-29 21:27:08","Twitter Web App",33,3,"61520728","dwainmcfarland","Context Matters",17722,798,13683,"Texas","You're a daisy if you do. @PFF, #UtilizationReport, @FFHustle, 3X @FFPC Top-5 Finisher, FFOC Top-8 Finisher, #SFB11

Tweets are my own",false,,,,,,,"","","","https://twitter.com/32BeatWriters/status/1432093190132310017","NFL Beat Writers","Training camp","We follow all 32 NFL teams' beat writers so you don't have to. Follow us to help win your fantasy football league. https://t.co/KK0FOJLbrr",,false,40071,755,1190,21673,1330,"2016-07-25 19:33:02",false,,,,"https://pbs.twimg.com/profile_banners/757659945487728640/1597874950",,"http://pbs.twimg.com/profile_images/1408078731051143171/SrpTaIsQ_normal.jpg"
"757659945487728640","1432092994316931074","2021-08-29 21:29:11","32BeatWriters","Trey Lance holding his hand after that last throw. He hit on a defenders helmet after the throw. #49ers","Twitter for iPhone",119,,,,false,true,0,8,,,"","","","","","","","","","","","",,"","","en",,,,,,,,,,,,,,,,"1432092878273060865","Trey Lance holding his hand after that last throw. He hit on a defenders helmet after the throw. #49ers","2021-08-29 21:28:43","Twitter Web App",31,8,"156813016","Rob_Lowder","Rob Lowder",23401,489,30586,"Fresno, CA","Covering the @49ers for @BlueWirePods' Striking Gold, Formerly @NinersNation and @TheNinersWire",true,,,,,,,"","","","https://twitter.com/32BeatWriters/status/1432092994316931074","NFL Beat Writers","Training camp","We follow all 32 NFL teams' beat writers so you don't have to. Follow us to help win your fantasy football league. https://t.co/KK0FOJLbrr",,false,40071,755,1190,21673,1330,"2016-07-25 19:33:02",false,,,,"https://pbs.twimg.com/profile_banners/757659945487728640/1597874950",,"http://pbs.twimg.com/profile_images/1408078731051143171/SrpTaIsQ_normal.jpg"
"757659945487728640","1432082736903331842","2021-08-29 20:48:25","32BeatWriters","That = https://t.co/vRdPJHwDti https://t.co/qnzIArxuCr","Twitter for iPhone",30,,,,true,false,20,0,,,"","","","","","","","","","","","",,"","","en","1432079853956763651","Chris Evans is gonna have a role just like that.","2021-08-29 20:36:58","Twitter for Android",757,21,"54703405","JoeGoodberry","Goodberry",36201,1793,279180,"Cinnabar Island","",true,,,,,,,,,,,,,,,,,,,,,,"","","","https://twitter.com/32BeatWriters/status/1432082736903331842","NFL Beat Writers","Training camp","We follow all 32 NFL teams' beat writers so you don't have to. Follow us to help win your fantasy football league. https://t.co/KK0FOJLbrr",,false,40071,755,1190,21673,1330,"2016-07-25 19:33:02",false,,,,"https://pbs.twimg.com/profile_banners/757659945487728640/1597874950",,"http://pbs.twimg.com/profile_images/1408078731051143171/SrpTaIsQ_normal.jpg"
"757659945487728640","1432082569630212103","2021-08-29 20:47:46","32BeatWriters","Chris Evans is gonna have a role just like that.","Twitter for iPhone",66,,,,false,true,0,21,,,"","","","","","","","","","","","",,"","","en",,,,,,,,,,,,,,,,"1432079853956763651","Chris Evans is gonna have a role just like that.","2021-08-29 20:36:58","Twitter for Android",757,21,"54703405","JoeGoodberry","Goodberry",36201,1793,279180,"Cinnabar Island","",true,,,,,,,"","","","https://twitter.com/32BeatWriters/status/1432082569630212103","NFL Beat Writers","Training camp","We follow all 32 NFL teams' beat writers so you don't have to. Follow us to help win your fantasy football league. https://t.co/KK0FOJLbrr",,false,40071,755,1190,21673,1330,"2016-07-25 19:33:02",false,,,,"https://pbs.twimg.com/profile_banners/757659945487728640/1597874950",,"http://pbs.twimg.com/profile_images/1408078731051143171/SrpTaIsQ_normal.jpg"
"757659945487728640","1432076188999094272","2021-08-29 20:22:24","32BeatWriters","Here's where we are: 

Reading between the lines (bad idea, I know), it's my sense that you can reasonably expect Carson Wentz and Quenton Nelson to play on opening day. 

T.Y. Hilton won't play and Eric Fisher feels like a long shot in my estimation.","Twitter for iPhone",140,,,,false,true,0,14,,,"","","","","","","","","","","","",,"","","en",,,,,,,,,,,,,,,,"1432076078164676615","Here's where we are: 

Reading between the lines (bad idea, I know), it's my sense that you can reasonably expect Carson Wentz and Quenton Nelson to play on opening day. 

T.Y. Hilton won't play and Eric Fisher feels like a long shot in my estimation.","2021-08-29 20:21:58","TweetDeck",179,14,"23955472","HolderStephen","Stephen Holder",49253,1879,66763,"Indianapolis, IN","Sr. writer @TheAthletic, Colts/NFL. @Fox59/@cbs4indy. Past @indystar @miamiherald @tb_times. Miami native in search of palm trees in corn fields. 1st Gen Amer.",true,,,,,,,"","","","https://twitter.com/32BeatWriters/status/1432076188999094272","NFL Beat Writers","Training camp","We follow all 32 NFL teams' beat writers so you don't have to. Follow us to help win your fantasy football league. https://t.co/KK0FOJLbrr",,false,40071,755,1190,21673,1330,"2016-07-25 19:33:02",false,,,,"https://pbs.twimg.com/profile_banners/757659945487728640/1597874950",,"http://pbs.twimg.com/profile_images/1408078731051143171/SrpTaIsQ_normal.jpg"
"757659945487728640","1432073967418892293","2021-08-29 20:13:35","32BeatWriters","Surprise: Jimmy Garoppolo exits and Trey Lance comes in on 2nd down. It's a read play, Lance opting to hand-off to Raheem Mostert for a first down. The play froze the defense well. Raheem follows that up with another big gain. #49ers","Twitter for iPhone",140,,,,false,true,0,3,,,"","","","","","","","","","","","",,"","","en",,,,,,,,,,,,,,,,"1432073512705945604","Surprise: Jimmy Garoppolo exits and Trey Lance comes in on 2nd down. It's a read play, Lance opting to hand-off to Raheem Mostert for a first down. The play froze the defense well. Raheem follows that up with another big gain. #49ers","2021-08-29 20:11:46","Twitter Web App",62,3,"156813016","Rob_Lowder","Rob Lowder",23401,489,30586,"Fresno, CA","Covering the @49ers for @BlueWirePods' Striking Gold, Formerly @NinersNation and @TheNinersWire",true,,,,,,,"","","","https://twitter.com/32BeatWriters/status/1432073967418892293","NFL Beat Writers","Training camp","We follow all 32 NFL teams' beat writers so you don't have to. Follow us to help win your fantasy football league. https://t.co/KK0FOJLbrr",,false,40071,755,1190,21673,1330,"2016-07-25 19:33:02",false,,,,"https://pbs.twimg.com/profile_banners/757659945487728640/1597874950",,"http://pbs.twimg.com/profile_images/1408078731051143171/SrpTaIsQ_normal.jpg"
"757659945487728640","1432073461283835906","2021-08-29 20:11:34","32BeatWriters","There’s some real weird stuff going on with JaMarr Chase. Not catching anything.","Twitter for iPhone",98,,,,false,true,0,26,,,"","","","","","","","","","","","",,"","","en",,,,,,,,,,,,,,,,"1432073210405793797","There’s some real weird stuff going on with JaMarr Chase. Not catching anything.","2021-08-29 20:10:34","Twitter for iPhone",398,26,"180646414","jake_burns18","Jake Burns",21451,615,67471,"Cleveland, OH","All about @Kelb_eyonce and Porter | Film Analyst & Football Writer @TheOBR @247sports @cbssports | @TheOBRFilmBDN | QB enthusiast",false,,,,,,,"","","","https://twitter.com/32BeatWriters/status/1432073461283835906","NFL Beat Writers","Training camp","We follow all 32 NFL teams' beat writers so you don't have to. Follow us to help win your fantasy football league. https://t.co/KK0FOJLbrr",,false,40071,755,1190,21673,1330,"2016-07-25 19:33:02",false,,,,"https://pbs.twimg.com/profile_banners/757659945487728640/1597874950",,"http://pbs.twimg.com/profile_images/1408078731051143171/SrpTaIsQ_normal.jpg"
"757659945487728640","1432060968998146057","2021-08-29 19:21:56","32BeatWriters","On #Ravens RB J.K. Dobbins, there will be more evaluations in the coming days on his knee because sources say the MRI showed possible LCL damage in addition to the ACL. Not a huge deal if that's indeed the case, but a more involved recovery.","Twitter for iPhone",140,,,,false,true,0,171,,,"","","","","","","","","","","","",,"","","en",,,,,,,,,,,,,,,,"1432060737657114626","On #Ravens RB J.K. Dobbins, there will be more evaluations in the coming days on his knee because sources say the MRI showed possible LCL damage in addition to the ACL. Not a huge deal if that's indeed the case, but a more involved recovery.","2021-08-29 19:21:00","TweetDeck",783,171,"12513132","MikeGarafolo","Mike Garafolo",348151,983,83878,"NY/NJ","Reporter, NFL Network. Co-host @GMFB Weekend. Distant cousin of @JimmyG_10. No relation to Pep Guardiola. IG: mike_garafolo",true,,,,,,,"","","","https://twitter.com/32BeatWriters/status/1432060968998146057","NFL Beat Writers","Training camp","We follow all 32 NFL teams' beat writers so you don't have to. Follow us to help win your fantasy football league. https://t.co/KK0FOJLbrr",,false,40071,755,1190,21673,1330,"2016-07-25 19:33:02",false,,,,"https://pbs.twimg.com/profile_banners/757659945487728640/1597874950",,"http://pbs.twimg.com/profile_images/1408078731051143171/SrpTaIsQ_normal.jpg"
"757659945487728640","1432060450053791746","2021-08-29 19:19:52","32BeatWriters","Irv is not only the Vikings' TE1, he's probably their best option as a WR3. Those two catches against KC showed his huge upside, so this sucks. Have to hope it's just a 2-4 week thing. Conklin's hamstring situation is now very important to monitor.","Twitter for iPhone",140,,,,false,true,0,5,,,"","","","","","","","","","","","",,"","","en",,,,,,,,,,,,,,,,"1432060040115068929","Irv is not only the Vikings' TE1, he's probably their best option as a WR3. Those two catches against KC showed his huge upside, so this sucks. Have to hope it's just a 2-4 week thing. Conklin's hamstring situation is now very important to monitor.","2021-08-29 19:18:14","Twitter Web App",25,5,"3765498081","WillRagatz","Will Ragatz",5164,934,11123,"Mpls","#Vikings writer for Sports Illustrated. @InsideNU, @MedillSchool alum. Uptown Minneapolis native. Expect other MN sports tweets, too.",false,,,,,,,"","","","https://twitter.com/32BeatWriters/status/1432060450053791746","NFL Beat Writers","Training camp","We follow all 32 NFL teams' beat writers so you don't have to. Follow us to help win your fantasy football league. https://t.co/KK0FOJLbrr",,false,40071,755,1190,21673,1330,"2016-07-25 19:33:02",false,,,,"https://pbs.twimg.com/profile_banners/757659945487728640/1597874950",,"http://pbs.twimg.com/profile_images/1408078731051143171/SrpTaIsQ_normal.jpg"
"757659945487728640","1432060407095734279","2021-08-29 19:19:42","32BeatWriters","The Irv Smith Jr. loss is a big one for this offense. Regression in injury luck was a concern on that side of the ball and it has already reared its head multiple times leading up to the season (Jefferson shoulder scare, Conklin hurt, Darrisaw struggling to get on the field).","Twitter for iPhone",139,,,,false,true,0,4,,,"","","","","","","","","","","","",,"","","en",,,,,,,,,,,,,,,,"1432059627513028609","The Irv Smith Jr. loss is a big one for this offense. Regression in injury luck was a concern on that side of the ball and it has already reared its head multiple times leading up to the season (Jefferson shoulder scare, Conklin hurt, Darrisaw struggling to get on the field).","2021-08-29 19:16:36","Twitter Web App",22,4,"3765498081","WillRagatz","Will Ragatz",5164,934,11123,"Mpls","#Vikings writer for Sports Illustrated. @InsideNU, @MedillSchool alum. Uptown Minneapolis native. Expect other MN sports tweets, too.",false,,,,,,,"","","","https://twitter.com/32BeatWriters/status/1432060407095734279","NFL Beat Writers","Training camp","We follow all 32 NFL teams' beat writers so you don't have to. Follow us to help win your fantasy football league. https://t.co/KK0FOJLbrr",,false,40071,755,1190,21673,1330,"2016-07-25 19:33:02",false,,,,"https://pbs.twimg.com/profile_banners/757659945487728640/1597874950",,"http://pbs.twimg.com/profile_images/1408078731051143171/SrpTaIsQ_normal.jpg"
