"757659945487728640","1431424794713591814","2021-08-28 01:14:00","32BeatWriters","That's a really nice route, catch and run by JJAW. He's making the team.","Twitter for iPhone",86,,,,false,true,0,13,,,"","","","","","","","","","","","",,"","","en",,,,,,,,,,,,,,,,"1431424347470761984","That's a really nice route, catch and run by JJAW. He's making the team.","2021-08-28 01:12:13","Twitter Web App",418,13,"200599938","RoobNBCS","Reuben Frank",115227,1524,83227,"Philadelphia","Covers Eagles for NBC Sports Philadelphia, part-time host on 94 WIP, track and field announcer, obsessive concert attendee.",true,,,,,,,"","","","https://twitter.com/32BeatWriters/status/1431424794713591814","NFL Beat Writers","Training camp","We follow all 32 NFL teams' beat writers so you don't have to. Follow us to help win your fantasy football league. https://t.co/KK0FOJLbrr",,false,40071,755,1190,21673,1330,"2016-07-25 19:33:02",false,,,,"https://pbs.twimg.com/profile_banners/757659945487728640/1597874950",,"http://pbs.twimg.com/profile_images/1408078731051143171/SrpTaIsQ_normal.jpg"
"757659945487728640","1431412240968601603","2021-08-28 00:24:07","32BeatWriters","Sam Darnold has looked good when given even semi adequate protection.","Twitter for iPhone",89,,,,false,true,0,15,,,"","","","","","","","","","","","",,"","","en",,,,,,,,,,,,,,,,"1431411901997662211","Sam Darnold has looked good when given even semi adequate protection.","2021-08-28 00:22:46","Twitter for Android",176,15,"41327335","CarolinaHuddle","Jeremy Igo",17101,437,38834,"Charlotte, NC","MFCEO - Carolina Huddle, I don't stick to sports.",true,,,,,,,"","","","https://twitter.com/32BeatWriters/status/1431412240968601603","NFL Beat Writers","Training camp","We follow all 32 NFL teams' beat writers so you don't have to. Follow us to help win your fantasy football league. https://t.co/KK0FOJLbrr",,false,40071,755,1190,21673,1330,"2016-07-25 19:33:02",false,,,,"https://pbs.twimg.com/profile_banners/757659945487728640/1597874950",,"http://pbs.twimg.com/profile_images/1408078731051143171/SrpTaIsQ_normal.jpg"
"757659945487728640","1431408647100407810","2021-08-28 00:09:50","32BeatWriters","Mecole Hardman not only starting, but starting ahead of Demarcus Robinson in a 2 WR set","Twitter for iPhone",107,,,,false,true,0,22,,,"","","","","","","","","","","","",,"","","en",,,,,,,,,,,,,,,,"1431407988267495432","Mecole Hardman not only starting, but starting ahead of Demarcus Robinson in a 2 WR set","2021-08-28 00:07:13","Twitter Web App",463,22,"182495200","PFF_NateJahnke","Nathan Jahnke",58421,898,29147,"Cincinnati, OH","Software Engineer & Senior Fantasy Analyst @PFF. Former Director of Analytics & Analyst @PFF He/Him #BlackLivesMatter Views are my own, not PFF's",true,,,,,,,"","","","https://twitter.com/32BeatWriters/status/1431408647100407810","NFL Beat Writers","Training camp","We follow all 32 NFL teams' beat writers so you don't have to. Follow us to help win your fantasy football league. https://t.co/KK0FOJLbrr",,false,40071,755,1190,21673,1330,"2016-07-25 19:33:02",false,,,,"https://pbs.twimg.com/profile_banners/757659945487728640/1597874950",,"http://pbs.twimg.com/profile_images/1408078731051143171/SrpTaIsQ_normal.jpg"
"757659945487728640","1431405247184793602","2021-08-27 23:56:19","32BeatWriters","Very good drive for Jacob Eason. Just one incompletion on a dropped TD by Mike Strachan. Got the ball out quickly and was decisive for the most part. Also showed some of his toughness. #Colts","Twitter for iPhone",140,,,,false,true,0,8,,,"","","","","","","","","","","","",,"","","en",,,,,,,,,,,,,,,,"1431404550855004163","Very good drive for Jacob Eason. Just one incompletion on a dropped TD by Mike Strachan. Got the ball out quickly and was decisive for the most part. Also showed some of his toughness. #Colts","2021-08-27 23:53:33","Twitter for iPhone",37,8,"117875048","gmbremer","George Bremer",13383,939,73864,"Anderson, IN","CNHI Sports Indiana executive editor, Indianapolis Colts beat writer and sports editor for The Herald Bulletin in Anderson, Ind. @PFWAwriters",false,,,,,,,"","","","https://twitter.com/32BeatWriters/status/1431405247184793602","NFL Beat Writers","Training camp","We follow all 32 NFL teams' beat writers so you don't have to. Follow us to help win your fantasy football league. https://t.co/KK0FOJLbrr",,false,40071,755,1190,21673,1330,"2016-07-25 19:33:02",false,,,,"https://pbs.twimg.com/profile_banners/757659945487728640/1597874950",,"http://pbs.twimg.com/profile_images/1408078731051143171/SrpTaIsQ_normal.jpg"
"757659945487728640","1431405143015104515","2021-08-27 23:55:54","32BeatWriters","Only half watching, but Jacob Eason has done a good job so far. I know he’s playing against backups, but he’s a backup too, remember. No real complaints. Consistency is still his issue, but he’s definitely got talent. He earned the job.","Twitter for iPhone",140,,,,false,true,0,13,,,"","","","","","","","","","","","",,"","","en",,,,,,,,,,,,,,,,"1431405031983562758","Only half watching, but Jacob Eason has done a good job so far. I know he’s playing against backups, but he’s a backup too, remember. No real complaints. Consistency is still his issue, but he’s definitely got talent. He earned the job.","2021-08-27 23:55:28","Twitter for iPhone",175,13,"23955472","HolderStephen","Stephen Holder",49253,1879,66763,"Indianapolis, IN","Sr. writer @TheAthletic, Colts/NFL. @Fox59/@cbs4indy. Past @indystar @miamiherald @tb_times. Miami native in search of palm trees in corn fields. 1st Gen Amer.",true,,,,,,,"","","","https://twitter.com/32BeatWriters/status/1431405143015104515","NFL Beat Writers","Training camp","We follow all 32 NFL teams' beat writers so you don't have to. Follow us to help win your fantasy football league. https://t.co/KK0FOJLbrr",,false,40071,755,1190,21673,1330,"2016-07-25 19:33:02",false,,,,"https://pbs.twimg.com/profile_banners/757659945487728640/1597874950",,"http://pbs.twimg.com/profile_images/1408078731051143171/SrpTaIsQ_normal.jpg"
"757659945487728640","1431284278759931911","2021-08-27 15:55:38","32BeatWriters","Evan Engram is participating after working on side Thurs. Rodarius Williams &amp; Gary Brightwell out here. Today’s injured group: Aaron Robinson, Kadarius Toney, Austin Mack, Danny Shelton, Shane Lemieux, Elerson Smith, Josh Jackson, Adoree Jackson, Kenny Golladay, John Ross #Giants","Twitter Web App",144,,,,false,true,0,6,,,"","","","","","","","","","","","",,"","","en",,,,,,,,,,,,,,,,"1431283281438330880","Evan Engram is participating after working on side Thurs. Rodarius Williams &amp; Gary Brightwell out here. Today’s injured group: Aaron Robinson, Kadarius Toney, Austin Mack, Danny Shelton, Shane Lemieux, Elerson Smith, Josh Jackson, Adoree Jackson, Kenny Golladay, John Ross #Giants","2021-08-27 15:51:40","Twitter for iPhone",45,6,"183372981","PLeonardNYDN","Pat Leonard",33127,4309,72591,"New York","NFL Giants beat writer/columnist @NYDNsports. @Maxx. Instagram: patleonard_nfl. Views & opinions are my own.",true,,,,,,,"","","","https://twitter.com/32BeatWriters/status/1431284278759931911","NFL Beat Writers","Training camp","We follow all 32 NFL teams' beat writers so you don't have to. Follow us to help win your fantasy football league. https://t.co/KK0FOJLbrr",,false,40071,755,1190,21673,1330,"2016-07-25 19:33:02",false,,,,"https://pbs.twimg.com/profile_banners/757659945487728640/1597874950",,"http://pbs.twimg.com/profile_images/1408078731051143171/SrpTaIsQ_normal.jpg"
"757659945487728640","1431279397357727753","2021-08-27 15:36:14","32BeatWriters","John Lynch on @knbr:
-#49ers haven’t shown anything as it relates to regular-season use of Jimmy Garoppolo &amp; Trey Lance.
-He’s high on WR Jalen Hurd, says if he’s on the field, it’s a good thing for team.
-They’ve received calls about D-linemen. Not interested in trading anyone.","Twitter for iPhone",144,,,,false,true,0,29,,,"","","","","","","","","","","","",,"","","en",,,,,,,,,,,,,,,,"1431277725751316486","John Lynch on @knbr:
-#49ers haven’t shown anything as it relates to regular-season use of Jimmy Garoppolo &amp; Trey Lance.
-He’s high on WR Jalen Hurd, says if he’s on the field, it’s a good thing for team.
-They’ve received calls about D-linemen. Not interested in trading anyone.","2021-08-27 15:29:36","Twitter for iPhone",327,29,"27796499","MaioccoNBCS","Matt Maiocco",117889,1369,58252,"San Francisco","🇺🇸 NBC Sports Bay Area. KNBR-680. Season No. 27 covering the 49ers. Pro Football Hall of Fame Selection Committee. Subscribe to 49ers Talk podcast. 🇺🇸",true,,,,,,,"","","","https://twitter.com/32BeatWriters/status/1431279397357727753","NFL Beat Writers","Training camp","We follow all 32 NFL teams' beat writers so you don't have to. Follow us to help win your fantasy football league. https://t.co/KK0FOJLbrr",,false,40071,755,1190,21673,1330,"2016-07-25 19:33:02",false,,,,"https://pbs.twimg.com/profile_banners/757659945487728640/1597874950",,"http://pbs.twimg.com/profile_images/1408078731051143171/SrpTaIsQ_normal.jpg"
"757659945487728640","1431278989952311299","2021-08-27 15:34:37","32BeatWriters","🧵 5 from @Eagles 🧵

1) Pleasant camp surprise: Zach Ertz. The vet's healthy, and looks like himself again. And amid trade rumblings, has been a pro, and an asset to Hurts.

2) 2020 FA signing Javon Hargraves looks like he's breaking thru, should be disruptive for a very good D.","Twitter for iPhone",139,,,,false,true,0,26,,,"","","","","","","","","","","","",,"","","en",,,,,,,,,,,,,,,,"1431278836319244288","🧵 5 from @Eagles 🧵

1) Pleasant camp surprise: Zach Ertz. The vet's healthy, and looks like himself again. And amid trade rumblings, has been a pro, and an asset to Hurts.

2) 2020 FA signing Javon Hargraves looks like he's breaking thru, should be disruptive for a very good D.","2021-08-27 15:34:01","Twitter Web App",263,26,"61830970","AlbertBreer","Albert Breer",513548,1217,113905,"All over the place","Senior NFL Reporter/Lead Content Strategist @TheMMQB | @NBCSBoston | @985TheSportsHub | Alum of Boston Globe, Dallas Morning News, NFL Network.",true,,,,,,,"","","","https://twitter.com/32BeatWriters/status/1431278989952311299","NFL Beat Writers","Training camp","We follow all 32 NFL teams' beat writers so you don't have to. Follow us to help win your fantasy football league. https://t.co/KK0FOJLbrr",,false,40071,755,1190,21673,1330,"2016-07-25 19:33:02",false,,,,"https://pbs.twimg.com/profile_banners/757659945487728640/1597874950",,"http://pbs.twimg.com/profile_images/1408078731051143171/SrpTaIsQ_normal.jpg"
"757659945487728640","1431271099384406021","2021-08-27 15:03:16","32BeatWriters","Neither RB Saquon Barkley, WR Kenny Golladay, nor TE Kyle Rudolph will play in the Giants’ preseason finale vs. the Patriots on Sunday, according to Joe Judge. Most of the remaining starters will play at least one half, he said.","Twitter for iPhone",140,,,,false,true,0,9,,,"","","","","","","","","","","","",,"","","en",,,,,,,,,,,,,,,,"1431270864016887822","Neither RB Saquon Barkley, WR Kenny Golladay, nor TE Kyle Rudolph will play in the Giants’ preseason finale vs. the Patriots on Sunday, according to Joe Judge. Most of the remaining starters will play at least one half, he said.","2021-08-27 15:02:20","Twitter for iPhone",44,9,"40679590","RVacchianoSNY","Ralph Vacchiano",81101,2013,135629,"New York, N.Y.","NFL Insider for SNY and https://t.co/Z4KEm3bLw0 covering the Giants and the Jets. 

The current state of New York football is not my fault.",true,,,,,,,"","","","https://twitter.com/32BeatWriters/status/1431271099384406021","NFL Beat Writers","Training camp","We follow all 32 NFL teams' beat writers so you don't have to. Follow us to help win your fantasy football league. https://t.co/KK0FOJLbrr",,false,40071,755,1190,21673,1330,"2016-07-25 19:33:02",false,,,,"https://pbs.twimg.com/profile_banners/757659945487728640/1597874950",,"http://pbs.twimg.com/profile_images/1408078731051143171/SrpTaIsQ_normal.jpg"
"757659945487728640","1431256206232936452","2021-08-27 14:04:05","32BeatWriters","The Giants posted nearly 20 minutes of video from yesterday's practice with the Patriots, including Cam Newton's entire touchdown drive in 11-on-11s.

Check it out: https://t.co/yPgDd90dn9 https://t.co/J28t03Xu4j","Twitter for iPhone",140,,,,false,true,0,6,,,"","","","","","","","","","","","",,"","","en",,,,,,,,,,,,,,,,"1431256148485853186","The Giants posted nearly 20 minutes of video from yesterday's practice with the Patriots, including Cam Newton's entire touchdown drive in 11-on-11s.

Check it out: https://t.co/yPgDd90dn9 https://t.co/J28t03Xu4j","2021-08-27 14:03:51","TweetDeck",41,6,"207765804","ZackCoxNESN","Zack Cox",23397,1539,52539,"Boston","Patriots beat writer at @NESN // co-host, NESN Patriots Podcast // @UofNH alum // Scrumhalf @CharlesRiverRFC // Tweener and a duck gets you on base.",true,,,,,,,"","","","https://twitter.com/32BeatWriters/status/1431256206232936452","NFL Beat Writers","Training camp","We follow all 32 NFL teams' beat writers so you don't have to. Follow us to help win your fantasy football league. https://t.co/KK0FOJLbrr",,false,40071,755,1190,21673,1330,"2016-07-25 19:33:02",false,,,,"https://pbs.twimg.com/profile_banners/757659945487728640/1597874950",,"http://pbs.twimg.com/profile_images/1408078731051143171/SrpTaIsQ_normal.jpg"
"757659945487728640","1431255489409601544","2021-08-27 14:01:14","32BeatWriters","Trying to see something:

Do you own an NFT?","Twitter Web App",44,,,,false,false,4,1,,,"","","","","","","","","","","","",,"","","en",,,,,,,,,,,,,,,,,,,,,,,,,,,,,,,,,,,,,"","","","https://twitter.com/32BeatWriters/status/1431255489409601544","NFL Beat Writers","Training camp","We follow all 32 NFL teams' beat writers so you don't have to. Follow us to help win your fantasy football league. https://t.co/KK0FOJLbrr",,false,40071,755,1190,21673,1330,"2016-07-25 19:33:02",false,,,,"https://pbs.twimg.com/profile_banners/757659945487728640/1597874950",,"http://pbs.twimg.com/profile_images/1408078731051143171/SrpTaIsQ_normal.jpg"
"757659945487728640","1431237635012431872","2021-08-27 12:50:17","32BeatWriters","Jameis Winston has been named the Saints' starting quarterback and will make his first start for New Orleans on opening day vs. Green Bay Packers, per sources.","Twitter for iPhone",140,,,,false,true,0,4711,,,"","","","","","","","","","","","",,"","","en",,,,,,,,,,,,,,,,"1431237587302297604","Jameis Winston has been named the Saints' starting quarterback and will make his first start for New Orleans on opening day vs. Green Bay Packers, per sources.","2021-08-27 12:50:06","Twitter for iPhone",40012,4711,"51263592","AdamSchefter","Adam Schefter",8506627,3442,55756,"New York","ESPN Senior NFL Insider. 
Interview & Podcast Requests: ESPNPR@espn.com
Host of the Adam Schefter Podcast
https://t.co/oz43ix5jZU",true,,,,,,,"","","","https://twitter.com/32BeatWriters/status/1431237635012431872","NFL Beat Writers","Training camp","We follow all 32 NFL teams' beat writers so you don't have to. Follow us to help win your fantasy football league. https://t.co/KK0FOJLbrr",,false,40071,755,1190,21673,1330,"2016-07-25 19:33:02",false,,,,"https://pbs.twimg.com/profile_banners/757659945487728640/1597874950",,"http://pbs.twimg.com/profile_images/1408078731051143171/SrpTaIsQ_normal.jpg"
"757659945487728640","1431236063394160640","2021-08-27 12:44:03","32BeatWriters","Three years after his NFL career ended, Christian Hackenberg is back on the field, as a volunteer coach, embracing the rest of his life at 26 — and finding peace in a quiet corner of N.J.

""You get one shot at life,"" he said. ""Live it and enjoy it."" 

https://t.co/JtJaQAHm5u","Twitter for iPhone",140,,,,false,true,0,50,,,"","","","","","","","","","","","",,"","","en",,,,,,,,,,,,,,,,"1431228012784197634","Three years after his NFL career ended, Christian Hackenberg is back on the field, as a volunteer coach, embracing the rest of his life at 26 — and finding peace in a quiet corner of N.J.

""You get one shot at life,"" he said. ""Live it and enjoy it."" 

https://t.co/JtJaQAHm5u","2021-08-27 12:12:03","Twitter Web App",412,50,"134207682","DarrylSlater","Darryl Slater",13718,1027,79673,"New Jersey, USA","NFL reporter/analyst at NJ Advance Media (The Star-Ledger and https://t.co/HTwLm8drB4)",true,,,,,,,"","","","https://twitter.com/32BeatWriters/status/1431236063394160640","NFL Beat Writers","Training camp","We follow all 32 NFL teams' beat writers so you don't have to. Follow us to help win your fantasy football league. https://t.co/KK0FOJLbrr",,false,40071,755,1190,21673,1330,"2016-07-25 19:33:02",false,,,,"https://pbs.twimg.com/profile_banners/757659945487728640/1597874950",,"http://pbs.twimg.com/profile_images/1408078731051143171/SrpTaIsQ_normal.jpg"
"757659945487728640","1431234164251140106","2021-08-27 12:36:30","32BeatWriters","🚨 🏈 BRAND NEW THE MATT LOMBARDO SHOW PODCAST presented by @FanSided 🏈 🚨 

Why #Eagles, #Patriots, #Giants &amp; #Broncos will surprise — for good or for bad. @CharlieBatch16 previews #Steelers and shares his insight on the #NFL’s top rookie QBs. 

Listen: https://t.co/bwgrCTQvQa https://t.co/TwFg0DaH18","Twitter for iPhone",144,,,,false,true,0,4,,,"","","","","","","","","","","","",,"","","en",,,,,,,,,,,,,,,,"1431222749029146627","🚨 🏈 BRAND NEW THE MATT LOMBARDO SHOW PODCAST presented by @FanSided 🏈 🚨 

Why #Eagles, #Patriots, #Giants &amp; #Broncos will surprise — for good or for bad. @CharlieBatch16 previews #Steelers and shares his insight on the #NFL’s top rookie QBs. 

Listen: https://t.co/bwgrCTQvQa https://t.co/TwFg0DaH18","2021-08-27 11:51:08","Twitter for iPhone",5,4,"136381415","MattLombardoNFL","Matt Lombardo",29851,7000,83595,"Lehigh Valley, PA - Born and Raised","@FanSided National NFL Insider | Host The Matt Lombardo Show Podcast | @GMenHQ Senior Editor covering NY Giants. PFWA. Golfer, E-Street Nation. #GirlDad #WeAre",true,,,,,,,"","","","https://twitter.com/32BeatWriters/status/1431234164251140106","NFL Beat Writers","Training camp","We follow all 32 NFL teams' beat writers so you don't have to. Follow us to help win your fantasy football league. https://t.co/KK0FOJLbrr",,false,40071,755,1190,21673,1330,"2016-07-25 19:33:02",false,,,,"https://pbs.twimg.com/profile_banners/757659945487728640/1597874950",,"http://pbs.twimg.com/profile_images/1408078731051143171/SrpTaIsQ_normal.jpg"
"757659945487728640","1431233989432520711","2021-08-27 12:35:48","32BeatWriters","On Zach Ertz: “He’s still in Philadelphia and has been a heavy part of the offense during Training Camp. In fact, Goedert and Ertz have been the 2 most targeted players. If he’s on the team, he’s going to play. If he’s on the field, he’s going to get open” https://t.co/2KulnQFr39","Twitter for iPhone",256,,,,true,false,22,3,,,"","","","","","","","","","","","",,"","","en","1431214922973724678","A fantasy football guide to the Eagles offense, from Jalen Hurts to Zach Ertz: https://t.co/c5NGyHTm6L","2021-08-27 11:20:02","Twitter for iPhone",8,2,"48937665","ZBerm","Zach Berman",68264,1851,49373,"Philadelphia, PA","Covers the Philadelphia Eagles for The Athletic (@TheAthleticNFL). Author of UNDERDOGS. Email: zberman@theathletic.com",true,,,,,,,,,,,,,,,,,,,,,,"","","","https://twitter.com/32BeatWriters/status/1431233989432520711","NFL Beat Writers","Training camp","We follow all 32 NFL teams' beat writers so you don't have to. Follow us to help win your fantasy football league. https://t.co/KK0FOJLbrr",,false,40071,755,1190,21673,1330,"2016-07-25 19:33:02",false,,,,"https://pbs.twimg.com/profile_banners/757659945487728640/1597874950",,"http://pbs.twimg.com/profile_images/1408078731051143171/SrpTaIsQ_normal.jpg"
"757659945487728640","1431213998222028807","2021-08-27 11:16:22","32BeatWriters","“I’m to a point where I am expecting to see (Tyrell) Williams and St. Brown as fixtures in their roles and a platoon of players—(Kalif) Raymond, Perriman (if he makes the team), Quintez Cephus—split time in the final outside spot.” https://t.co/OfvQJsxwBc","Twitter for iPhone",231,,,,true,false,25,4,,,"","","","","","","","","","","","",,"","","en","1431210209104498688",".@DetroitOnLion and @erikschlitt are back answering your questions, including a couple on the #Lions’ WR corps:  https://t.co/58gWas6lbb","2021-08-27 11:01:19","Chorus publishing platform",41,7,"26681152","PrideOfDetroit","Pride of Detroit",63842,536,90419,"Detroit, MI","The official SB Nation blog for Detroit Lions fans, by Detroit Lions fans.",true,,,,,,,,,,,,,,,,,,,,,,"","","","https://twitter.com/32BeatWriters/status/1431213998222028807","NFL Beat Writers","Training camp","We follow all 32 NFL teams' beat writers so you don't have to. Follow us to help win your fantasy football league. https://t.co/KK0FOJLbrr",,false,40071,755,1190,21673,1330,"2016-07-25 19:33:02",false,,,,"https://pbs.twimg.com/profile_banners/757659945487728640/1597874950",,"http://pbs.twimg.com/profile_images/1408078731051143171/SrpTaIsQ_normal.jpg"
