"757659945487728640","1432049787927470087","2021-08-29 18:37:30","32BeatWriters","One important QB note: The Washington Football Team will start QB Ryan Fitzpatrick in Week 1 and going forward, I’m told. This has been obvious by the way the WFT preseason played out, though it was never announced. But it will be Fitz under center.","Twitter for iPhone",140,,,,false,true,0,386,,,"","","","","","","","","","","","",,"","","en",,,,,,,,,,,,,,,,"1432049096664178695","One important QB note: The Washington Football Team will start QB Ryan Fitzpatrick in Week 1 and going forward, I’m told. This has been obvious by the way the WFT preseason played out, though it was never announced. But it will be Fitz under center.","2021-08-29 18:34:45","TweetDeck",3686,386,"16403943","RapSheet","Ian Rapoport",2810870,718,148600,"New York","National Insider for NFL Network and https://t.co/NIVZ6FP1b6. Husband of @thebanktress.",true,,,,,,,"","","","https://twitter.com/32BeatWriters/status/1432049787927470087","NFL Beat Writers","Training camp","We follow all 32 NFL teams' beat writers so you don't have to. Follow us to help win your fantasy football league. https://t.co/KK0FOJLbrr",,false,40071,755,1190,21673,1330,"2016-07-25 19:33:02",false,,,,"https://pbs.twimg.com/profile_banners/757659945487728640/1597874950",,"http://pbs.twimg.com/profile_images/1408078731051143171/SrpTaIsQ_normal.jpg"
"757659945487728640","1432048318318891013","2021-08-29 18:31:39","32BeatWriters","An MRI today confirmed that Ravens’ RB J.K. Dobbins, one of the top young running backs in the game, suffered a season-ending torn ACL, per source.","Twitter for iPhone",140,,,,false,true,0,2174,,,"","","","","","","","","","","","",,"","","en",,,,,,,,,,,,,,,,"1432048173346967554","An MRI today confirmed that Ravens’ RB J.K. Dobbins, one of the top young running backs in the game, suffered a season-ending torn ACL, per source.","2021-08-29 18:31:05","Twitter for iPhone",15132,2174,"51263592","AdamSchefter","Adam Schefter",8506627,3442,55756,"New York","ESPN Senior NFL Insider. 
Interview & Podcast Requests: ESPNPR@espn.com
Host of the Adam Schefter Podcast
https://t.co/oz43ix5jZU",true,,,,,,,"","","","https://twitter.com/32BeatWriters/status/1432048318318891013","NFL Beat Writers","Training camp","We follow all 32 NFL teams' beat writers so you don't have to. Follow us to help win your fantasy football league. https://t.co/KK0FOJLbrr",,false,40071,755,1190,21673,1330,"2016-07-25 19:33:02",false,,,,"https://pbs.twimg.com/profile_banners/757659945487728640/1597874950",,"http://pbs.twimg.com/profile_images/1408078731051143171/SrpTaIsQ_normal.jpg"
"757659945487728640","1432044527171276802","2021-08-29 18:16:36","32BeatWriters","#Vikings starting TE Irv Smith Jr. is expected to undergo surgery for a meniscus injury that will sideline him for at least the start of the regular season, per sources. 

Exact timetable TBD for now, but Smith seemed poised for a breakout season and now it’s on hold.","Twitter for iPhone",140,,,,false,true,0,368,,,"","","","","","","","","","","","",,"","","en",,,,,,,,,,,,,,,,"1432043598401482753","#Vikings starting TE Irv Smith Jr. is expected to undergo surgery for a meniscus injury that will sideline him for at least the start of the regular season, per sources. 

Exact timetable TBD for now, but Smith seemed poised for a breakout season and now it’s on hold.","2021-08-29 18:12:54","TweetDeck",1421,368,"36089053","TomPelissero","Tom Pelissero",317224,1235,74810,"","Reporter, @NFLNetwork. Host, @SiriusXMNFL. Husband, @SaraPelissero. Dad, the best girls ever.",true,,,,,,,"","","","https://twitter.com/32BeatWriters/status/1432044527171276802","NFL Beat Writers","Training camp","We follow all 32 NFL teams' beat writers so you don't have to. Follow us to help win your fantasy football league. https://t.co/KK0FOJLbrr",,false,40071,755,1190,21673,1330,"2016-07-25 19:33:02",false,,,,"https://pbs.twimg.com/profile_banners/757659945487728640/1597874950",,"http://pbs.twimg.com/profile_images/1408078731051143171/SrpTaIsQ_normal.jpg"
"757659945487728640","1432010950727589890","2021-08-29 16:03:10","32BeatWriters","Updated thoughts on Gus Edwards, T.Y. Hilton, Melvin Gordon, Gio Bernard (and how many passing situation targets the Bucs had to RBs last year), Rob Gronkowski, and more. Will keep updating throughout the day.
https://t.co/adwLM8rM6o","Twitter for iPhone",139,,,,false,true,0,2,,,"","","","","","","","","","","","",,"","","en",,,,,,,,,,,,,,,,"1432010386258100231","Updated thoughts on Gus Edwards, T.Y. Hilton, Melvin Gordon, Gio Bernard (and how many passing situation targets the Bucs had to RBs last year), Rob Gronkowski, and more. Will keep updating throughout the day.
https://t.co/adwLM8rM6o","2021-08-29 16:00:56","Twitter Web App",35,2,"838999572093399040","HaydenWinks","Hayden Winks",19998,1362,11356,"","Content and Marketing @UnderdogFantasy 🐶 | Mon-Thu at 12:30 EST ⬇️",false,,,,,,,"","","","https://twitter.com/32BeatWriters/status/1432010950727589890","NFL Beat Writers","Training camp","We follow all 32 NFL teams' beat writers so you don't have to. Follow us to help win your fantasy football league. https://t.co/KK0FOJLbrr",,false,40071,755,1190,21673,1330,"2016-07-25 19:33:02",false,,,,"https://pbs.twimg.com/profile_banners/757659945487728640/1597874950",,"http://pbs.twimg.com/profile_images/1408078731051143171/SrpTaIsQ_normal.jpg"
"757659945487728640","1431983816172785672","2021-08-29 14:15:21","32BeatWriters","An ACL tear is the belief, but all parties are waiting on the MRI to confirm. https://t.co/aRjNWMxqSS","Twitter for iPhone",91,,,,false,true,0,314,,,"","","","","","","","","","","","",,"","","en",,,,,,,,,,,,,,,,"1431983772614995971","An ACL tear is the belief, but all parties are waiting on the MRI to confirm. https://t.co/aRjNWMxqSS","2021-08-29 14:15:11","Twitter for iPhone",1910,314,"16403943","RapSheet","Ian Rapoport",2810870,718,148600,"New York","National Insider for NFL Network and https://t.co/NIVZ6FP1b6. Husband of @thebanktress.",true,,,,,,,"","","","https://twitter.com/32BeatWriters/status/1431983816172785672","NFL Beat Writers","Training camp","We follow all 32 NFL teams' beat writers so you don't have to. Follow us to help win your fantasy football league. https://t.co/KK0FOJLbrr",,false,40071,755,1190,21673,1330,"2016-07-25 19:33:02",false,,,,"https://pbs.twimg.com/profile_banners/757659945487728640/1597874950",,"http://pbs.twimg.com/profile_images/1408078731051143171/SrpTaIsQ_normal.jpg"
"757659945487728640","1431983636971143172","2021-08-29 14:14:38","32BeatWriters","J.K. Dobbins currently is undergoing his MRI, but the expectation going in was that he had suffered a season-ending knee injury, per sources.","Twitter for iPhone",139,,,,false,true,0,1294,,,"","","","","","","","","","","","",,"","","en",,,,,,,,,,,,,,,,"1431983214424465410","J.K. Dobbins currently is undergoing his MRI, but the expectation going in was that he had suffered a season-ending knee injury, per sources.","2021-08-29 14:12:57","Twitter for iPhone",10745,1294,"51263592","AdamSchefter","Adam Schefter",8506627,3442,55756,"New York","ESPN Senior NFL Insider. 
Interview & Podcast Requests: ESPNPR@espn.com
Host of the Adam Schefter Podcast
https://t.co/oz43ix5jZU",true,,,,,,,"","","","https://twitter.com/32BeatWriters/status/1431983636971143172","NFL Beat Writers","Training camp","We follow all 32 NFL teams' beat writers so you don't have to. Follow us to help win your fantasy football league. https://t.co/KK0FOJLbrr",,false,40071,755,1190,21673,1330,"2016-07-25 19:33:02",false,,,,"https://pbs.twimg.com/profile_banners/757659945487728640/1597874950",,"http://pbs.twimg.com/profile_images/1408078731051143171/SrpTaIsQ_normal.jpg"
"757659945487728640","1431982106414964749","2021-08-29 14:08:33","32BeatWriters","Just mentioned on @VSiNLive Dobbins is out for the year.","Twitter for iPhone",74,,,,false,true,0,91,,,"","","","","","","","","","","","",,"","","en",,,,,,,,,,,,,,,,"1431981724133515268","Just mentioned on @VSiNLive Dobbins is out for the year.","2021-08-29 14:07:02","Twitter Web App",195,91,"757924803831533568","mlombardiNFL","Michael Lombardi",142060,1321,28896,"","GMShuffle Pod, @TheDaily_Coach | Proud husband, father of 2 coaches, 2 beautiful daughter in laws, 4 grandsons, 2 lagottos & 3SB rings.",true,,,,,,,"","","","https://twitter.com/32BeatWriters/status/1431982106414964749","NFL Beat Writers","Training camp","We follow all 32 NFL teams' beat writers so you don't have to. Follow us to help win your fantasy football league. https://t.co/KK0FOJLbrr",,false,40071,755,1190,21673,1330,"2016-07-25 19:33:02",false,,,,"https://pbs.twimg.com/profile_banners/757659945487728640/1597874950",,"http://pbs.twimg.com/profile_images/1408078731051143171/SrpTaIsQ_normal.jpg"
"757659945487728640","1431795191439036418","2021-08-29 01:45:49","32BeatWriters","Ravens QB Lamar Jackson said ""hopefully"" RB J.K. Dobbins (knee) doesn't miss any time over the injury.

""That's a tremendous back,"" Jackson said. ""But we have  Gus [Edwards], we have Ty [Williams]. Hopefully, he's good.""","Twitter for iPhone",140,,,,false,true,0,20,,,"","","","","","","","","","","","",,"","","en",,,,,,,,,,,,,,,,"1431794614223216653","Ravens QB Lamar Jackson said ""hopefully"" RB J.K. Dobbins (knee) doesn't miss any time over the injury.

""That's a tremendous back,"" Jackson said. ""But we have  Gus [Edwards], we have Ty [Williams]. Hopefully, he's good.""","2021-08-29 01:43:32","Twitter Web App",260,20,"41200745","jamisonhensley","Jamison Hensley",51020,1792,45324,"Baltimore","ESPN Ravens reporter and WBAL Radio contributor.

Email me jamison.hensley@espn.com.

Alum: @baltimoresun, @thedbk",true,,,,,,,"","","","https://twitter.com/32BeatWriters/status/1431795191439036418","NFL Beat Writers","Training camp","We follow all 32 NFL teams' beat writers so you don't have to. Follow us to help win your fantasy football league. https://t.co/KK0FOJLbrr",,false,40071,755,1190,21673,1330,"2016-07-25 19:33:02",false,,,,"https://pbs.twimg.com/profile_banners/757659945487728640/1597874950",,"http://pbs.twimg.com/profile_images/1408078731051143171/SrpTaIsQ_normal.jpg"
"757659945487728640","1431793976676343808","2021-08-29 01:41:00","32BeatWriters","Broncos tied at 3 with the Rams after the 1st quarter.

But it feels worse.

Teddy is 1/6.

Defense has looked shaky against Rams backups.

Special teams has allowed a big return.","Twitter for iPhone",140,,,,false,true,0,6,,,"","","","","","","","","","","","",,"","","en",,,,,,,,,,,,,,,,"1431793880979095554","Broncos tied at 3 with the Rams after the 1st quarter.

But it feels worse.

Teddy is 1/6.

Defense has looked shaky against Rams backups.

Special teams has allowed a big return.","2021-08-29 01:40:37","TweetDeck",53,6,"37002193","ZacStevensDNVR","Zac Stevens",18493,815,47146,"Denver, CO","Denver Broncos beat reporter @DNVR__Broncos w/@DNVR_Sports, @DNVR_Nuggets, @DNVR_Avalanche, @DNVR_Rockies — Colorado guy covering Colorado's team — @PFWAwriters",false,,,,,,,"","","","https://twitter.com/32BeatWriters/status/1431793976676343808","NFL Beat Writers","Training camp","We follow all 32 NFL teams' beat writers so you don't have to. Follow us to help win your fantasy football league. https://t.co/KK0FOJLbrr",,false,40071,755,1190,21673,1330,"2016-07-25 19:33:02",false,,,,"https://pbs.twimg.com/profile_banners/757659945487728640/1597874950",,"http://pbs.twimg.com/profile_images/1408078731051143171/SrpTaIsQ_normal.jpg"
"757659945487728640","1431793935672823813","2021-08-29 01:40:50","32BeatWriters","Javian Hawkins got here too late to have a shot at the roster, but he's looked good with the carries he's gotten tonight.","Twitter for iPhone",136,,,,false,true,0,3,,,"","","","","","","","","","","","",,"","","en",,,,,,,,,,,,,,,,"1431793827413696519","Javian Hawkins got here too late to have a shot at the roster, but he's looked good with the carries he's gotten tonight.","2021-08-29 01:40:24","Twitter Web App",16,3,"129605773","terrymc13","Terry McCormick",17018,826,45879,"Nashville, TN","Titans beat writer since 1997. Publisher of https://t.co/8stmRMCt1q, Co-host of ""George Plaster Show"" on WNSR-AM 560. Appear on Fox 17.",false,,,,,,,"","","","https://twitter.com/32BeatWriters/status/1431793935672823813","NFL Beat Writers","Training camp","We follow all 32 NFL teams' beat writers so you don't have to. Follow us to help win your fantasy football league. https://t.co/KK0FOJLbrr",,false,40071,755,1190,21673,1330,"2016-07-25 19:33:02",false,,,,"https://pbs.twimg.com/profile_banners/757659945487728640/1597874950",,"http://pbs.twimg.com/profile_images/1408078731051143171/SrpTaIsQ_normal.jpg"
"757659945487728640","1431793490036416515","2021-08-29 01:39:04","32BeatWriters","JESPER HORSTED.

His third TD catch of the game! 

📺: #CHIvsTEN on @NFLNetwork (or check local listings)
📱: https://t.co/fuBaH7nb4O https://t.co/f9PDBvwF03","Twitter for iPhone",140,,,,false,true,0,372,,,"","","","","","","","","","","","",,"","","en",,,,,,,,,,,,,,,,"1431793033633099781","JESPER HORSTED.

His third TD catch of the game! 

📺: #CHIvsTEN on @NFLNetwork (or check local listings)
📱: https://t.co/fuBaH7nb4O https://t.co/f9PDBvwF03","2021-08-29 01:37:15","Twitter Media Studio - LiveCut",2788,372,"19426551","NFL","NFL",26988742,2697,223918,"","Official Twitter account of the National Football League.",true,,,,,,,"","","","https://twitter.com/32BeatWriters/status/1431793490036416515","NFL Beat Writers","Training camp","We follow all 32 NFL teams' beat writers so you don't have to. Follow us to help win your fantasy football league. https://t.co/KK0FOJLbrr",,false,40071,755,1190,21673,1330,"2016-07-25 19:33:02",false,,,,"https://pbs.twimg.com/profile_banners/757659945487728640/1597874950",,"http://pbs.twimg.com/profile_images/1408078731051143171/SrpTaIsQ_normal.jpg"
"757659945487728640","1431785485681283079","2021-08-29 01:07:15","32BeatWriters","Myles Gaskin and Malcolm Brown ADP over the past month per @UnderdogFantasy https://t.co/1PVtAGOJJI","Twitter for iPhone",75,,,,false,false,32,1,,,"","","","","","","","","","","","",,"","","en",,,,,,,,,,,,,,,,,,,,,,,,,,,,,,,,,,,,,"","","","https://twitter.com/32BeatWriters/status/1431785485681283079","NFL Beat Writers","Training camp","We follow all 32 NFL teams' beat writers so you don't have to. Follow us to help win your fantasy football league. https://t.co/KK0FOJLbrr",,false,40071,755,1190,21673,1330,"2016-07-25 19:33:02",false,,,,"https://pbs.twimg.com/profile_banners/757659945487728640/1597874950",,"http://pbs.twimg.com/profile_images/1408078731051143171/SrpTaIsQ_normal.jpg"
"757659945487728640","1431750540250136577","2021-08-28 22:48:24","32BeatWriters","Hope Dobbins is OK &amp; it’s just a sprain. 

This is the worst part of my job, but here it goes:

If Dobbins is out, Gus Edwards has RB1 upside. No. 5 PFF run grade from last season, not an outstanding receiver, but not a total dud either.

He had the No. 5 YPC (5.18) from 2019-20. https://t.co/EoCA4QVcab","Twitter for iPhone",144,,,,false,true,0,8,,,"","","","","","","","","","","","",,"","","en",,,,,,,,,,,,,,,,"1431750116965191681","Hope Dobbins is OK &amp; it’s just a sprain. 

This is the worst part of my job, but here it goes:

If Dobbins is out, Gus Edwards has RB1 upside. No. 5 PFF run grade from last season, not an outstanding receiver, but not a total dud either.

He had the No. 5 YPC (5.18) from 2019-20. https://t.co/EoCA4QVcab","2021-08-28 22:46:43","TweetDeck",81,8,"23541812","4for4_John","John Paulsen",70485,1123,84328,"Sunny CA","Director of Forecasting @4for4football | FantasyPros Most Accurate, 2010 & 2014 | FantasyPros Top 6 Accuracy in 9 of the last 11 years | GBP, GSW, LFC",false,,,,,,,"","","","https://twitter.com/32BeatWriters/status/1431750540250136577","NFL Beat Writers","Training camp","We follow all 32 NFL teams' beat writers so you don't have to. Follow us to help win your fantasy football league. https://t.co/KK0FOJLbrr",,false,40071,755,1190,21673,1330,"2016-07-25 19:33:02",false,,,,"https://pbs.twimg.com/profile_banners/757659945487728640/1597874950",,"http://pbs.twimg.com/profile_images/1408078731051143171/SrpTaIsQ_normal.jpg"
"757659945487728640","1431744387780915201","2021-08-28 22:23:57","32BeatWriters","https://t.co/3BQRzKClgP https://t.co/WP8TPyU3FW","Twitter for iPhone",23,,,,true,false,30,1,,,"","","","","","","","","","","","",,"","","und","1431743390186573826","JK Dobbins carried into the medical tent, putting no weight on left knee which was bent backwards on a tackle on a screen pass.","2021-08-28 22:19:59","TweetDeck",43,22,"48124952","PatrickClaybon","Patrick Claybon",24254,2103,129885,"Los Angeles, California","TV for @NfLnetwork ... NFL Fantasy Live, guest on your fav podcast Alabamian,Father(X2), Husband & lucky son. Momentum doesn't exist. People not profits. he/him",true,,,,,,,,,,,,,,,,,,,,,,"","","","https://twitter.com/32BeatWriters/status/1431744387780915201","NFL Beat Writers","Training camp","We follow all 32 NFL teams' beat writers so you don't have to. Follow us to help win your fantasy football league. https://t.co/KK0FOJLbrr",,false,40071,755,1190,21673,1330,"2016-07-25 19:33:02",false,,,,"https://pbs.twimg.com/profile_banners/757659945487728640/1597874950",,"http://pbs.twimg.com/profile_images/1408078731051143171/SrpTaIsQ_normal.jpg"
"757659945487728640","1431730385898061830","2021-08-28 21:28:18","32BeatWriters","A couple of routes from A.J. Brown and Julio Jones. #Titans https://t.co/UKpFT3oYA0","Twitter for iPhone",103,,,,false,true,0,11,,,"","","","","","","","","","","","",,"","","en",,,,,,,,,,,,,,,,"1431729762397995018","A couple of routes from A.J. Brown and Julio Jones. #Titans https://t.co/UKpFT3oYA0","2021-08-28 21:25:50","Twitter for Android",95,11,"41814795","TDavenport_NFL","TURRON DAVENPORT",32330,1809,145401,"Philly 🛫 Nashville","💻ESPN NFL Nation reporter covering the Tennessee Titans |  🗣️🎙️Talking w/TD | 🏈Member Pro Football Writers Association | 🙏🏾Heb 11:1 Believe it!",true,,,,,,,"","","","https://twitter.com/32BeatWriters/status/1431730385898061830","NFL Beat Writers","Training camp","We follow all 32 NFL teams' beat writers so you don't have to. Follow us to help win your fantasy football league. https://t.co/KK0FOJLbrr",,false,40071,755,1190,21673,1330,"2016-07-25 19:33:02",false,,,,"https://pbs.twimg.com/profile_banners/757659945487728640/1597874950",,"http://pbs.twimg.com/profile_images/1408078731051143171/SrpTaIsQ_normal.jpg"
"757659945487728640","1431688456489652226","2021-08-28 18:41:42","32BeatWriters","Thread. Sources tell @yahoosports the #Dolphins have emerged as the frontrunner in trade discussions with the #Texans for QB Deshaun Watson. The Texans are seeking 3 first-round picks and 2 second-round picks in negotiations, according to a team that dropped out of trade talks.","Twitter for iPhone",139,,,,false,true,0,1276,,,"","","","","","","","","","","","",,"","","en",,,,,,,,,,,,,,,,"1431685635702726658","Thread. Sources tell @yahoosports the #Dolphins have emerged as the frontrunner in trade discussions with the #Texans for QB Deshaun Watson. The Texans are seeking 3 first-round picks and 2 second-round picks in negotiations, according to a team that dropped out of trade talks.","2021-08-28 18:30:29","Twitter for iPhone",3769,1276,"50863281","CharlesRobinson","Charles Robinson",115678,648,13350,"An NFL city near you","Senior NFL reporter for Yahoo. Always outnumbered. Email me at: WindyCityScribe@yahoo.com.",true,,,,,,,"","","","https://twitter.com/32BeatWriters/status/1431688456489652226","NFL Beat Writers","Training camp","We follow all 32 NFL teams' beat writers so you don't have to. Follow us to help win your fantasy football league. https://t.co/KK0FOJLbrr",,false,40071,755,1190,21673,1330,"2016-07-25 19:33:02",false,,,,"https://pbs.twimg.com/profile_banners/757659945487728640/1597874950",,"http://pbs.twimg.com/profile_images/1408078731051143171/SrpTaIsQ_normal.jpg"
"757659945487728640","1431621653889433608","2021-08-28 14:16:15","32BeatWriters","Trade: Jaguars are sending QB Gardner Minshew II to the Philadelphia Eagles for a conditional 2022 sixth-round pick, per sources. The 6th-round pick could go to a 5th if Minshew plays in 50 percent of the plays in three games this season.","Twitter for iPhone",139,,,,false,true,0,3739,,,"","","","","","","","","","","","",,"","","en",,,,,,,,,,,,,,,,"1431620255256924161","Trade: Jaguars are sending QB Gardner Minshew II to the Philadelphia Eagles for a conditional 2022 sixth-round pick, per sources. The 6th-round pick could go to a 5th if Minshew plays in 50 percent of the plays in three games this season.","2021-08-28 14:10:41","Twitter for iPhone",28049,3739,"51263592","AdamSchefter","Adam Schefter",8506627,3442,55756,"New York","ESPN Senior NFL Insider. 
Interview & Podcast Requests: ESPNPR@espn.com
Host of the Adam Schefter Podcast
https://t.co/oz43ix5jZU",true,,,,,,,"","","","https://twitter.com/32BeatWriters/status/1431621653889433608","NFL Beat Writers","Training camp","We follow all 32 NFL teams' beat writers so you don't have to. Follow us to help win your fantasy football league. https://t.co/KK0FOJLbrr",,false,40071,755,1190,21673,1330,"2016-07-25 19:33:02",false,,,,"https://pbs.twimg.com/profile_banners/757659945487728640/1597874950",,"http://pbs.twimg.com/profile_images/1408078731051143171/SrpTaIsQ_normal.jpg"
"757659945487728640","1431450232928210944","2021-08-28 02:55:05","32BeatWriters","Rhule on Darnold: ""He needed to get out there and play. We wanted to put him in some situations. Like everyone else they'll be some good, some bad. Overall good effort."" #Panthers","Twitter for iPhone",140,,,,false,true,0,4,,,"","","","","","","","","","","","",,"","","en",,,,,,,,,,,,,,,,"1431450120130859009","Rhule on Darnold: ""He needed to get out there and play. We wanted to put him in some situations. Like everyone else they'll be some good, some bad. Overall good effort."" #Panthers","2021-08-28 02:54:38","TweetDeck",28,4,"23670839","WilliePStyle","Will Palaszczuk",3678,967,67957,"Charlotte, NC","Sports Talk Host/Field Reporter @wfnz. Previously: @929TheGame, @ESPNUpstate, SC Radio Network, @SBNationRadio & @KTGRSports. Opinions: my own",false,,,,,,,"","","","https://twitter.com/32BeatWriters/status/1431450232928210944","NFL Beat Writers","Training camp","We follow all 32 NFL teams' beat writers so you don't have to. Follow us to help win your fantasy football league. https://t.co/KK0FOJLbrr",,false,40071,755,1190,21673,1330,"2016-07-25 19:33:02",false,,,,"https://pbs.twimg.com/profile_banners/757659945487728640/1597874950",,"http://pbs.twimg.com/profile_images/1408078731051143171/SrpTaIsQ_normal.jpg"
"757659945487728640","1431433811842248707","2021-08-28 01:49:50","32BeatWriters","Kellen Mond through two games is 12 for 28 passing with 3 points on 11 drives, including zero second-half points.

Can only go up from there...right?","Twitter for iPhone",140,,,,false,true,0,7,,,"","","","","","","","","","","","",,"","","en",,,,,,,,,,,,,,,,"1431432208573771776","Kellen Mond through two games is 12 for 28 passing with 3 points on 11 drives, including zero second-half points.

Can only go up from there...right?","2021-08-28 01:43:27","TweetDeck",53,7,"3765498081","WillRagatz","Will Ragatz",5164,934,11123,"Mpls","#Vikings writer for Sports Illustrated. @InsideNU, @MedillSchool alum. Uptown Minneapolis native. Expect other MN sports tweets, too.",false,,,,,,,"","","","https://twitter.com/32BeatWriters/status/1431433811842248707","NFL Beat Writers","Training camp","We follow all 32 NFL teams' beat writers so you don't have to. Follow us to help win your fantasy football league. https://t.co/KK0FOJLbrr",,false,40071,755,1190,21673,1330,"2016-07-25 19:33:02",false,,,,"https://pbs.twimg.com/profile_banners/757659945487728640/1597874950",,"http://pbs.twimg.com/profile_images/1408078731051143171/SrpTaIsQ_normal.jpg"
"757659945487728640","1431433752803172354","2021-08-28 01:49:36","32BeatWriters","This weekend only, we are opening this promotion to existing users.

If you enter the Big Dog tournament this weekend you will be automatically entered to win a $60,000 custom chain from Ben Baller 💎⛓ https://t.co/TaFd8wRvIQ","Twitter for iPhone",139,,,,false,true,0,10,,,"","","","","","","","","","","","",,"","","en",,,,,,,,,,,,,,,,"1431394995286708228","This weekend only, we are opening this promotion to existing users.

If you enter the Big Dog tournament this weekend you will be automatically entered to win a $60,000 custom chain from Ben Baller 💎⛓ https://t.co/TaFd8wRvIQ","2021-08-27 23:15:35","Twitter Web App",64,10,"1230555304670244864","UnderdogFantasy","Underdog Fantasy",20772,320,917,"Brooklyn, NY","Underdog Fantasy",false,,,,,,,"","","","https://twitter.com/32BeatWriters/status/1431433752803172354","NFL Beat Writers","Training camp","We follow all 32 NFL teams' beat writers so you don't have to. Follow us to help win your fantasy football league. https://t.co/KK0FOJLbrr",,false,40071,755,1190,21673,1330,"2016-07-25 19:33:02",false,,,,"https://pbs.twimg.com/profile_banners/757659945487728640/1597874950",,"http://pbs.twimg.com/profile_images/1408078731051143171/SrpTaIsQ_normal.jpg"
