"757659945487728640","1430656770138152960","2021-08-25 22:22:08","32BeatWriters","Vic Fangio said there wasn’t much separation between Teddy Bridgewater and Drew Lock, but said this was the right decision for the team right now. https://t.co/HnFW5a87Lz","Twitter for iPhone",140,,,,false,true,0,5,,,"","","","","","","","","","","","",,"","","en",,,,,,,,,,,,,,,,"1430656658112335872","Vic Fangio said there wasn’t much separation between Teddy Bridgewater and Drew Lock, but said this was the right decision for the team right now. https://t.co/HnFW5a87Lz","2021-08-25 22:21:42","Twitter for iPhone",17,5,"316896160","AricDiLalla","Aric DiLalla",5576,789,13189,"Denver, CO","Lead writer & team reporter for @Broncos | @NorthwesternU, @Mercersburg | Not a cat person, definitely a 'Cats person",true,,,,,,,"","","","https://twitter.com/32BeatWriters/status/1430656770138152960","NFL Beat Writers","Training camp","We follow all 32 NFL teams' beat writers so you don't have to. Follow us to help win your fantasy football league. https://t.co/KK0FOJLbrr",,false,39672,755,1183,21619,1324,"2016-07-25 19:33:02",false,,,,"https://pbs.twimg.com/profile_banners/757659945487728640/1597874950",,"http://pbs.twimg.com/profile_images/1408078731051143171/SrpTaIsQ_normal.jpg"
"757659945487728640","1430618162572242948","2021-08-25 19:48:44","32BeatWriters","Eagles-Jets practice notes, Day 2:

1) A lot of goal line/red zone work. In one session, Jalen Hurts threw it to Zach Ertz in the back of the end zone, Ertz raised up to snag it.

Sirianni said Ertz and Goedert were at the top of chart for most catches this summer. Hurts’ go-to.","Twitter for iPhone",140,,,,false,true,0,22,,,"","","","","","","","","","","","",,"","","en",,,,,,,,,,,,,,,,"1430614142629687296","Eagles-Jets practice notes, Day 2:

1) A lot of goal line/red zone work. In one session, Jalen Hurts threw it to Zach Ertz in the back of the end zone, Ertz raised up to snag it.

Sirianni said Ertz and Goedert were at the top of chart for most catches this summer. Hurts’ go-to.","2021-08-25 19:32:45","Twitter for iPhone",330,22,"124275696","Tim_McManus","Tim McManus",84758,807,26923,"Philadelphia","ESPN Eagles beat reporter. Contributor to 97.5 the Fanatic. Tips? Email timmcmanus42@gmail.com",true,,,,,,,"","","","https://twitter.com/32BeatWriters/status/1430618162572242948","NFL Beat Writers","Training camp","We follow all 32 NFL teams' beat writers so you don't have to. Follow us to help win your fantasy football league. https://t.co/KK0FOJLbrr",,false,39672,755,1183,21619,1324,"2016-07-25 19:33:02",false,,,,"https://pbs.twimg.com/profile_banners/757659945487728640/1597874950",,"http://pbs.twimg.com/profile_images/1408078731051143171/SrpTaIsQ_normal.jpg"
"757659945487728640","1430617435284115460","2021-08-25 19:45:50","32BeatWriters","Kyle Shanahan is still fielding 49ers’ Week 1 starting QB questions: 

“I feel I’ve talked pretty consistently this whole time… I’ve got a pretty good idea and I think our team does also.”","Twitter for iPhone",140,,,,false,true,0,11,,,"","","","","","","","","","","","",,"","","en",,,,,,,,,,,,,,,,"1430615483225571329","Kyle Shanahan is still fielding 49ers’ Week 1 starting QB questions: 

“I feel I’ve talked pretty consistently this whole time… I’ve got a pretty good idea and I think our team does also.”","2021-08-25 19:38:05","Twitter for iPhone",155,11,"47062369","LombardiHimself","David Lombardi",36498,623,78403,"","San Francisco 49ers coverage @TheAthletic. Contact: dlombardi@theathletic.com. Subscribe to my YouTube channel: https://t.co/ahUeDjaJGH",true,,,,,,,"","","","https://twitter.com/32BeatWriters/status/1430617435284115460","NFL Beat Writers","Training camp","We follow all 32 NFL teams' beat writers so you don't have to. Follow us to help win your fantasy football league. https://t.co/KK0FOJLbrr",,false,39672,755,1183,21619,1324,"2016-07-25 19:33:02",false,,,,"https://pbs.twimg.com/profile_banners/757659945487728640/1597874950",,"http://pbs.twimg.com/profile_images/1408078731051143171/SrpTaIsQ_normal.jpg"
"757659945487728640","1430617346926854146","2021-08-25 19:45:29","32BeatWriters","Practice is over. Hotter than yesterday, if that’s possible. Dak Prescott participated in four series of team drills and showed good zip on the ball, including a pair of 20-plus-yard completions to Blake Jarwin and Dalton Schultz.","Twitter for iPhone",139,,,,false,true,0,13,,,"","","","","","","","","","","","",,"","","en",,,,,,,,,,,,,,,,"1430613864186621966","Practice is over. Hotter than yesterday, if that’s possible. Dak Prescott participated in four series of team drills and showed good zip on the ball, including a pair of 20-plus-yard completions to Blake Jarwin and Dalton Schultz.","2021-08-25 19:31:39","Twitter for iPhone",185,13,"135946911","robphillips3","Rob Phillips",54657,901,29441,"DFW","Geriatric millennial, @dallascowboys Senior Writer Emmy Winner | Emmy’s Dad | 1 Corinthians 13:13",true,,,,,,,"","","","https://twitter.com/32BeatWriters/status/1430617346926854146","NFL Beat Writers","Training camp","We follow all 32 NFL teams' beat writers so you don't have to. Follow us to help win your fantasy football league. https://t.co/KK0FOJLbrr",,false,39672,755,1183,21619,1324,"2016-07-25 19:33:02",false,,,,"https://pbs.twimg.com/profile_banners/757659945487728640/1597874950",,"http://pbs.twimg.com/profile_images/1408078731051143171/SrpTaIsQ_normal.jpg"
"757659945487728640","1430615534480019463","2021-08-25 19:38:17","32BeatWriters","Greg Roman was asked today about the difference between James Proche's productivity at training camp practices, where has often been the standout among WRs, and the two preseason games, where he has a total of three catches for 14 yards ...","Twitter Web App",140,,,,false,true,0,2,,,"","","","","","","","","","","","",,"","","en",,,,,,,,,,,,,,,,"1430615360064180226","Greg Roman was asked today about the difference between James Proche's productivity at training camp practices, where has often been the standout among WRs, and the two preseason games, where he has a total of three catches for 14 yards ...","2021-08-25 19:37:36","TweetDeck",6,2,"36724078","bsmolka","Bo Smolka",3817,922,33548,"Baltimore, MD","Ravens beat writer for PressBox, former BaltSun desk editor, Bucknell SID. Past winner CoSIDA National Story of the Year. Above all else, husband and father",false,,,,,,,"","","","https://twitter.com/32BeatWriters/status/1430615534480019463","NFL Beat Writers","Training camp","We follow all 32 NFL teams' beat writers so you don't have to. Follow us to help win your fantasy football league. https://t.co/KK0FOJLbrr",,false,39672,755,1183,21619,1324,"2016-07-25 19:33:02",false,,,,"https://pbs.twimg.com/profile_banners/757659945487728640/1597874950",,"http://pbs.twimg.com/profile_images/1408078731051143171/SrpTaIsQ_normal.jpg"
"757659945487728640","1430613512531947523","2021-08-25 19:30:15","32BeatWriters","Asked Ravens OC Greg Roman how he assesses the production of WR James Proche, who’s been quiet in the preseason and loud at training camp. 

His response: ⤵️ https://t.co/lVmhazIJrI https://t.co/tNzfWxlxl5","Twitter for iPhone",140,,,,false,true,0,7,,,"","","","","","","","","","","","",,"","","en",,,,,,,,,,,,,,,,"1430611062794108928","Asked Ravens OC Greg Roman how he assesses the production of WR James Proche, who’s been quiet in the preseason and loud at training camp. 

His response: ⤵️ https://t.co/lVmhazIJrI https://t.co/tNzfWxlxl5","2021-08-25 19:20:31","Twitter for iPhone",40,7,"38530641","jonas_shaffer","Jonas Shaffer",6987,555,16806,"DMV","Sports @baltimoresun. … Born-and-raised Marylander. … Formerly of @DBKSports, @CNSmd, @capecodtimes and @PostSports.",true,,,,,,,"","","","https://twitter.com/32BeatWriters/status/1430613512531947523","NFL Beat Writers","Training camp","We follow all 32 NFL teams' beat writers so you don't have to. Follow us to help win your fantasy football league. https://t.co/KK0FOJLbrr",,false,39672,755,1183,21619,1324,"2016-07-25 19:33:02",false,,,,"https://pbs.twimg.com/profile_banners/757659945487728640/1597874950",,"http://pbs.twimg.com/profile_images/1408078731051143171/SrpTaIsQ_normal.jpg"
"757659945487728640","1430612798887841795","2021-08-25 19:27:25","32BeatWriters","Really enjoyed doing this podcast with @2guysbrandon and @ChrisAllenFFWX! 
We discussed:
- The origins of 32beatwriters
- Preseason Hype
- Best Ball talk
- Camp Competitions

Go listen! https://t.co/KsZL3bXgh5","Twitter Web App",185,,,,true,false,14,2,,,"","","","","","","","","","","","",,"","","en","1430597265740210177","🎧  We have a must-listen bonus episode of TMAP for you today! Hosts @2guysbrandon &amp; @ChrisAllenFFWX were joined by Zach Ring of @32BeatWriters to talk preseason buzz &amp; competitions. 

Subscribe: https://t.co/0jguzmdjtz

Listen: https://t.co/RcF4pXB2lS

Sponsor: @UnderdogFantasy https://t.co/z1gutRqupH","2021-08-25 18:25:42","Buffer",7,7,"53922985","4for4football","4for4 Fantasy Football",47094,444,74541,"USA","Home of the most accurate fantasy football rankings since 2010. Battle-Tested by 40,000+ football diehards as the #1 fantasy website since 1999!",false,,,,,,,,,,,,,,,,,,,,,,"","","","https://twitter.com/32BeatWriters/status/1430612798887841795","NFL Beat Writers","Training camp","We follow all 32 NFL teams' beat writers so you don't have to. Follow us to help win your fantasy football league. https://t.co/KK0FOJLbrr",,false,39672,755,1183,21619,1324,"2016-07-25 19:33:02",false,,,,"https://pbs.twimg.com/profile_banners/757659945487728640/1597874950",,"http://pbs.twimg.com/profile_images/1408078731051143171/SrpTaIsQ_normal.jpg"
"757659945487728640","1430603270821662739","2021-08-25 18:49:33","32BeatWriters","We've tallied up the 88 replies/quote tweets so far and the leaders are:

QB - Jalen Hurts/Tua Tagovailoa (12 votes a piece)
RB - Antonio Gibson (13 votes)
WR - Corey Davis (7 votes)
TE - Irv Smith (12 votes) https://t.co/N6Vr5nhJWD","Twitter Web App",208,,,,true,false,40,3,,,"","","","","","","","","","","","",,"","","en","1430529804797890561","We’ve done this before but it was a few months ago and things have changed…

Who is YOUR guy this year? Pick one player at each of the following positions that you are higher on than consensus:

QB - 
RB - 
WR - 
TE -","2021-08-25 13:57:38","Twitter for iPhone",31,4,"757659945487728640","32BeatWriters","NFL Beat Writers",39672,755,21619,"Training camp","We follow all 32 NFL teams' beat writers so you don't have to. Follow us to help win your fantasy football league. https://t.co/KK0FOJLbrr",false,,,,,,,,,,,,,,,,,,,,,,"","","","https://twitter.com/32BeatWriters/status/1430603270821662739","NFL Beat Writers","Training camp","We follow all 32 NFL teams' beat writers so you don't have to. Follow us to help win your fantasy football league. https://t.co/KK0FOJLbrr",,false,39672,755,1183,21619,1324,"2016-07-25 19:33:02",false,,,,"https://pbs.twimg.com/profile_banners/757659945487728640/1597874950",,"http://pbs.twimg.com/profile_images/1408078731051143171/SrpTaIsQ_normal.jpg"
"757659945487728640","1430591455161110537","2021-08-25 18:02:36","32BeatWriters","Stefon Diggs made full return to practice today. Highlight were a few 1-on-1 reps vs Tre White. 

They were battling as hard as ever and I’d have to give edge to Tre. Diggs made one catch that was just jaw-dropping, but Tre recovered after getting beat initially &amp; ripped it out.","Twitter for iPhone",140,,,,false,true,0,27,,,"","","","","","","","","","","","",,"","","en",,,,,,,,,,,,,,,,"1430591260520292363","Stefon Diggs made full return to practice today. Highlight were a few 1-on-1 reps vs Tre White. 

They were battling as hard as ever and I’d have to give edge to Tre. Diggs made one catch that was just jaw-dropping, but Tre recovered after getting beat initially &amp; ripped it out.","2021-08-25 18:01:50","Twitter for iPhone",239,27,"27072201","MattParrino","Matt Parrino",34238,3880,44374,"Buffalo, NY","Bills beat reporter @syracusedotcom 🏈 | ""SHOUT!"" Podcast | 📺 @news4buffalo | @PFWAwriters | UB adjunct 🗒 | UB grad | Past: UFC Dig. Media Dir. 👊",true,,,,,,,"","","","https://twitter.com/32BeatWriters/status/1430591455161110537","NFL Beat Writers","Training camp","We follow all 32 NFL teams' beat writers so you don't have to. Follow us to help win your fantasy football league. https://t.co/KK0FOJLbrr",,false,39672,755,1183,21619,1324,"2016-07-25 19:33:02",false,,,,"https://pbs.twimg.com/profile_banners/757659945487728640/1597874950",,"http://pbs.twimg.com/profile_images/1408078731051143171/SrpTaIsQ_normal.jpg"
"757659945487728640","1430578853768990727","2021-08-25 17:12:32","32BeatWriters","Byron Jones comes in an punches one out on Gaskin – put his first right on the football","Twitter for iPhone",105,,,,false,true,0,4,,,"","","","","","","","","","","","",,"","","en",,,,,,,,,,,,,,,,"1430578492769509384","Byron Jones comes in an punches one out on Gaskin – put his first right on the football","2021-08-25 17:11:06","Twitter Web App",103,4,"763497955936444416","WingfieldNFL","Travis Wingfield",29255,660,66804,"Miami, FL","Host of the Drive Time Podcast, part of the @MiamiDolphins Podcast Network. Writer https://t.co/4zmBWubD1q, PNW ✈️ MIA, Washington State University alum",true,,,,,,,"","","","https://twitter.com/32BeatWriters/status/1430578853768990727","NFL Beat Writers","Training camp","We follow all 32 NFL teams' beat writers so you don't have to. Follow us to help win your fantasy football league. https://t.co/KK0FOJLbrr",,false,39672,755,1183,21619,1324,"2016-07-25 19:33:02",false,,,,"https://pbs.twimg.com/profile_banners/757659945487728640/1597874950",,"http://pbs.twimg.com/profile_images/1408078731051143171/SrpTaIsQ_normal.jpg"
"757659945487728640","1430578784600723462","2021-08-25 17:12:15","32BeatWriters","11on11 - Tua with a dime to Merritt on a deep crosser – lofted it out there for a catch about 20 yards down field and who know how much after","Twitter for iPhone",140,,,,false,true,0,23,,,"","","","","","","","","","","","",,"","","en",,,,,,,,,,,,,,,,"1430576566476619788","11on11 - Tua with a dime to Merritt on a deep crosser – lofted it out there for a catch about 20 yards down field and who know how much after","2021-08-25 17:03:26","Twitter Web App",263,23,"763497955936444416","WingfieldNFL","Travis Wingfield",29255,660,66804,"Miami, FL","Host of the Drive Time Podcast, part of the @MiamiDolphins Podcast Network. Writer https://t.co/4zmBWubD1q, PNW ✈️ MIA, Washington State University alum",true,,,,,,,"","","","https://twitter.com/32BeatWriters/status/1430578784600723462","NFL Beat Writers","Training camp","We follow all 32 NFL teams' beat writers so you don't have to. Follow us to help win your fantasy football league. https://t.co/KK0FOJLbrr",,false,39672,755,1183,21619,1324,"2016-07-25 19:33:02",false,,,,"https://pbs.twimg.com/profile_banners/757659945487728640/1597874950",,"http://pbs.twimg.com/profile_images/1408078731051143171/SrpTaIsQ_normal.jpg"
"757659945487728640","1430578763880976390","2021-08-25 17:12:10","32BeatWriters","Gaskin finds an lane and it’s another chunk of yardage – Jackson, Kindley and Deiter making some room","Twitter for iPhone",119,,,,false,true,0,6,,,"","","","","","","","","","","","",,"","","en",,,,,,,,,,,,,,,,"1430576946505830406","Gaskin finds an lane and it’s another chunk of yardage – Jackson, Kindley and Deiter making some room","2021-08-25 17:04:57","Twitter Web App",111,6,"763497955936444416","WingfieldNFL","Travis Wingfield",29255,660,66804,"Miami, FL","Host of the Drive Time Podcast, part of the @MiamiDolphins Podcast Network. Writer https://t.co/4zmBWubD1q, PNW ✈️ MIA, Washington State University alum",true,,,,,,,"","","","https://twitter.com/32BeatWriters/status/1430578763880976390","NFL Beat Writers","Training camp","We follow all 32 NFL teams' beat writers so you don't have to. Follow us to help win your fantasy football league. https://t.co/KK0FOJLbrr",,false,39672,755,1183,21619,1324,"2016-07-25 19:33:02",false,,,,"https://pbs.twimg.com/profile_banners/757659945487728640/1597874950",,"http://pbs.twimg.com/profile_images/1408078731051143171/SrpTaIsQ_normal.jpg"
"757659945487728640","1430578662181642246","2021-08-25 17:11:46","32BeatWriters","#Browns coach Kevin Stefanski on Njoku: ""I see a very determined player and I like where David's at""","Twitter for iPhone",118,,,,false,true,0,10,,,"","","","","","","","","","","","",,"","","en",,,,,,,,,,,,,,,,"1430577625337061382","#Browns coach Kevin Stefanski on Njoku: ""I see a very determined player and I like where David's at""","2021-08-25 17:07:39","Twitter Web App",155,10,"28619896","ByNateUlrich","Nate Ulrich",36555,1226,74482,"Akron, Ohio","Cleveland Browns beat writer for the @beaconjournal and Gannett’s USA TODAY Network. Email: nulrich@thebeaconjournal.com",true,,,,,,,"","","","https://twitter.com/32BeatWriters/status/1430578662181642246","NFL Beat Writers","Training camp","We follow all 32 NFL teams' beat writers so you don't have to. Follow us to help win your fantasy football league. https://t.co/KK0FOJLbrr",,false,39672,755,1183,21619,1324,"2016-07-25 19:33:02",false,,,,"https://pbs.twimg.com/profile_banners/757659945487728640/1597874950",,"http://pbs.twimg.com/profile_images/1408078731051143171/SrpTaIsQ_normal.jpg"
"757659945487728640","1430578357591228428","2021-08-25 17:10:33","32BeatWriters","#Browns Kevin Stefanski on Odell Beckham Jr. getting ready for the regular season coming off his injury: ""Has a much better understanding of the scheme in Year 2...it'll increase as we go...it just keeps showing up that the guy's battling. He's working very hard.""","Twitter for iPhone",140,,,,false,true,0,6,,,"","","","","","","","","","","","",,"","","en",,,,,,,,,,,,,,,,"1430578104238583812","#Browns Kevin Stefanski on Odell Beckham Jr. getting ready for the regular season coming off his injury: ""Has a much better understanding of the scheme in Year 2...it'll increase as we go...it just keeps showing up that the guy's battling. He's working very hard.""","2021-08-25 17:09:33","TweetDeck",81,6,"32893049","camijustice","Camryn Justice",16916,1270,12228,"","@WEWS Digital Content Producer | Emmy-nominated sports journalist | Browns | Cavs | Tribe | Covering news/sports in Northeast Ohio | Just a kid from Akron",true,,,,,,,"","","","https://twitter.com/32BeatWriters/status/1430578357591228428","NFL Beat Writers","Training camp","We follow all 32 NFL teams' beat writers so you don't have to. Follow us to help win your fantasy football league. https://t.co/KK0FOJLbrr",,false,39672,755,1183,21619,1324,"2016-07-25 19:33:02",false,,,,"https://pbs.twimg.com/profile_banners/757659945487728640/1597874950",,"http://pbs.twimg.com/profile_images/1408078731051143171/SrpTaIsQ_normal.jpg"
"757659945487728640","1430578291078012934","2021-08-25 17:10:18","32BeatWriters","Stefanski isn't ruling out rookie WR Anthony Schwartz being able to contribute early in the season.

Third-round rookie has missed chunks of camp with a hamstring injury.","Twitter for iPhone",140,,,,false,true,0,1,,,"","","","","","","","","","","","",,"","","en",,,,,,,,,,,,,,,,"1430578133741285383","Stefanski isn't ruling out rookie WR Anthony Schwartz being able to contribute early in the season.

Third-round rookie has missed chunks of camp with a hamstring injury.","2021-08-25 17:09:40","Twitter Web App",26,1,"192729852","Andrew_Gribble","Andrew Gribble",29078,940,32466,"Cleveland is the city","Senior Manager, Digital Media for @Browns | Cleveland native | Ohio U grad | Seasoned and married in the SEC | Two baby girls run the show",true,,,,,,,"","","","https://twitter.com/32BeatWriters/status/1430578291078012934","NFL Beat Writers","Training camp","We follow all 32 NFL teams' beat writers so you don't have to. Follow us to help win your fantasy football league. https://t.co/KK0FOJLbrr",,false,39672,755,1183,21619,1324,"2016-07-25 19:33:02",false,,,,"https://pbs.twimg.com/profile_banners/757659945487728640/1597874950",,"http://pbs.twimg.com/profile_images/1408078731051143171/SrpTaIsQ_normal.jpg"
"757659945487728640","1430573913046757379","2021-08-25 16:52:54","32BeatWriters","Broncos named Teddy Bridgewater their starting QB.","Twitter for iPhone",68,,,,false,true,0,2643,,,"","","","","","","","","","","","",,"","","en",,,,,,,,,,,,,,,,"1430573859917516803","Broncos named Teddy Bridgewater their starting QB.","2021-08-25 16:52:41","Twitter for iPhone",31673,2643,"51263592","AdamSchefter","Adam Schefter",8498882,3441,55716,"New York","ESPN Senior NFL Insider. 
Interview & Podcast Requests: ESPNPR@espn.com
Host of the Adam Schefter Podcast
https://t.co/oz43ix5jZU",true,,,,,,,"","","","https://twitter.com/32BeatWriters/status/1430573913046757379","NFL Beat Writers","Training camp","We follow all 32 NFL teams' beat writers so you don't have to. Follow us to help win your fantasy football league. https://t.co/KK0FOJLbrr",,false,39672,755,1183,21619,1324,"2016-07-25 19:33:02",false,,,,"https://pbs.twimg.com/profile_banners/757659945487728640/1597874950",,"http://pbs.twimg.com/profile_images/1408078731051143171/SrpTaIsQ_normal.jpg"
"757659945487728640","1430573873192439809","2021-08-25 16:52:44","32BeatWriters","Coach Fangio informed our team this morning that Teddy Bridgewater will be the Broncos’ starting quarterback. https://t.co/ZU0hNCi0kg","Twitter for iPhone",140,,,,false,true,0,1233,,,"","","","","","","","","","","","",,"","","en",,,,,,,,,,,,,,,,"1430573590806728704","Coach Fangio informed our team this morning that Teddy Bridgewater will be the Broncos’ starting quarterback. https://t.co/ZU0hNCi0kg","2021-08-25 16:51:37","Buffer",8691,1233,"18734310","Broncos","Denver Broncos",2634528,5762,66836,"Denver, CO","Twitter home of the three-time Super Bowl champions: XXXII, XXXIII and #SB50",true,,,,,,,"","","","https://twitter.com/32BeatWriters/status/1430573873192439809","NFL Beat Writers","Training camp","We follow all 32 NFL teams' beat writers so you don't have to. Follow us to help win your fantasy football league. https://t.co/KK0FOJLbrr",,false,39672,755,1183,21619,1324,"2016-07-25 19:33:02",false,,,,"https://pbs.twimg.com/profile_banners/757659945487728640/1597874950",,"http://pbs.twimg.com/profile_images/1408078731051143171/SrpTaIsQ_normal.jpg"
"757659945487728640","1430572165292769280","2021-08-25 16:45:57","32BeatWriters","Adam Trautman is seeing a foot specialist tomorrow. So, timeline/opinions could change. Initial belief is that he is dealing with a 1-3 week injury. Some depth issues perhaps heading into the season with this and Vannett's injury, but nothing that should linger too long.","Twitter for iPhone",140,,,,false,true,0,65,,,"","","","","","","","","","","","",,"","","en",,,,,,,,,,,,,,,,"1430571688966688769","Adam Trautman is seeing a foot specialist tomorrow. So, timeline/opinions could change. Initial belief is that he is dealing with a 1-3 week injury. Some depth issues perhaps heading into the season with this and Vannett's injury, but nothing that should linger too long.","2021-08-25 16:44:04","Twitter Web App",361,65,"22101927","nick_underhill","Nick Underhill",47635,968,49301,"New Orleans","Cover the Saints at https://t.co/tA1PwV9Nqo @NOdotFootball • Saints analyst at @WWLTV • Podcast: https://t.co/StF2JZRCrG",true,,,,,,,"","","","https://twitter.com/32BeatWriters/status/1430572165292769280","NFL Beat Writers","Training camp","We follow all 32 NFL teams' beat writers so you don't have to. Follow us to help win your fantasy football league. https://t.co/KK0FOJLbrr",,false,39672,755,1183,21619,1324,"2016-07-25 19:33:02",false,,,,"https://pbs.twimg.com/profile_banners/757659945487728640/1597874950",,"http://pbs.twimg.com/profile_images/1408078731051143171/SrpTaIsQ_normal.jpg"
"757659945487728640","1430571973776642055","2021-08-25 16:45:11","32BeatWriters","Malcolm Brown finds some daylight on a pair of runs with the Brissett-led offense. First one was a big gap, second was a nice patient run in behind Eichenberg.","Twitter for iPhone",139,,,,false,true,0,5,,,"","","","","","","","","","","","",,"","","en",,,,,,,,,,,,,,,,"1430571802690998275","Malcolm Brown finds some daylight on a pair of runs with the Brissett-led offense. First one was a big gap, second was a nice patient run in behind Eichenberg.","2021-08-25 16:44:31","Twitter Web App",73,5,"763497955936444416","WingfieldNFL","Travis Wingfield",29255,660,66804,"Miami, FL","Host of the Drive Time Podcast, part of the @MiamiDolphins Podcast Network. Writer https://t.co/4zmBWubD1q, PNW ✈️ MIA, Washington State University alum",true,,,,,,,"","","","https://twitter.com/32BeatWriters/status/1430571973776642055","NFL Beat Writers","Training camp","We follow all 32 NFL teams' beat writers so you don't have to. Follow us to help win your fantasy football league. https://t.co/KK0FOJLbrr",,false,39672,755,1183,21619,1324,"2016-07-25 19:33:02",false,,,,"https://pbs.twimg.com/profile_banners/757659945487728640/1597874950",,"http://pbs.twimg.com/profile_images/1408078731051143171/SrpTaIsQ_normal.jpg"
